{"componentChunkName":"component---src-templates-docs-docs-template-jsx","path":"/docs/22/03/2020/contribute-blog-post","result":{"data":{"mdx":{"id":"a9d942dc-8d84-56c0-9ed7-744ef1d87843","body":"var _excluded = [\"components\"];\n\nfunction _extends() { _extends = Object.assign || function (target) { for (var i = 1; i < arguments.length; i++) { var source = arguments[i]; for (var key in source) { if (Object.prototype.hasOwnProperty.call(source, key)) { target[key] = source[key]; } } } return target; }; return _extends.apply(this, arguments); }\n\nfunction _objectWithoutProperties(source, excluded) { if (source == null) return {}; var target = _objectWithoutPropertiesLoose(source, excluded); var key, i; if (Object.getOwnPropertySymbols) { var sourceSymbolKeys = Object.getOwnPropertySymbols(source); for (i = 0; i < sourceSymbolKeys.length; i++) { key = sourceSymbolKeys[i]; if (excluded.indexOf(key) >= 0) continue; if (!Object.prototype.propertyIsEnumerable.call(source, key)) continue; target[key] = source[key]; } } return target; }\n\nfunction _objectWithoutPropertiesLoose(source, excluded) { if (source == null) return {}; var target = {}; var sourceKeys = Object.keys(source); var key, i; for (i = 0; i < sourceKeys.length; i++) { key = sourceKeys[i]; if (excluded.indexOf(key) >= 0) continue; target[key] = source[key]; } return target; }\n\n/* @jsxRuntime classic */\n\n/* @jsx mdx */\nvar _frontmatter = {\n  \"type\": \"docs\",\n  \"author\": [\"Yu Liang Weng\"],\n  \"title\": \"Contribute blog posts\",\n  \"thumbnail\": \"./temp.jpg\",\n  \"description\": \"(UPDATED on 21 Apr 2021) This article will guide you to setup a development environment, relevant steps for produce a blog post, and introduce you to useful syntax for styling the blog post and adding resources such as images, videos, and codes.\",\n  \"date\": \"2020-03-22\",\n  \"template\": null,\n  \"featured\": false,\n  \"published\": true,\n  \"disableTOC\": false,\n  \"d3\": [\"https://unpkg.com/topojson@3\", \"dataviz.js\"]\n};\n\nvar makeShortcode = function makeShortcode(name) {\n  return function MDXDefaultShortcode(props) {\n    console.warn(\"Component \" + name + \" was not imported, exported, or provided by MDXProvider as global scope\");\n    return mdx(\"div\", props);\n  };\n};\n\nvar Accordion = makeShortcode(\"Accordion\");\nvar AccordionItem = makeShortcode(\"AccordionItem\");\nvar AccordionItemHeading = makeShortcode(\"AccordionItemHeading\");\nvar AccordionItemButton = makeShortcode(\"AccordionItemButton\");\nvar AccordionItemPanel = makeShortcode(\"AccordionItemPanel\");\nvar layoutProps = {\n  _frontmatter: _frontmatter\n};\nvar MDXLayout = \"wrapper\";\nreturn function MDXContent(_ref) {\n  var components = _ref.components,\n      props = _objectWithoutProperties(_ref, _excluded);\n\n  return mdx(MDXLayout, _extends({}, layoutProps, props, {\n    components: components,\n    mdxType: \"MDXLayout\"\n  }), mdx(\"h1\", {\n    \"id\": \"introduction\",\n    \"style\": {\n      \"position\": \"relative\"\n    }\n  }, mdx(\"a\", {\n    parentName: \"h1\",\n    \"href\": \"#introduction\",\n    \"aria-label\": \"introduction permalink\",\n    \"className\": \"anchor before\"\n  }, mdx(\"undefined\", {\n    parentName: \"a\"\n  })), \"Introduction\"), mdx(\"p\", null, \"(UPDATED on 21 Apr 2021) This is a template for blog posts. This website is built from \", mdx(\"a\", {\n    href: \"https://www.gatsbyjs.org/\"\n  }, \"Gatsby\"), \" framework and the way of styling is slightly different from HTML/CSS.\\nYou can write posts use \", mdx(\"a\", {\n    href: \"https://www.markdownguide.org/basic-syntax/\"\n  }, \"markdown\"), \" or/and HTML/CSS. A copy of this blog file is available \", mdx(\"a\", {\n    href: \"/dc71c720e0841c4f3116c669f96dd648/index.mdx\"\n  }, \"here\"), \".\", mdx(\"br\", {\n    parentName: \"p\"\n  }), \"\\n\", \"This article will guide you to setup a development environment, relevant steps for produce a blog post, and introduce\\nyou to useful syntax for styling the blog post and adding resources such as images, videos, and codes.\\nYou can also use Google Docs to write a post then \", mdx(\"a\", {\n    parentName: \"p\",\n    \"href\": \"mailto:rdm@sheffield.ac.uk\"\n  }, \"share\"), \" the link with us, we will take care of uploading for you. However, you'll also need to specify\\n\", mdx(\"strong\", {\n    parentName: \"p\"\n  }, \"header\"), \" section in your post as shown in step 2 of \", mdx(\"a\", {\n    href: \"#write-a-post\",\n    anchor: true\n  }, \"write a post\"), \" section.\"), mdx(\"p\", null, mdx(\"em\", {\n    parentName: \"p\"\n  }, \"We're working on improving the process!\")), mdx(\"h1\", {\n    \"id\": \"setup\",\n    \"style\": {\n      \"position\": \"relative\"\n    }\n  }, mdx(\"a\", {\n    parentName: \"h1\",\n    \"href\": \"#setup\",\n    \"aria-label\": \"setup permalink\",\n    \"className\": \"anchor before\"\n  }, mdx(\"undefined\", {\n    parentName: \"a\"\n  })), \"Setup\"), mdx(\"p\", null, \"You probably want to install Gatsby so that you can test your contribution before submitting it.\\nTo do this you'll need to setup a gatsby development environment in order to preview the website. Otherwise, go to \", mdx(\"a\", {\n    href: \"#write-a-post\",\n    anchor: true\n  }, \"write a post\"), \" section.\"), mdx(\"h2\", {\n    \"id\": \"installation\",\n    \"style\": {\n      \"position\": \"relative\"\n    }\n  }, mdx(\"a\", {\n    parentName: \"h2\",\n    \"href\": \"#installation\",\n    \"aria-label\": \"installation permalink\",\n    \"className\": \"anchor before\"\n  }, mdx(\"undefined\", {\n    parentName: \"a\"\n  })), \"Installation\"), mdx(\"ol\", null, mdx(\"li\", {\n    parentName: \"ol\"\n  }, mdx(\"p\", {\n    parentName: \"li\"\n  }, \"For Windows users, Download and install the latest Node.js version from \", mdx(\"a\", {\n    href: \"https://nodejs.org/en/\"\n  }, \"the official Node.js website\"), \".\\nFor other OS visit \", mdx(\"a\", {\n    href: \"https://www.gatsbyjs.org/tutorial/part-zero/#install-nodejs-for-your-appropriate-operating-system\"\n  }, \"here\"), \". (You might also need to download Visual Studio installer to install node.js development tools).\")), mdx(\"li\", {\n    parentName: \"ol\"\n  }, mdx(\"p\", {\n    parentName: \"li\"\n  }, \"Install \", mdx(\"a\", {\n    href: \"https://gitforwindows.org/\"\n  }, \"Git\"), \".\")), mdx(\"li\", {\n    parentName: \"ol\"\n  }, mdx(\"p\", {\n    parentName: \"li\"\n  }, \"Install Gatsby CLI by running \", mdx(\"code\", {\n    parentName: \"p\",\n    \"className\": \"language-text\"\n  }, \"npm install -g gatsby-cli\"))), mdx(\"li\", {\n    parentName: \"ol\"\n  }, mdx(\"p\", {\n    parentName: \"li\"\n  }, \"Fork this \", mdx(\"a\", {\n    parentName: \"p\",\n    \"href\": \"https://github.com/researchdata-sheffield/dataviz-hub2\"\n  }, \"repository\"), \" and open up your Git Bash/terminal (and navigate to a directory you want to place the site) and run:\"))), mdx(\"div\", {\n    \"className\": \"gatsby-highlight\",\n    \"data-language\": \"bash\"\n  }, mdx(\"pre\", {\n    parentName: \"div\",\n    \"style\": {\n      \"counterReset\": \"linenumber NaN\"\n    },\n    \"className\": \"language-bash line-numbers\"\n  }, mdx(\"code\", {\n    parentName: \"pre\",\n    \"className\": \"language-bash\"\n  }, mdx(\"span\", {\n    parentName: \"code\",\n    \"className\": \"token function\"\n  }, \"git\"), \" clone https://github.com/yourusername/dataviz-hub2.git\\n\", mdx(\"span\", {\n    parentName: \"code\",\n    \"className\": \"token builtin class-name\"\n  }, \"cd\"), \" dataviz-hub2\\n\", mdx(\"span\", {\n    parentName: \"code\",\n    \"className\": \"token function\"\n  }, \"npm\"), \" \", mdx(\"span\", {\n    parentName: \"code\",\n    \"className\": \"token function\"\n  }, \"install\"), \"      \", mdx(\"span\", {\n    parentName: \"code\",\n    \"className\": \"token comment\"\n  }, \"# install dependencies\")), mdx(\"span\", {\n    parentName: \"pre\",\n    \"aria-hidden\": \"true\",\n    \"className\": \"line-numbers-rows\",\n    \"style\": {\n      \"whiteSpace\": \"normal\",\n      \"width\": \"auto\",\n      \"left\": \"0\"\n    }\n  }, mdx(\"span\", {\n    parentName: \"span\"\n  }), mdx(\"span\", {\n    parentName: \"span\"\n  }), mdx(\"span\", {\n    parentName: \"span\"\n  })))), mdx(\"ol\", {\n    \"start\": 5\n  }, mdx(\"li\", {\n    parentName: \"ol\"\n  }, \"Run \", mdx(\"code\", {\n    parentName: \"li\",\n    \"className\": \"language-text\"\n  }, \"gatsby develop\"), \". Now you can view the site at \", mdx(\"strong\", {\n    parentName: \"li\"\n  }, \"http://localhost:8000/\"), \". Any changes you made to posts locally will be updated instantly on preview. Press \", mdx(\"code\", {\n    parentName: \"li\",\n    \"className\": \"language-text\"\n  }, \"Ctrl + C\"), \" if you want to stop the server running locally.\\nIf you're happy with your changes, you could also run \", mdx(\"code\", {\n    parentName: \"li\",\n    \"className\": \"language-text\"\n  }, \"npm run serve\"), \" to make a production build and check everything is identical to the development version at \", mdx(\"strong\", {\n    parentName: \"li\"\n  }, \"http://localhost:9000/\"), \".\")), mdx(\"div\", {\n    \"className\": \"gatsby-highlight\",\n    \"data-language\": \"text\"\n  }, mdx(\"pre\", {\n    parentName: \"div\",\n    \"style\": {\n      \"counterReset\": \"linenumber NaN\"\n    },\n    \"className\": \"language-text line-numbers\"\n  }, mdx(\"code\", {\n    parentName: \"pre\",\n    \"className\": \"language-text\"\n  }, \"If you have cloned the repository a while a ago,\\nfetch the latest commits from origin repository:\\n\\ngit checkout development\\ngit pull upstream development\"), mdx(\"span\", {\n    parentName: \"pre\",\n    \"aria-hidden\": \"true\",\n    \"className\": \"line-numbers-rows\",\n    \"style\": {\n      \"whiteSpace\": \"normal\",\n      \"width\": \"auto\",\n      \"left\": \"0\"\n    }\n  }, mdx(\"span\", {\n    parentName: \"span\"\n  }), mdx(\"span\", {\n    parentName: \"span\"\n  }), mdx(\"span\", {\n    parentName: \"span\"\n  }), mdx(\"span\", {\n    parentName: \"span\"\n  }), mdx(\"span\", {\n    parentName: \"span\"\n  })))), mdx(\"h1\", {\n    \"id\": \"write-a-post\",\n    \"style\": {\n      \"position\": \"relative\"\n    }\n  }, mdx(\"a\", {\n    parentName: \"h1\",\n    \"href\": \"#write-a-post\",\n    \"aria-label\": \"write a post permalink\",\n    \"className\": \"anchor before\"\n  }, mdx(\"undefined\", {\n    parentName: \"a\"\n  })), \"Write a post\"), mdx(\"p\", null, \"If you didn't setup, skip the following text and look at \", mdx(\"a\", {\n    anchor: true,\n    href: \"#write-post\"\n  }, \"steps for writing a post\"), \".\"), mdx(\"p\", null, \"Once you've setup, run \", mdx(\"code\", {\n    parentName: \"p\",\n    \"className\": \"language-text\"\n  }, \"gatsby develop\"), \".\\nNow you can view the site at \", mdx(\"strong\", {\n    parentName: \"p\"\n  }, \"http://localhost:8000/\"), \". The website will be reloaded automatically on changes. Press \", mdx(\"code\", {\n    parentName: \"p\",\n    \"className\": \"language-text\"\n  }, \"Ctrl + C\"), \" if you want to stop the server running locally.\\nIf you're happy with your post, you could also run \", mdx(\"code\", {\n    parentName: \"p\",\n    \"className\": \"language-text\"\n  }, \"npm run serve\"), \" to make a production build and check everything is identical to the development version at \", mdx(\"strong\", {\n    parentName: \"p\"\n  }, \"http://localhost:9000/\"), \".\"), mdx(\"p\", null, \"Steps on below assumed you've setup everything mentioned above.\"), mdx(\"div\", {\n    id: \"write-post\"\n  }), mdx(\"ol\", null, mdx(\"li\", {\n    parentName: \"ol\"\n  }, \"Make a new directory under the \", mdx(\"code\", {\n    parentName: \"li\",\n    \"className\": \"language-text\"\n  }, \"/content/blog/\"), \" directory, make sure the directory name is of the format \", mdx(\"code\", {\n    parentName: \"li\",\n    \"className\": \"language-text\"\n  }, \"2020-06-12-my-blog-title\"), \" (a YYYY-MM-DD date followed by some text). If you didn't setup, create the directory anywhere you wish to.\")), mdx(\"hr\", null), mdx(\"ol\", {\n    \"start\": 2\n  }, mdx(\"li\", {\n    parentName: \"ol\"\n  }, mdx(\"p\", {\n    parentName: \"li\"\n  }, \"Create a file \", mdx(\"code\", {\n    parentName: \"p\",\n    \"className\": \"language-text\"\n  }, \"index.mdx\"), \" (or with .md extension, but we recommend use .mdx because it\\u2019s a superset of Markdown syntax that also supports importing, exporting, and JSX. \", mdx(\"a\", {\n    href: \"https://mdxjs.com/\"\n  }, \"learn more about mdx\"), \").\"), mdx(\"ul\", {\n    parentName: \"li\"\n  }, mdx(\"li\", {\n    parentName: \"ul\"\n  }, \"At the very beginning of your index file, you have the following properties to specify in the \", mdx(\"strong\", {\n    parentName: \"li\"\n  }, \"header\"), \":\")))), mdx(\"div\", {\n    \"className\": \"gatsby-highlight\",\n    \"data-language\": \"markdown\"\n  }, mdx(\"pre\", {\n    parentName: \"div\",\n    \"style\": {\n      \"counterReset\": \"linenumber NaN\"\n    },\n    \"className\": \"language-markdown line-numbers\"\n  }, mdx(\"code\", {\n    parentName: \"pre\",\n    \"className\": \"language-markdown\"\n  }, mdx(\"span\", {\n    parentName: \"code\",\n    \"className\": \"token front-matter-block\"\n  }, mdx(\"span\", {\n    parentName: \"span\",\n    \"className\": \"token punctuation\"\n  }, \"---\"), \"\\n\", mdx(\"span\", {\n    parentName: \"span\",\n    \"className\": \"token front-matter yaml language-yaml\"\n  }, \"title: \\\"This is a template for posts\\\"\\nauthor: [\\\"A\\\", \\\"B\\\"]\\ndate: \\\"2020-03-06\\\" # please use Y-M-D format required by mdx syntax, if the post belongs to \\\"Events\\\" category, then probably use the event date rather than the written date\\ndescription: \\\"Shown at blog page\\\"\\ncategory: \\\"Articles\\\" # use pre-set categories: \\\"Articles\\\", \\\"News\\\", \\\"Tutorials\\\", \\\"Events\\\"\\ntag: [\\\"SomeTag\\\", \\\"AnotherOne\\\"] # make sure tags & cate are capitalised\\nthumbnail: ./image.jpg # an image to use for your post's thumbnail\\ntemplate: # optional, if set to \\\"custom\\\", you would need to design your own post page except from header and footer of the website.\\nfeatured: true # optional, Set it to true if you want to show the post on home page\\ndisableTOC: false # optional, set it to true if you wish to disable the default Table of Contents\\nd3: [\\\"file1.js\\\", \\\"file2.js\\\"] # optional, use to include your d3 documents\"), \"\\n\", mdx(\"span\", {\n    parentName: \"span\",\n    \"className\": \"token punctuation\"\n  }, \"---\"))), mdx(\"span\", {\n    parentName: \"pre\",\n    \"aria-hidden\": \"true\",\n    \"className\": \"line-numbers-rows\",\n    \"style\": {\n      \"whiteSpace\": \"normal\",\n      \"width\": \"auto\",\n      \"left\": \"0\"\n    }\n  }, mdx(\"span\", {\n    parentName: \"span\"\n  }), mdx(\"span\", {\n    parentName: \"span\"\n  }), mdx(\"span\", {\n    parentName: \"span\"\n  }), mdx(\"span\", {\n    parentName: \"span\"\n  }), mdx(\"span\", {\n    parentName: \"span\"\n  }), mdx(\"span\", {\n    parentName: \"span\"\n  }), mdx(\"span\", {\n    parentName: \"span\"\n  }), mdx(\"span\", {\n    parentName: \"span\"\n  }), mdx(\"span\", {\n    parentName: \"span\"\n  }), mdx(\"span\", {\n    parentName: \"span\"\n  }), mdx(\"span\", {\n    parentName: \"span\"\n  }), mdx(\"span\", {\n    parentName: \"span\"\n  }), mdx(\"span\", {\n    parentName: \"span\"\n  })))), mdx(\"ul\", null, mdx(\"li\", {\n    parentName: \"ul\"\n  }, mdx(\"p\", {\n    parentName: \"li\"\n  }, \"Wrap properties with triple hyphens. Use double quotation marks for all text, use square brackets in properties with two or more items.\")), mdx(\"li\", {\n    parentName: \"ul\"\n  }, mdx(\"p\", {\n    parentName: \"li\"\n  }, \"Then add content to the file, read \", mdx(\"a\", {\n    href: \"#table-of-content\",\n    anchor: true\n  }, \"next section\"), \" and beyond to know more about how to style your post.\")), mdx(\"li\", {\n    parentName: \"ul\"\n  }, mdx(\"p\", {\n    parentName: \"li\"\n  }, \"(\", mdx(\"strong\", {\n    parentName: \"p\"\n  }, \"Compulsory\"), \" for your first post): On first time you're required to add your name and avatar to the file \", mdx(\"strong\", {\n    parentName: \"p\"\n  }, \"author.json\"), \" located at \", mdx(\"code\", {\n    parentName: \"p\",\n    \"className\": \"language-text\"\n  }, \"dataviz-hub2/src/data\"), \", otherwise author info will not be shown on the post (and the website produce errors).\\nFormat:\"))), mdx(\"div\", {\n    \"className\": \"gatsby-highlight\",\n    \"data-language\": \"json\"\n  }, mdx(\"pre\", {\n    parentName: \"div\",\n    \"style\": {\n      \"counterReset\": \"linenumber NaN\"\n    },\n    \"className\": \"language-json line-numbers\"\n  }, mdx(\"code\", {\n    parentName: \"pre\",\n    \"className\": \"language-json\"\n  }, \"...\\n\", mdx(\"span\", {\n    parentName: \"code\",\n    \"className\": \"token punctuation\"\n  }, \"}\"), mdx(\"span\", {\n    parentName: \"code\",\n    \"className\": \"token punctuation\"\n  }, \",\"), \"                              \", mdx(\"span\", {\n    parentName: \"code\",\n    \"className\": \"token comment\"\n  }, \"// Make sure you've added comma after the previous right curly bracket\"), \"\\n\", mdx(\"span\", {\n    parentName: \"code\",\n    \"className\": \"token punctuation\"\n  }, \"{\"), \"                               \", mdx(\"span\", {\n    parentName: \"code\",\n    \"className\": \"token comment\"\n  }, \"// Start with left curly bracket\"), \"\\n  \", mdx(\"span\", {\n    parentName: \"code\",\n    \"className\": \"token property\"\n  }, \"\\\"name\\\"\"), mdx(\"span\", {\n    parentName: \"code\",\n    \"className\": \"token operator\"\n  }, \":\"), \" \", mdx(\"span\", {\n    parentName: \"code\",\n    \"className\": \"token string\"\n  }, \"\\\"New Author\\\"\"), mdx(\"span\", {\n    parentName: \"code\",\n    \"className\": \"token punctuation\"\n  }, \",\"), \"         \", mdx(\"span\", {\n    parentName: \"code\",\n    \"className\": \"token comment\"\n  }, \"// The exact same name you've put in mdx file, use same name for all mdx file consistently\"), \"\\n  \", mdx(\"span\", {\n    parentName: \"code\",\n    \"className\": \"token property\"\n  }, \"\\\"avatar\\\"\"), mdx(\"span\", {\n    parentName: \"code\",\n    \"className\": \"token operator\"\n  }, \":\"), \" \", mdx(\"span\", {\n    parentName: \"code\",\n    \"className\": \"token string\"\n  }, \"\\\"../images/author/default.jpg\\\"\"), mdx(\"span\", {\n    parentName: \"code\",\n    \"className\": \"token punctuation\"\n  }, \",\"), \"    \", mdx(\"span\", {\n    parentName: \"code\",\n    \"className\": \"token comment\"\n  }, \"// If you want to add your own avatar, place it under the /src/images/author folder and replace default.jpg with your image name and extension\"), \"\\n\", mdx(\"span\", {\n    parentName: \"code\",\n    \"className\": \"token punctuation\"\n  }, \"}\"), \"                               \", mdx(\"span\", {\n    parentName: \"code\",\n    \"className\": \"token comment\"\n  }, \"// No comma\")), mdx(\"span\", {\n    parentName: \"pre\",\n    \"aria-hidden\": \"true\",\n    \"className\": \"line-numbers-rows\",\n    \"style\": {\n      \"whiteSpace\": \"normal\",\n      \"width\": \"auto\",\n      \"left\": \"0\"\n    }\n  }, mdx(\"span\", {\n    parentName: \"span\"\n  }), mdx(\"span\", {\n    parentName: \"span\"\n  }), mdx(\"span\", {\n    parentName: \"span\"\n  }), mdx(\"span\", {\n    parentName: \"span\"\n  }), mdx(\"span\", {\n    parentName: \"span\"\n  }), mdx(\"span\", {\n    parentName: \"span\"\n  })))), mdx(\"hr\", null), mdx(\"ol\", {\n    \"start\": 3\n  }, mdx(\"li\", {\n    parentName: \"ol\"\n  }, mdx(\"p\", {\n    parentName: \"li\"\n  }, \"Copy any other resources required for the post to the current directory. For example, if you want to include an image \", mdx(\"code\", {\n    parentName: \"p\",\n    \"className\": \"language-text\"\n  }, \"post.jpg\"), \" then the file path for it would be \", mdx(\"strong\", {\n    parentName: \"p\"\n  }, \"/content/blog/yourdirname/post.jpg\"), \". Sections\\nbelow will tell you how to embed \", mdx(\"a\", {\n    href: \"#image\",\n    anchor: true\n  }, \"images\"), \" and \", mdx(\"a\", {\n    href: \"#embed-well-known-services\",\n    anchor: true\n  }, \"videos\"), \".\")), mdx(\"li\", {\n    parentName: \"ol\"\n  }, mdx(\"p\", {\n    parentName: \"li\"\n  }, \"Commit any changes you've made. If you didn't setup, see \", mdx(\"strong\", {\n    parentName: \"p\"\n  }, mdx(\"a\", {\n    href: \"#upload-via-githubcom\",\n    anchor: true\n  }, \"Upload via github.com\")), \" section.\")), mdx(\"li\", {\n    parentName: \"ol\"\n  }, mdx(\"p\", {\n    parentName: \"li\"\n  }, \"Now create a pull request. If it comes from a fork repository, \", mdx(\"a\", {\n    parentName: \"p\",\n    \"href\": \"https://help.github.com/en/github/collaborating-with-issues-and-pull-requests/creating-a-pull-request-from-a-fork\"\n  }, \"read here\"), \".\\nIf it comes from a branch in origin repository, \", mdx(\"a\", {\n    parentName: \"p\",\n    \"href\": \"https://help.github.com/en/github/collaborating-with-issues-and-pull-requests/creating-a-pull-request#changing-the-branch-range-and-destination-repository\"\n  }, \"read here\"), \".\"))), mdx(\"h2\", {\n    \"id\": \"upload-via-githubcom\",\n    \"style\": {\n      \"position\": \"relative\"\n    }\n  }, mdx(\"a\", {\n    parentName: \"h2\",\n    \"href\": \"#upload-via-githubcom\",\n    \"aria-label\": \"upload via githubcom permalink\",\n    \"className\": \"anchor before\"\n  }, mdx(\"undefined\", {\n    parentName: \"a\"\n  })), \"Upload via github.com\"), mdx(\"p\", null, \"If you do not want to setup the environment, you can write a post by upload \", mdx(\"strong\", {\n    parentName: \"p\"\n  }, \"index.mdx\"), \" file and any resources related to the post on Github too. To do this,\"), mdx(\"ol\", null, mdx(\"li\", {\n    parentName: \"ol\"\n  }, mdx(\"p\", {\n    parentName: \"li\"\n  }, \"Go to \", mdx(\"a\", {\n    parentName: \"p\",\n    \"href\": \"https://github.com/researchdata-sheffield/dataviz-hub2\"\n  }, \"repository\"), \" and click on content/blog directory.\")), mdx(\"li\", {\n    parentName: \"ol\"\n  }, mdx(\"p\", {\n    parentName: \"li\"\n  }, \"Click the \", mdx(\"em\", {\n    parentName: \"p\"\n  }, \"Create new file\"), \" button on the top right, and type \", mdx(\"code\", {\n    parentName: \"p\",\n    \"className\": \"language-text\"\n  }, \"folder-name/index.mdx\"), \" in the \", mdx(\"strong\", {\n    parentName: \"p\"\n  }, \"name your file...\"), \" box, this will create a new directory with the name - \", mdx(\"code\", {\n    parentName: \"p\",\n    \"className\": \"language-text\"\n  }, \"folder-name\"), \"\\nof your choice (make sure this name is not exists).\")), mdx(\"li\", {\n    parentName: \"ol\"\n  }, mdx(\"p\", {\n    parentName: \"li\"\n  }, \"Copy contents of your local \", mdx(\"strong\", {\n    parentName: \"p\"\n  }, \"index.mdx\"), \" file into the box below. Fill in all the details under the \", mdx(\"strong\", {\n    parentName: \"p\"\n  }, \"Propose new file\"), \" section and submit. Now Github has already forked the project for you and you're on the \", mdx(\"strong\", {\n    parentName: \"p\"\n  }, \"Comparing changes\"), \" page.\")), mdx(\"li\", {\n    parentName: \"ol\"\n  }, mdx(\"p\", {\n    parentName: \"li\"\n  }, \"If you don't have any other files (images etc.) to upload, click on \", mdx(\"strong\", {\n    parentName: \"p\"\n  }, \"Create pull request\"), \" button, complete the form and submit (and you're done). Otherwise ignore this and go to your own \", mdx(\"em\", {\n    parentName: \"p\"\n  }, \"dataviz-hub2\"), \" repository.\")), mdx(\"li\", {\n    parentName: \"ol\"\n  }, mdx(\"p\", {\n    parentName: \"li\"\n  }, \"Once you're in forked repository page, you'll see github has created a new branch \", mdx(\"em\", {\n    parentName: \"p\"\n  }, \"patch-1\"), \" for you. Select this branch and go to the directory you've created e.g. \", mdx(\"strong\", {\n    parentName: \"p\"\n  }, \"content/blog/folder-name/\"), \".\")), mdx(\"li\", {\n    parentName: \"ol\"\n  }, mdx(\"p\", {\n    parentName: \"li\"\n  }, \"Upload all neccessary files and commit directly to the \", mdx(\"em\", {\n    parentName: \"p\"\n  }, \"patch-1\"), \" branch. Once this was done, go to \", mdx(\"em\", {\n    parentName: \"p\"\n  }, mdx(\"a\", {\n    parentName: \"em\",\n    \"href\": \"https://github.com/researchdata-sheffield/dataviz-hub2\"\n  }, \"https://github.com/researchdata-sheffield/dataviz-hub2\")), \" and click on \", mdx(\"strong\", {\n    parentName: \"p\"\n  }, \"Compare & pull request\"), \", complete the form and submit.\"))), mdx(\"h1\", {\n    \"id\": \"table-of-content\",\n    \"style\": {\n      \"position\": \"relative\"\n    }\n  }, mdx(\"a\", {\n    parentName: \"h1\",\n    \"href\": \"#table-of-content\",\n    \"aria-label\": \"table of content permalink\",\n    \"className\": \"anchor before\"\n  }, mdx(\"undefined\", {\n    parentName: \"a\"\n  })), \"Table of content\"), mdx(\"p\", null, \"If you have created headings using markdown syntax like below:\"), mdx(\"div\", {\n    \"className\": \"gatsby-highlight\",\n    \"data-language\": \"text\"\n  }, mdx(\"pre\", {\n    parentName: \"div\",\n    \"style\": {\n      \"counterReset\": \"linenumber NaN\"\n    },\n    \"className\": \"language-text line-numbers\"\n  }, mdx(\"code\", {\n    parentName: \"pre\",\n    \"className\": \"language-text\"\n  }, \"# table of content\\nWrite something\\n\\n## Subtitle\\n...\\n\\n# Another Title\\n...\\n\\n## Another Title - subtitle\\n...\"), mdx(\"span\", {\n    parentName: \"pre\",\n    \"aria-hidden\": \"true\",\n    \"className\": \"line-numbers-rows\",\n    \"style\": {\n      \"whiteSpace\": \"normal\",\n      \"width\": \"auto\",\n      \"left\": \"0\"\n    }\n  }, mdx(\"span\", {\n    parentName: \"span\"\n  }), mdx(\"span\", {\n    parentName: \"span\"\n  }), mdx(\"span\", {\n    parentName: \"span\"\n  }), mdx(\"span\", {\n    parentName: \"span\"\n  }), mdx(\"span\", {\n    parentName: \"span\"\n  }), mdx(\"span\", {\n    parentName: \"span\"\n  }), mdx(\"span\", {\n    parentName: \"span\"\n  }), mdx(\"span\", {\n    parentName: \"span\"\n  }), mdx(\"span\", {\n    parentName: \"span\"\n  }), mdx(\"span\", {\n    parentName: \"span\"\n  }), mdx(\"span\", {\n    parentName: \"span\"\n  })))), mdx(\"p\", null, \"then this website will automatically create a table of content list for you on the right hand side of the post.\", mdx(\"br\", {\n    parentName: \"p\"\n  }), \"\\n\", \"If you would like to disable the table of content, simply insert the following line in the header section:\"), mdx(\"div\", {\n    \"className\": \"gatsby-highlight\",\n    \"data-language\": \"md\"\n  }, mdx(\"pre\", {\n    parentName: \"div\",\n    \"style\": {\n      \"counterReset\": \"linenumber NaN\"\n    },\n    \"className\": \"language-md line-numbers\"\n  }, mdx(\"code\", {\n    parentName: \"pre\",\n    \"className\": \"language-md\"\n  }, \"disableTOC: true\"), mdx(\"span\", {\n    parentName: \"pre\",\n    \"aria-hidden\": \"true\",\n    \"className\": \"line-numbers-rows\",\n    \"style\": {\n      \"whiteSpace\": \"normal\",\n      \"width\": \"auto\",\n      \"left\": \"0\"\n    }\n  }, mdx(\"span\", {\n    parentName: \"span\"\n  })))), mdx(\"h1\", {\n    \"id\": \"styling\",\n    \"style\": {\n      \"position\": \"relative\"\n    }\n  }, mdx(\"a\", {\n    parentName: \"h1\",\n    \"href\": \"#styling\",\n    \"aria-label\": \"styling permalink\",\n    \"className\": \"anchor before\"\n  }, mdx(\"undefined\", {\n    parentName: \"a\"\n  })), \"Styling\"), mdx(\"p\", null, \"There are many ways to add styles to your md/mdx elements, in here we listed two methods to do this.\"), mdx(\"ol\", null, mdx(\"li\", {\n    parentName: \"ol\"\n  }, \"Use the style attribute as usual with slightly different syntax:\")), mdx(\"div\", {\n    \"className\": \"gatsby-highlight has-highlighted-lines\",\n    \"data-language\": \"html\"\n  }, mdx(\"pre\", {\n    parentName: \"div\",\n    \"style\": {\n      \"counterReset\": \"linenumber NaN\"\n    },\n    \"className\": \"language-html line-numbers\"\n  }, mdx(\"code\", {\n    parentName: \"pre\",\n    \"className\": \"language-html\"\n  }, \"In HTML we normally style a div tag like this:\\n\", mdx(\"span\", {\n    parentName: \"code\",\n    \"className\": \"token tag\"\n  }, mdx(\"span\", {\n    parentName: \"span\",\n    \"className\": \"token tag\"\n  }, mdx(\"span\", {\n    parentName: \"span\",\n    \"className\": \"token punctuation\"\n  }, \"<\"), \"div\"), \" \", mdx(\"span\", {\n    parentName: \"span\",\n    \"className\": \"token special-attr\"\n  }, mdx(\"span\", {\n    parentName: \"span\",\n    \"className\": \"token attr-name\"\n  }, \"style\"), mdx(\"span\", {\n    parentName: \"span\",\n    \"className\": \"token attr-value\"\n  }, mdx(\"span\", {\n    parentName: \"span\",\n    \"className\": \"token punctuation attr-equals\"\n  }, \"=\"), mdx(\"span\", {\n    parentName: \"span\",\n    \"className\": \"token punctuation\"\n  }, \"\\\"\"), mdx(\"span\", {\n    parentName: \"span\",\n    \"className\": \"token value css language-css\"\n  }, mdx(\"span\", {\n    parentName: \"span\",\n    \"className\": \"token property\"\n  }, \"font-size\"), mdx(\"span\", {\n    parentName: \"span\",\n    \"className\": \"token punctuation\"\n  }, \":\"), \" 25px\", mdx(\"span\", {\n    parentName: \"span\",\n    \"className\": \"token punctuation\"\n  }, \",\"), \" \", mdx(\"span\", {\n    parentName: \"span\",\n    \"className\": \"token property\"\n  }, \"display\"), mdx(\"span\", {\n    parentName: \"span\",\n    \"className\": \"token punctuation\"\n  }, \":\"), \" flex\"), mdx(\"span\", {\n    parentName: \"span\",\n    \"className\": \"token punctuation\"\n  }, \"\\\"\"))), mdx(\"span\", {\n    parentName: \"span\",\n    \"className\": \"token punctuation\"\n  }, \">\")), \"\\n  Write something\\n\", mdx(\"span\", {\n    parentName: \"code\",\n    \"className\": \"token tag\"\n  }, mdx(\"span\", {\n    parentName: \"span\",\n    \"className\": \"token tag\"\n  }, mdx(\"span\", {\n    parentName: \"span\",\n    \"className\": \"token punctuation\"\n  }, \"</\"), \"div\"), mdx(\"span\", {\n    parentName: \"span\",\n    \"className\": \"token punctuation\"\n  }, \">\")), \"\\n\\n-----------------------\\n\", mdx(\"span\", {\n    parentName: \"code\",\n    \"className\": \"gatsby-highlight-code-line\"\n  }, \"In Gatsby (and React) we transform it into:\"), mdx(\"span\", {\n    parentName: \"code\",\n    \"className\": \"gatsby-highlight-code-line\"\n  }, mdx(\"span\", {\n    parentName: \"span\",\n    \"className\": \"token tag\"\n  }, mdx(\"span\", {\n    parentName: \"span\",\n    \"className\": \"token tag\"\n  }, mdx(\"span\", {\n    parentName: \"span\",\n    \"className\": \"token punctuation\"\n  }, \"<\"), \"div\"), \" \", mdx(\"span\", {\n    parentName: \"span\",\n    \"className\": \"token special-attr\"\n  }, mdx(\"span\", {\n    parentName: \"span\",\n    \"className\": \"token attr-name\"\n  }, \"style\"), mdx(\"span\", {\n    parentName: \"span\",\n    \"className\": \"token attr-value\"\n  }, mdx(\"span\", {\n    parentName: \"span\",\n    \"className\": \"token punctuation attr-equals\"\n  }, \"=\"), mdx(\"span\", {\n    parentName: \"span\",\n    \"className\": \"token value css language-css\"\n  }, mdx(\"span\", {\n    parentName: \"span\",\n    \"className\": \"token punctuation\"\n  }, \"{\"), mdx(\"span\", {\n    parentName: \"span\",\n    \"className\": \"token punctuation\"\n  }, \"{\")))), \" \", mdx(\"span\", {\n    parentName: \"span\",\n    \"className\": \"token attr-name\"\n  }, mdx(\"span\", {\n    parentName: \"span\",\n    \"className\": \"token namespace\"\n  }, \"fontSize:\")), \" \", mdx(\"span\", {\n    parentName: \"span\",\n    \"className\": \"token attr-name\"\n  }, \"\\\"25px\\\",\"), \" \", mdx(\"span\", {\n    parentName: \"span\",\n    \"className\": \"token attr-name\"\n  }, mdx(\"span\", {\n    parentName: \"span\",\n    \"className\": \"token namespace\"\n  }, \"display:\")), \" \", mdx(\"span\", {\n    parentName: \"span\",\n    \"className\": \"token attr-name\"\n  }, \"\\\"flex\\\"\"), \" \", mdx(\"span\", {\n    parentName: \"span\",\n    \"className\": \"token attr-name\"\n  }, \"}}\"), mdx(\"span\", {\n    parentName: \"span\",\n    \"className\": \"token punctuation\"\n  }, \">\"))), mdx(\"span\", {\n    parentName: \"code\",\n    \"className\": \"gatsby-highlight-code-line\"\n  }, \"  Write something\"), mdx(\"span\", {\n    parentName: \"code\",\n    \"className\": \"gatsby-highlight-code-line\"\n  }, mdx(\"span\", {\n    parentName: \"span\",\n    \"className\": \"token tag\"\n  }, mdx(\"span\", {\n    parentName: \"span\",\n    \"className\": \"token tag\"\n  }, mdx(\"span\", {\n    parentName: \"span\",\n    \"className\": \"token punctuation\"\n  }, \"</\"), \"div\"), mdx(\"span\", {\n    parentName: \"span\",\n    \"className\": \"token punctuation\"\n  }, \">\"))), \"\\nFor any declaration in HTML with hyphen,\\nin Gatsby we remove the hyphen and capitalise the letter after the hyphen.\"), mdx(\"span\", {\n    parentName: \"pre\",\n    \"aria-hidden\": \"true\",\n    \"className\": \"line-numbers-rows\",\n    \"style\": {\n      \"whiteSpace\": \"normal\",\n      \"width\": \"auto\",\n      \"left\": \"0\"\n    }\n  }, mdx(\"span\", {\n    parentName: \"span\"\n  }), mdx(\"span\", {\n    parentName: \"span\"\n  }), mdx(\"span\", {\n    parentName: \"span\"\n  }), mdx(\"span\", {\n    parentName: \"span\"\n  }), mdx(\"span\", {\n    parentName: \"span\"\n  }), mdx(\"span\", {\n    parentName: \"span\"\n  }), mdx(\"span\", {\n    parentName: \"span\"\n  }), mdx(\"span\", {\n    parentName: \"span\"\n  }), mdx(\"span\", {\n    parentName: \"span\"\n  }), mdx(\"span\", {\n    parentName: \"span\"\n  }), mdx(\"span\", {\n    parentName: \"span\"\n  }), mdx(\"span\", {\n    parentName: \"span\"\n  }), mdx(\"span\", {\n    parentName: \"span\"\n  })))), mdx(\"ol\", {\n    \"start\": 2\n  }, mdx(\"li\", {\n    parentName: \"ol\"\n  }, \"This website has integrated \", mdx(\"b\", null, \"tailwindcss\"), \" framework therefore you can style elements by applying \", mdx(\"b\", null, \"pre-existing classes\"), \" directly in your HTML.\\nExplore \", mdx(\"a\", {\n    parentName: \"li\",\n    \"href\": \"https://tailwindcss.com/docs/width\"\n  }, \"tailwindCSS\"), \" to see available classes you can utilise.\")), mdx(\"div\", {\n    \"className\": \"gatsby-highlight\",\n    \"data-language\": \"html\"\n  }, mdx(\"pre\", {\n    parentName: \"div\",\n    \"style\": {\n      \"counterReset\": \"linenumber NaN\"\n    },\n    \"className\": \"language-html line-numbers\"\n  }, mdx(\"code\", {\n    parentName: \"pre\",\n    \"className\": \"language-html\"\n  }, \"// In Gatsby, class is replaced by className An example of using tailwindCSS\\n\\n\", mdx(\"span\", {\n    parentName: \"code\",\n    \"className\": \"token tag\"\n  }, mdx(\"span\", {\n    parentName: \"span\",\n    \"className\": \"token tag\"\n  }, mdx(\"span\", {\n    parentName: \"span\",\n    \"className\": \"token punctuation\"\n  }, \"<\"), \"p\"), \" \", mdx(\"span\", {\n    parentName: \"span\",\n    \"className\": \"token attr-name\"\n  }, \"className\"), mdx(\"span\", {\n    parentName: \"span\",\n    \"className\": \"token attr-value\"\n  }, mdx(\"span\", {\n    parentName: \"span\",\n    \"className\": \"token punctuation attr-equals\"\n  }, \"=\"), mdx(\"span\", {\n    parentName: \"span\",\n    \"className\": \"token punctuation\"\n  }, \"\\\"\"), \"text-3xl text-gray-500 mb-24\", mdx(\"span\", {\n    parentName: \"span\",\n    \"className\": \"token punctuation\"\n  }, \"\\\"\")), mdx(\"span\", {\n    parentName: \"span\",\n    \"className\": \"token punctuation\"\n  }, \">\")), \"TAILwindCSS\", mdx(\"span\", {\n    parentName: \"code\",\n    \"className\": \"token tag\"\n  }, mdx(\"span\", {\n    parentName: \"span\",\n    \"className\": \"token tag\"\n  }, mdx(\"span\", {\n    parentName: \"span\",\n    \"className\": \"token punctuation\"\n  }, \"</\"), \"p\"), mdx(\"span\", {\n    parentName: \"span\",\n    \"className\": \"token punctuation\"\n  }, \">\")), \"\\n\\ntext-3xl: text size with 3xl. text-gray-500: text color set to be gray with\\ntransparency of 500 (50% probably). mb-24: bottom margin with size 24.\"), mdx(\"span\", {\n    parentName: \"pre\",\n    \"aria-hidden\": \"true\",\n    \"className\": \"line-numbers-rows\",\n    \"style\": {\n      \"whiteSpace\": \"normal\",\n      \"width\": \"auto\",\n      \"left\": \"0\"\n    }\n  }, mdx(\"span\", {\n    parentName: \"span\"\n  }), mdx(\"span\", {\n    parentName: \"span\"\n  }), mdx(\"span\", {\n    parentName: \"span\"\n  }), mdx(\"span\", {\n    parentName: \"span\"\n  }), mdx(\"span\", {\n    parentName: \"span\"\n  }), mdx(\"span\", {\n    parentName: \"span\"\n  })))), mdx(\"p\", null, \"Output:\"), mdx(\"p\", {\n    className: \"text-3xl text-gray-500 mb-24\"\n  }, \"TAILwindCSS\"), \"Of course you can also add your own class, just need to make sure all classes you've created need to be place in the file `dataviz-hub2/src/css/post.scss` (as the file extension shown, the website supports scss styling). Specificity is important, to avoid your classes being override by other styling plugins, add `body` before each class. Otherwise, use style attribute.\", \" \", mdx(\"h1\", {\n    \"id\": \"accordion\",\n    \"style\": {\n      \"position\": \"relative\"\n    }\n  }, mdx(\"a\", {\n    parentName: \"h1\",\n    \"href\": \"#accordion\",\n    \"aria-label\": \"accordion permalink\",\n    \"className\": \"anchor before\"\n  }, mdx(\"undefined\", {\n    parentName: \"a\"\n  })), \"Accordion\"), mdx(\"p\", null, \"To use accordions in your post, you'll need to do something like this:\"), mdx(\"div\", {\n    \"className\": \"gatsby-highlight\",\n    \"data-language\": \"html\"\n  }, mdx(\"pre\", {\n    parentName: \"div\",\n    \"style\": {\n      \"counterReset\": \"linenumber NaN\"\n    },\n    \"className\": \"language-html line-numbers\"\n  }, mdx(\"code\", {\n    parentName: \"pre\",\n    \"className\": \"language-html\"\n  }, mdx(\"span\", {\n    parentName: \"code\",\n    \"className\": \"token tag\"\n  }, mdx(\"span\", {\n    parentName: \"span\",\n    \"className\": \"token tag\"\n  }, mdx(\"span\", {\n    parentName: \"span\",\n    \"className\": \"token punctuation\"\n  }, \"<\"), \"Accordion\"), \" \", mdx(\"span\", {\n    parentName: \"span\",\n    \"className\": \"token attr-name\"\n  }, \"allowZeroExpanded\"), mdx(\"span\", {\n    parentName: \"span\",\n    \"className\": \"token attr-value\"\n  }, mdx(\"span\", {\n    parentName: \"span\",\n    \"className\": \"token punctuation attr-equals\"\n  }, \"=\"), mdx(\"span\", {\n    parentName: \"span\",\n    \"className\": \"token punctuation\"\n  }, \"\\\"\"), \"true\", mdx(\"span\", {\n    parentName: \"span\",\n    \"className\": \"token punctuation\"\n  }, \"\\\"\")), mdx(\"span\", {\n    parentName: \"span\",\n    \"className\": \"token punctuation\"\n  }, \">\")), \"\\n  \", mdx(\"span\", {\n    parentName: \"code\",\n    \"className\": \"token tag\"\n  }, mdx(\"span\", {\n    parentName: \"span\",\n    \"className\": \"token tag\"\n  }, mdx(\"span\", {\n    parentName: \"span\",\n    \"className\": \"token punctuation\"\n  }, \"<\"), \"AccordionItem\"), mdx(\"span\", {\n    parentName: \"span\",\n    \"className\": \"token punctuation\"\n  }, \">\")), \"\\n    \", mdx(\"span\", {\n    parentName: \"code\",\n    \"className\": \"token tag\"\n  }, mdx(\"span\", {\n    parentName: \"span\",\n    \"className\": \"token tag\"\n  }, mdx(\"span\", {\n    parentName: \"span\",\n    \"className\": \"token punctuation\"\n  }, \"<\"), \"AccordionItemHeading\"), mdx(\"span\", {\n    parentName: \"span\",\n    \"className\": \"token punctuation\"\n  }, \">\")), \"\\n      \", mdx(\"span\", {\n    parentName: \"code\",\n    \"className\": \"token tag\"\n  }, mdx(\"span\", {\n    parentName: \"span\",\n    \"className\": \"token tag\"\n  }, mdx(\"span\", {\n    parentName: \"span\",\n    \"className\": \"token punctuation\"\n  }, \"<\"), \"AccordionItemButton\"), mdx(\"span\", {\n    parentName: \"span\",\n    \"className\": \"token punctuation\"\n  }, \">\")), \" Section 1 \", mdx(\"span\", {\n    parentName: \"code\",\n    \"className\": \"token tag\"\n  }, mdx(\"span\", {\n    parentName: \"span\",\n    \"className\": \"token tag\"\n  }, mdx(\"span\", {\n    parentName: \"span\",\n    \"className\": \"token punctuation\"\n  }, \"</\"), \"AccordionItemButton\"), mdx(\"span\", {\n    parentName: \"span\",\n    \"className\": \"token punctuation\"\n  }, \">\")), \"\\n    \", mdx(\"span\", {\n    parentName: \"code\",\n    \"className\": \"token tag\"\n  }, mdx(\"span\", {\n    parentName: \"span\",\n    \"className\": \"token tag\"\n  }, mdx(\"span\", {\n    parentName: \"span\",\n    \"className\": \"token punctuation\"\n  }, \"</\"), \"AccordionItemHeading\"), mdx(\"span\", {\n    parentName: \"span\",\n    \"className\": \"token punctuation\"\n  }, \">\")), \"\\n    \", mdx(\"span\", {\n    parentName: \"code\",\n    \"className\": \"token tag\"\n  }, mdx(\"span\", {\n    parentName: \"span\",\n    \"className\": \"token tag\"\n  }, mdx(\"span\", {\n    parentName: \"span\",\n    \"className\": \"token punctuation\"\n  }, \"<\"), \"AccordionItemPanel\"), mdx(\"span\", {\n    parentName: \"span\",\n    \"className\": \"token punctuation\"\n  }, \">\")), \" Write Something \", mdx(\"span\", {\n    parentName: \"code\",\n    \"className\": \"token tag\"\n  }, mdx(\"span\", {\n    parentName: \"span\",\n    \"className\": \"token tag\"\n  }, mdx(\"span\", {\n    parentName: \"span\",\n    \"className\": \"token punctuation\"\n  }, \"</\"), \"AccordionItemPanel\"), mdx(\"span\", {\n    parentName: \"span\",\n    \"className\": \"token punctuation\"\n  }, \">\")), \"\\n  \", mdx(\"span\", {\n    parentName: \"code\",\n    \"className\": \"token tag\"\n  }, mdx(\"span\", {\n    parentName: \"span\",\n    \"className\": \"token tag\"\n  }, mdx(\"span\", {\n    parentName: \"span\",\n    \"className\": \"token punctuation\"\n  }, \"</\"), \"AccordionItem\"), mdx(\"span\", {\n    parentName: \"span\",\n    \"className\": \"token punctuation\"\n  }, \">\")), \"\\n\\n  \", mdx(\"span\", {\n    parentName: \"code\",\n    \"className\": \"token tag\"\n  }, mdx(\"span\", {\n    parentName: \"span\",\n    \"className\": \"token tag\"\n  }, mdx(\"span\", {\n    parentName: \"span\",\n    \"className\": \"token punctuation\"\n  }, \"<\"), \"AccordionItem\"), mdx(\"span\", {\n    parentName: \"span\",\n    \"className\": \"token punctuation\"\n  }, \">\")), \"\\n    \", mdx(\"span\", {\n    parentName: \"code\",\n    \"className\": \"token tag\"\n  }, mdx(\"span\", {\n    parentName: \"span\",\n    \"className\": \"token tag\"\n  }, mdx(\"span\", {\n    parentName: \"span\",\n    \"className\": \"token punctuation\"\n  }, \"<\"), \"AccordionItemHeading\"), mdx(\"span\", {\n    parentName: \"span\",\n    \"className\": \"token punctuation\"\n  }, \">\")), \"\\n      \", mdx(\"span\", {\n    parentName: \"code\",\n    \"className\": \"token tag\"\n  }, mdx(\"span\", {\n    parentName: \"span\",\n    \"className\": \"token tag\"\n  }, mdx(\"span\", {\n    parentName: \"span\",\n    \"className\": \"token punctuation\"\n  }, \"<\"), \"AccordionItemButton\"), mdx(\"span\", {\n    parentName: \"span\",\n    \"className\": \"token punctuation\"\n  }, \">\")), \" Section 2 \", mdx(\"span\", {\n    parentName: \"code\",\n    \"className\": \"token tag\"\n  }, mdx(\"span\", {\n    parentName: \"span\",\n    \"className\": \"token tag\"\n  }, mdx(\"span\", {\n    parentName: \"span\",\n    \"className\": \"token punctuation\"\n  }, \"</\"), \"AccordionItemButton\"), mdx(\"span\", {\n    parentName: \"span\",\n    \"className\": \"token punctuation\"\n  }, \">\")), \"\\n    \", mdx(\"span\", {\n    parentName: \"code\",\n    \"className\": \"token tag\"\n  }, mdx(\"span\", {\n    parentName: \"span\",\n    \"className\": \"token tag\"\n  }, mdx(\"span\", {\n    parentName: \"span\",\n    \"className\": \"token punctuation\"\n  }, \"</\"), \"AccordionItemHeading\"), mdx(\"span\", {\n    parentName: \"span\",\n    \"className\": \"token punctuation\"\n  }, \">\")), \"\\n    \", mdx(\"span\", {\n    parentName: \"code\",\n    \"className\": \"token tag\"\n  }, mdx(\"span\", {\n    parentName: \"span\",\n    \"className\": \"token tag\"\n  }, mdx(\"span\", {\n    parentName: \"span\",\n    \"className\": \"token punctuation\"\n  }, \"<\"), \"AccordionItemPanel\"), mdx(\"span\", {\n    parentName: \"span\",\n    \"className\": \"token punctuation\"\n  }, \">\")), \"\\n      \", mdx(\"span\", {\n    parentName: \"code\",\n    \"className\": \"token tag\"\n  }, mdx(\"span\", {\n    parentName: \"span\",\n    \"className\": \"token tag\"\n  }, mdx(\"span\", {\n    parentName: \"span\",\n    \"className\": \"token punctuation\"\n  }, \"<\"), \"p\"), mdx(\"span\", {\n    parentName: \"span\",\n    \"className\": \"token punctuation\"\n  }, \">\")), \"You can also include other tags like paragraph and headings\", mdx(\"span\", {\n    parentName: \"code\",\n    \"className\": \"token tag\"\n  }, mdx(\"span\", {\n    parentName: \"span\",\n    \"className\": \"token tag\"\n  }, mdx(\"span\", {\n    parentName: \"span\",\n    \"className\": \"token punctuation\"\n  }, \"</\"), \"p\"), mdx(\"span\", {\n    parentName: \"span\",\n    \"className\": \"token punctuation\"\n  }, \">\")), \"\\n    \", mdx(\"span\", {\n    parentName: \"code\",\n    \"className\": \"token tag\"\n  }, mdx(\"span\", {\n    parentName: \"span\",\n    \"className\": \"token tag\"\n  }, mdx(\"span\", {\n    parentName: \"span\",\n    \"className\": \"token punctuation\"\n  }, \"</\"), \"AccordionItemPanel\"), mdx(\"span\", {\n    parentName: \"span\",\n    \"className\": \"token punctuation\"\n  }, \">\")), \"\\n  \", mdx(\"span\", {\n    parentName: \"code\",\n    \"className\": \"token tag\"\n  }, mdx(\"span\", {\n    parentName: \"span\",\n    \"className\": \"token tag\"\n  }, mdx(\"span\", {\n    parentName: \"span\",\n    \"className\": \"token punctuation\"\n  }, \"</\"), \"AccordionItem\"), mdx(\"span\", {\n    parentName: \"span\",\n    \"className\": \"token punctuation\"\n  }, \">\")), \"\\n\\n  \", mdx(\"span\", {\n    parentName: \"code\",\n    \"className\": \"token tag\"\n  }, mdx(\"span\", {\n    parentName: \"span\",\n    \"className\": \"token tag\"\n  }, mdx(\"span\", {\n    parentName: \"span\",\n    \"className\": \"token punctuation\"\n  }, \"<\"), \"AccordionItem\"), mdx(\"span\", {\n    parentName: \"span\",\n    \"className\": \"token punctuation\"\n  }, \">\")), \"\\n    \", mdx(\"span\", {\n    parentName: \"code\",\n    \"className\": \"token tag\"\n  }, mdx(\"span\", {\n    parentName: \"span\",\n    \"className\": \"token tag\"\n  }, mdx(\"span\", {\n    parentName: \"span\",\n    \"className\": \"token punctuation\"\n  }, \"<\"), \"AccordionItemHeading\"), mdx(\"span\", {\n    parentName: \"span\",\n    \"className\": \"token punctuation\"\n  }, \">\")), \"\\n      \", mdx(\"span\", {\n    parentName: \"code\",\n    \"className\": \"token tag\"\n  }, mdx(\"span\", {\n    parentName: \"span\",\n    \"className\": \"token tag\"\n  }, mdx(\"span\", {\n    parentName: \"span\",\n    \"className\": \"token punctuation\"\n  }, \"<\"), \"AccordionItemButton\"), mdx(\"span\", {\n    parentName: \"span\",\n    \"className\": \"token punctuation\"\n  }, \">\")), \" Section 3 \", mdx(\"span\", {\n    parentName: \"code\",\n    \"className\": \"token tag\"\n  }, mdx(\"span\", {\n    parentName: \"span\",\n    \"className\": \"token tag\"\n  }, mdx(\"span\", {\n    parentName: \"span\",\n    \"className\": \"token punctuation\"\n  }, \"</\"), \"AccordionItemButton\"), mdx(\"span\", {\n    parentName: \"span\",\n    \"className\": \"token punctuation\"\n  }, \">\")), \"\\n    \", mdx(\"span\", {\n    parentName: \"code\",\n    \"className\": \"token tag\"\n  }, mdx(\"span\", {\n    parentName: \"span\",\n    \"className\": \"token tag\"\n  }, mdx(\"span\", {\n    parentName: \"span\",\n    \"className\": \"token punctuation\"\n  }, \"</\"), \"AccordionItemHeading\"), mdx(\"span\", {\n    parentName: \"span\",\n    \"className\": \"token punctuation\"\n  }, \">\")), \"\\n    \", mdx(\"span\", {\n    parentName: \"code\",\n    \"className\": \"token tag\"\n  }, mdx(\"span\", {\n    parentName: \"span\",\n    \"className\": \"token tag\"\n  }, mdx(\"span\", {\n    parentName: \"span\",\n    \"className\": \"token punctuation\"\n  }, \"<\"), \"AccordionItemPanel\"), mdx(\"span\", {\n    parentName: \"span\",\n    \"className\": \"token punctuation\"\n  }, \">\")), \"\\n      \", mdx(\"span\", {\n    parentName: \"code\",\n    \"className\": \"token tag\"\n  }, mdx(\"span\", {\n    parentName: \"span\",\n    \"className\": \"token tag\"\n  }, mdx(\"span\", {\n    parentName: \"span\",\n    \"className\": \"token punctuation\"\n  }, \"<\"), \"p\"), mdx(\"span\", {\n    parentName: \"span\",\n    \"className\": \"token punctuation\"\n  }, \">\")), \"Write something about section 3\", mdx(\"span\", {\n    parentName: \"code\",\n    \"className\": \"token tag\"\n  }, mdx(\"span\", {\n    parentName: \"span\",\n    \"className\": \"token tag\"\n  }, mdx(\"span\", {\n    parentName: \"span\",\n    \"className\": \"token punctuation\"\n  }, \"</\"), \"p\"), mdx(\"span\", {\n    parentName: \"span\",\n    \"className\": \"token punctuation\"\n  }, \">\")), \"\\n    \", mdx(\"span\", {\n    parentName: \"code\",\n    \"className\": \"token tag\"\n  }, mdx(\"span\", {\n    parentName: \"span\",\n    \"className\": \"token tag\"\n  }, mdx(\"span\", {\n    parentName: \"span\",\n    \"className\": \"token punctuation\"\n  }, \"</\"), \"AccordionItemPanel\"), mdx(\"span\", {\n    parentName: \"span\",\n    \"className\": \"token punctuation\"\n  }, \">\")), \"\\n  \", mdx(\"span\", {\n    parentName: \"code\",\n    \"className\": \"token tag\"\n  }, mdx(\"span\", {\n    parentName: \"span\",\n    \"className\": \"token tag\"\n  }, mdx(\"span\", {\n    parentName: \"span\",\n    \"className\": \"token punctuation\"\n  }, \"</\"), \"AccordionItem\"), mdx(\"span\", {\n    parentName: \"span\",\n    \"className\": \"token punctuation\"\n  }, \">\")), \"\\n\", mdx(\"span\", {\n    parentName: \"code\",\n    \"className\": \"token tag\"\n  }, mdx(\"span\", {\n    parentName: \"span\",\n    \"className\": \"token tag\"\n  }, mdx(\"span\", {\n    parentName: \"span\",\n    \"className\": \"token punctuation\"\n  }, \"</\"), \"Accordion\"), mdx(\"span\", {\n    parentName: \"span\",\n    \"className\": \"token punctuation\"\n  }, \">\"))), mdx(\"span\", {\n    parentName: \"pre\",\n    \"aria-hidden\": \"true\",\n    \"className\": \"line-numbers-rows\",\n    \"style\": {\n      \"whiteSpace\": \"normal\",\n      \"width\": \"auto\",\n      \"left\": \"0\"\n    }\n  }, mdx(\"span\", {\n    parentName: \"span\"\n  }), mdx(\"span\", {\n    parentName: \"span\"\n  }), mdx(\"span\", {\n    parentName: \"span\"\n  }), mdx(\"span\", {\n    parentName: \"span\"\n  }), mdx(\"span\", {\n    parentName: \"span\"\n  }), mdx(\"span\", {\n    parentName: \"span\"\n  }), mdx(\"span\", {\n    parentName: \"span\"\n  }), mdx(\"span\", {\n    parentName: \"span\"\n  }), mdx(\"span\", {\n    parentName: \"span\"\n  }), mdx(\"span\", {\n    parentName: \"span\"\n  }), mdx(\"span\", {\n    parentName: \"span\"\n  }), mdx(\"span\", {\n    parentName: \"span\"\n  }), mdx(\"span\", {\n    parentName: \"span\"\n  }), mdx(\"span\", {\n    parentName: \"span\"\n  }), mdx(\"span\", {\n    parentName: \"span\"\n  }), mdx(\"span\", {\n    parentName: \"span\"\n  }), mdx(\"span\", {\n    parentName: \"span\"\n  }), mdx(\"span\", {\n    parentName: \"span\"\n  }), mdx(\"span\", {\n    parentName: \"span\"\n  }), mdx(\"span\", {\n    parentName: \"span\"\n  }), mdx(\"span\", {\n    parentName: \"span\"\n  }), mdx(\"span\", {\n    parentName: \"span\"\n  }), mdx(\"span\", {\n    parentName: \"span\"\n  }), mdx(\"span\", {\n    parentName: \"span\"\n  }), mdx(\"span\", {\n    parentName: \"span\"\n  }), mdx(\"span\", {\n    parentName: \"span\"\n  })))), mdx(\"p\", null, \"The output will be:\"), mdx(Accordion, {\n    allowZeroExpanded: \"true\",\n    mdxType: \"Accordion\"\n  }, mdx(AccordionItem, {\n    mdxType: \"AccordionItem\"\n  }, mdx(AccordionItemHeading, {\n    mdxType: \"AccordionItemHeading\"\n  }, mdx(AccordionItemButton, {\n    mdxType: \"AccordionItemButton\"\n  }, \"Section 1\")), mdx(AccordionItemPanel, {\n    mdxType: \"AccordionItemPanel\"\n  }, \"Write Something\")), mdx(AccordionItem, {\n    mdxType: \"AccordionItem\"\n  }, mdx(AccordionItemHeading, {\n    mdxType: \"AccordionItemHeading\"\n  }, mdx(AccordionItemButton, {\n    mdxType: \"AccordionItemButton\"\n  }, \"Section 2\")), mdx(AccordionItemPanel, {\n    mdxType: \"AccordionItemPanel\"\n  }, mdx(\"p\", null, \"You can also include other tags like paragraph and headings\"))), mdx(AccordionItem, {\n    mdxType: \"AccordionItem\"\n  }, mdx(AccordionItemHeading, {\n    mdxType: \"AccordionItemHeading\"\n  }, mdx(AccordionItemButton, {\n    mdxType: \"AccordionItemButton\"\n  }, \"Section 3\")), mdx(AccordionItemPanel, {\n    mdxType: \"AccordionItemPanel\"\n  }, mdx(\"p\", null, \"Write something about section 3\")))), mdx(\"p\", null, \"You have to start with \", mdx(\"code\", {\n    parentName: \"p\",\n    \"className\": \"language-text\"\n  }, \"<Accordion>\"), \" tag and wrap everything within it.\\nUse \", mdx(\"code\", {\n    parentName: \"p\",\n    \"className\": \"language-text\"\n  }, \"<AccordionItem>\"), \" for each accordion you want to add, and use \", mdx(\"code\", {\n    parentName: \"p\",\n    \"className\": \"language-text\"\n  }, \"<AccordItemHeading>\"), \" and\\n\", mdx(\"code\", {\n    parentName: \"p\",\n    \"className\": \"language-text\"\n  }, \"<AccordionItemButton>\"), \" together to produce the button and the heading. Then use \", mdx(\"code\", {\n    parentName: \"p\",\n    \"className\": \"language-text\"\n  }, \"<AccordionItemPanel>\"), \" for\\nyour main contents. Each tag mentioned above has some properties you can specify, for example, only allow\\none accordion expanded at a time or expand first first accordion by default.\\nVisit \", mdx(\"a\", {\n    parentName: \"p\",\n    \"href\": \"https://www.npmjs.com/package/react-accessible-accordion\"\n  }, \"react-accessible-accordion\"), \" to see what options\\nare available.\"), mdx(\"h1\", {\n    \"id\": \"code\",\n    \"style\": {\n      \"position\": \"relative\"\n    }\n  }, mdx(\"a\", {\n    parentName: \"h1\",\n    \"href\": \"#code\",\n    \"aria-label\": \"code permalink\",\n    \"className\": \"anchor before\"\n  }, mdx(\"undefined\", {\n    parentName: \"a\"\n  })), \"Code\"), mdx(\"p\", null, \"To add inline code, surround your code by single backtick.\"), mdx(\"div\", {\n    \"className\": \"gatsby-highlight\",\n    \"data-language\": \"text\"\n  }, mdx(\"pre\", {\n    parentName: \"div\",\n    \"style\": {\n      \"counterReset\": \"linenumber NaN\"\n    },\n    \"className\": \"language-text line-numbers\"\n  }, mdx(\"code\", {\n    parentName: \"pre\",\n    \"className\": \"language-text\"\n  }, \"`inline code`\"), mdx(\"span\", {\n    parentName: \"pre\",\n    \"aria-hidden\": \"true\",\n    \"className\": \"line-numbers-rows\",\n    \"style\": {\n      \"whiteSpace\": \"normal\",\n      \"width\": \"auto\",\n      \"left\": \"0\"\n    }\n  }, mdx(\"span\", {\n    parentName: \"span\"\n  })))), mdx(\"p\", null, \"For a code block, use triple backticks.\"), mdx(\"div\", {\n    \"className\": \"gatsby-highlight has-highlighted-lines\",\n    \"data-language\": \"md\"\n  }, mdx(\"pre\", {\n    parentName: \"div\",\n    \"style\": {\n      \"counterReset\": \"linenumber NaN\"\n    },\n    \"className\": \"language-md line-numbers\"\n  }, mdx(\"code\", {\n    parentName: \"pre\",\n    \"className\": \"language-md\"\n  }, \"1```html\\ncode block\\n1```\\n\\n1 is for illustration, remove it in practice.\"), mdx(\"span\", {\n    parentName: \"pre\",\n    \"aria-hidden\": \"true\",\n    \"className\": \"line-numbers-rows\",\n    \"style\": {\n      \"whiteSpace\": \"normal\",\n      \"width\": \"auto\",\n      \"left\": \"0\"\n    }\n  }, mdx(\"span\", {\n    parentName: \"span\"\n  }), mdx(\"span\", {\n    parentName: \"span\"\n  }), mdx(\"span\", {\n    parentName: \"span\"\n  }), mdx(\"span\", {\n    parentName: \"span\"\n  }), mdx(\"span\", {\n    parentName: \"span\"\n  })))), mdx(\"p\", null, \"You can also specify what programming language after first triple backticks.\\nTo highlight lines, specify line numbers within curly brackets after triple backticks.\"), mdx(\"div\", {\n    \"className\": \"gatsby-highlight\",\n    \"data-language\": \"text\"\n  }, mdx(\"pre\", {\n    parentName: \"div\",\n    \"style\": {\n      \"counterReset\": \"linenumber NaN\"\n    },\n    \"className\": \"language-text line-numbers\"\n  }, mdx(\"code\", {\n    parentName: \"pre\",\n    \"className\": \"language-text\"\n  }, \"1```js{1-2,4,5,6}\\ncode\\n1```\"), mdx(\"span\", {\n    parentName: \"pre\",\n    \"aria-hidden\": \"true\",\n    \"className\": \"line-numbers-rows\",\n    \"style\": {\n      \"whiteSpace\": \"normal\",\n      \"width\": \"auto\",\n      \"left\": \"0\"\n    }\n  }, mdx(\"span\", {\n    parentName: \"span\"\n  }), mdx(\"span\", {\n    parentName: \"span\"\n  }), mdx(\"span\", {\n    parentName: \"span\"\n  })))), mdx(\"p\", null, \"To add a title for your code block, insert \", mdx(\"code\", {\n    parentName: \"p\",\n    \"className\": \"language-text\"\n  }, \":title=your-title-name\"), \" just behind the language. Space is not allowed.\"), mdx(\"div\", {\n    \"className\": \"gatsby-code-title\"\n  }, \"My-title.html\"), mdx(\"div\", {\n    \"className\": \"gatsby-highlight has-highlighted-lines\",\n    \"data-language\": \"html\"\n  }, mdx(\"pre\", {\n    parentName: \"div\",\n    \"style\": {\n      \"counterReset\": \"linenumber NaN\"\n    },\n    \"className\": \"language-html line-numbers\"\n  }, mdx(\"code\", {\n    parentName: \"pre\",\n    \"className\": \"language-html\"\n  }, \"1```html{2}:title=My-title.html\\n\", mdx(\"span\", {\n    parentName: \"code\",\n    \"className\": \"gatsby-highlight-code-line\"\n  }, \"Add a title for your code block!\"), \"1```\"), mdx(\"span\", {\n    parentName: \"pre\",\n    \"aria-hidden\": \"true\",\n    \"className\": \"line-numbers-rows\",\n    \"style\": {\n      \"whiteSpace\": \"normal\",\n      \"width\": \"auto\",\n      \"left\": \"0\"\n    }\n  }, mdx(\"span\", {\n    parentName: \"span\"\n  }), mdx(\"span\", {\n    parentName: \"span\"\n  }), mdx(\"span\", {\n    parentName: \"span\"\n  })))), mdx(\"h1\", {\n    \"id\": \"d3js\",\n    \"style\": {\n      \"position\": \"relative\"\n    }\n  }, mdx(\"a\", {\n    parentName: \"h1\",\n    \"href\": \"#d3js\",\n    \"aria-label\": \"d3js permalink\",\n    \"className\": \"anchor before\"\n  }, mdx(\"undefined\", {\n    parentName: \"a\"\n  })), \"D3.js\"), mdx(\"p\", null, \"This website included the latest release of the D3.js library. Here is how you would include your D3 document\\nin your post in two steps:\"), mdx(\"ol\", null, mdx(\"li\", {\n    parentName: \"ol\"\n  }, mdx(\"p\", {\n    parentName: \"li\"\n  }, \"Place your D3 files under \", mdx(\"code\", {\n    parentName: \"p\",\n    \"className\": \"language-text\"\n  }, \"dataviz-hub2/static/d3\"))), mdx(\"li\", {\n    parentName: \"ol\"\n  }, mdx(\"p\", {\n    parentName: \"li\"\n  }, \"Add the following within the property list in the top of the \", mdx(\"code\", {\n    parentName: \"p\",\n    \"className\": \"language-text\"\n  }, \"index.mdx\"), \" file:\"), mdx(\"div\", {\n    parentName: \"li\",\n    \"className\": \"gatsby-highlight\",\n    \"data-language\": \"md\"\n  }, mdx(\"pre\", {\n    parentName: \"div\",\n    \"style\": {\n      \"counterReset\": \"linenumber NaN\"\n    },\n    \"className\": \"language-md line-numbers\"\n  }, mdx(\"code\", {\n    parentName: \"pre\",\n    \"className\": \"language-md\"\n  }, \"title: \\\"This is an example document\\\"\\n...\\nd3: [\\\"d3-filename.js\\\", \\\"more-file.js\\\"]\"), mdx(\"span\", {\n    parentName: \"pre\",\n    \"aria-hidden\": \"true\",\n    \"className\": \"line-numbers-rows\",\n    \"style\": {\n      \"whiteSpace\": \"normal\",\n      \"width\": \"auto\",\n      \"left\": \"0\"\n    }\n  }, mdx(\"span\", {\n    parentName: \"span\"\n  }), mdx(\"span\", {\n    parentName: \"span\"\n  }), mdx(\"span\", {\n    parentName: \"span\"\n  })))), mdx(\"p\", {\n    parentName: \"li\"\n  }, \"Items within squared brackets should be your file names, separate by comma if there are more than one files.\\nIf you want to inlcude external files (subject to approval), use the format \\\"\", mdx(\"a\", {\n    parentName: \"p\",\n    \"href\": \"https://yourfile.address%22\"\n  }, \"https://yourfile.address\\\"\"), \".\"))), mdx(\"svg\", {\n    id: \"d3\",\n    className: \"lg:-ml-60 lg:min-w-80 lg:min-h-40\"\n  }), mdx(\"div\", {\n    className: \"tooltip\"\n  }), mdx(\"h1\", {\n    \"id\": \"embed-well-known-services\",\n    \"style\": {\n      \"position\": \"relative\"\n    }\n  }, mdx(\"a\", {\n    parentName: \"h1\",\n    \"href\": \"#embed-well-known-services\",\n    \"aria-label\": \"embed well known services permalink\",\n    \"className\": \"anchor before\"\n  }, mdx(\"undefined\", {\n    parentName: \"a\"\n  })), \"Embed well known services\"), mdx(\"p\", null, \"You can embed many services (like CodePen, CodeSandbox, GIPHY, Instagram, Lichess, Slides, SoundCloud, Spotify, Streamable, Twitch, Twitter or YouTube) into blog posts by their URLs.\\nPlease ensure the URLs are wrapped by empty lines.\"), mdx(\"p\", null, \"This is how you would embed a youtube video:\"), mdx(\"div\", {\n    \"className\": \"gatsby-highlight\",\n    \"data-language\": \"md\"\n  }, mdx(\"pre\", {\n    parentName: \"div\",\n    \"style\": {\n      \"counterReset\": \"linenumber NaN\"\n    },\n    \"className\": \"language-md line-numbers\"\n  }, mdx(\"code\", {\n    parentName: \"pre\",\n    \"className\": \"language-md\"\n  }, mdx(\"span\", {\n    parentName: \"code\",\n    \"className\": \"token code-snippet code keyword\"\n  }, \"`video: https://www.youtube.com/watch?v=N5yRLFcbv4s`\"), \"\\nor\\nhttps://www.youtube.com/watch?v=dKno6ojJd_Q\"), mdx(\"span\", {\n    parentName: \"pre\",\n    \"aria-hidden\": \"true\",\n    \"className\": \"line-numbers-rows\",\n    \"style\": {\n      \"whiteSpace\": \"normal\",\n      \"width\": \"auto\",\n      \"left\": \"0\"\n    }\n  }, mdx(\"span\", {\n    parentName: \"span\"\n  }), mdx(\"span\", {\n    parentName: \"span\"\n  }), mdx(\"span\", {\n    parentName: \"span\"\n  })))), mdx(\"p\", null, \"Note: you can't styling videos at the moment.\\n\", mdx(\"div\", {\n    parentName: \"p\",\n    \"className\": \"gatsby-resp-iframe-wrapper\",\n    \"style\": {\n      \"paddingBottom\": \"56.42857142857143%\",\n      \"position\": \"relative\",\n      \"height\": \"0\",\n      \"overflow\": \"hidden\",\n      \"margin\": \"2rem auto 1.075rem auto, max-width: 800px, height: 600px\"\n    }\n  }, \" \", mdx(\"div\", {\n    parentName: \"div\",\n    \"className\": \"embedVideo-container\"\n  }, \" \", mdx(\"iframe\", {\n    parentName: \"div\",\n    \"title\": \"\",\n    \"src\": \"https://www.youtube-nocookie.com/embed/N5yRLFcbv4s?rel=0\",\n    \"className\": \"embedVideo-iframe\",\n    \"style\": {\n      \"border\": \"0\",\n      \"position\": \"absolute\",\n      \"top\": \"0\",\n      \"left\": \"0\",\n      \"width\": \"100%\",\n      \"height\": \"100%\"\n    },\n    \"loading\": \"eager\",\n    \"allowFullScreen\": true,\n    \"sandbox\": \"allow-same-origin allow-scripts allow-popups\"\n  }), \" \"), \" \"), \"\\nfor more information about embedding videos using the first option, visit \", mdx(\"a\", {\n    href: \"https://www.gatsbyjs.org/packages/gatsby-remark-embed-video/#usage\",\n    target: \"_blank\",\n    rel: \"noreferrer noopener\"\n  }, \"here\"), \".\"), mdx(\"p\", null, mdx(\"a\", {\n    parentName: \"p\",\n    \"href\": \"https://www.youtube.com/watch?v=dKno6ojJd_Q\"\n  }, \"https://www.youtube.com/watch?v=dKno6ojJd_Q\")), mdx(\"p\", null, \"Embed twitter:\"), mdx(\"div\", {\n    \"className\": \"gatsby-highlight\",\n    \"data-language\": \"md\"\n  }, mdx(\"pre\", {\n    parentName: \"div\",\n    \"style\": {\n      \"counterReset\": \"linenumber NaN\"\n    },\n    \"className\": \"language-md line-numbers\"\n  }, mdx(\"code\", {\n    parentName: \"pre\",\n    \"className\": \"language-md\"\n  }, \"https://twitter.com/OpenResShef/status/1255448310271356932\\nor\\nOn Twitter, find the tweet you'd like to display.\\nIn the top right-hand corner of the tweet, click the caret (\\u2228) and select \\\"Embed tweet\\\".\\nTake the code you're given and copy it into your markdown page.\\n\\nNote: when copying the embed code, copy only the blockquote section and not the script.\\n\\n\", mdx(\"span\", {\n    parentName: \"code\",\n    \"className\": \"token tag\"\n  }, mdx(\"span\", {\n    parentName: \"span\",\n    \"className\": \"token tag\"\n  }, mdx(\"span\", {\n    parentName: \"span\",\n    \"className\": \"token punctuation\"\n  }, \"<\"), \"blockquote\"), \" \", mdx(\"span\", {\n    parentName: \"span\",\n    \"className\": \"token attr-name\"\n  }, \"class\"), mdx(\"span\", {\n    parentName: \"span\",\n    \"className\": \"token attr-value\"\n  }, mdx(\"span\", {\n    parentName: \"span\",\n    \"className\": \"token punctuation attr-equals\"\n  }, \"=\"), mdx(\"span\", {\n    parentName: \"span\",\n    \"className\": \"token punctuation\"\n  }, \"\\\"\"), \"twitter-tweet\", mdx(\"span\", {\n    parentName: \"span\",\n    \"className\": \"token punctuation\"\n  }, \"\\\"\")), mdx(\"span\", {\n    parentName: \"span\",\n    \"className\": \"token punctuation\"\n  }, \">\")), \"\\n\", mdx(\"span\", {\n    parentName: \"code\",\n    \"className\": \"token tag\"\n  }, mdx(\"span\", {\n    parentName: \"span\",\n    \"className\": \"token tag\"\n  }, mdx(\"span\", {\n    parentName: \"span\",\n    \"className\": \"token punctuation\"\n  }, \"<\"), \"p\"), \" \", mdx(\"span\", {\n    parentName: \"span\",\n    \"className\": \"token attr-name\"\n  }, \"lang\"), mdx(\"span\", {\n    parentName: \"span\",\n    \"className\": \"token attr-value\"\n  }, mdx(\"span\", {\n    parentName: \"span\",\n    \"className\": \"token punctuation attr-equals\"\n  }, \"=\"), mdx(\"span\", {\n    parentName: \"span\",\n    \"className\": \"token punctuation\"\n  }, \"\\\"\"), \"en\", mdx(\"span\", {\n    parentName: \"span\",\n    \"className\": \"token punctuation\"\n  }, \"\\\"\")), \" \", mdx(\"span\", {\n    parentName: \"span\",\n    \"className\": \"token attr-name\"\n  }, \"dir\"), mdx(\"span\", {\n    parentName: \"span\",\n    \"className\": \"token attr-value\"\n  }, mdx(\"span\", {\n    parentName: \"span\",\n    \"className\": \"token punctuation attr-equals\"\n  }, \"=\"), mdx(\"span\", {\n    parentName: \"span\",\n    \"className\": \"token punctuation\"\n  }, \"\\\"\"), \"ltr\", mdx(\"span\", {\n    parentName: \"span\",\n    \"className\": \"token punctuation\"\n  }, \"\\\"\")), mdx(\"span\", {\n    parentName: \"span\",\n    \"className\": \"token punctuation\"\n  }, \">\")), \"UKRI-funded researchers will know that the current open access policy only applies to journal articles \", mdx(\"span\", {\n    parentName: \"code\",\n    \"className\": \"token entity named-entity\",\n    \"title\": \"&\"\n  }, \"&amp;\"), \" conference proceedings - the new one will also apply \\nto monographs, edited collections \", mdx(\"span\", {\n    parentName: \"code\",\n    \"className\": \"token entity named-entity\",\n    \"title\": \"&\"\n  }, \"&amp;\"), \" chapters \\uD83D\\uDCDA (so particular heads up to our A\", mdx(\"span\", {\n    parentName: \"code\",\n    \"className\": \"token entity named-entity\",\n    \"title\": \"&\"\n  }, \"&amp;\"), \"H and social sciences researchers)\", mdx(\"span\", {\n    parentName: \"code\",\n    \"className\": \"token tag\"\n  }, mdx(\"span\", {\n    parentName: \"span\",\n    \"className\": \"token tag\"\n  }, mdx(\"span\", {\n    parentName: \"span\",\n    \"className\": \"token punctuation\"\n  }, \"</\"), \"p\"), mdx(\"span\", {\n    parentName: \"span\",\n    \"className\": \"token punctuation\"\n  }, \">\")), mdx(\"span\", {\n    parentName: \"code\",\n    \"className\": \"token entity named-entity\",\n    \"title\": \"—\"\n  }, \"&mdash;\"), \" Open Research TUoS (@OpenResShef) \\n\", mdx(\"span\", {\n    parentName: \"code\",\n    \"className\": \"token tag\"\n  }, mdx(\"span\", {\n    parentName: \"span\",\n    \"className\": \"token tag\"\n  }, mdx(\"span\", {\n    parentName: \"span\",\n    \"className\": \"token punctuation\"\n  }, \"<\"), \"a\"), \" \", mdx(\"span\", {\n    parentName: \"span\",\n    \"className\": \"token attr-name\"\n  }, \"href\"), mdx(\"span\", {\n    parentName: \"span\",\n    \"className\": \"token attr-value\"\n  }, mdx(\"span\", {\n    parentName: \"span\",\n    \"className\": \"token punctuation attr-equals\"\n  }, \"=\"), mdx(\"span\", {\n    parentName: \"span\",\n    \"className\": \"token punctuation\"\n  }, \"\\\"\"), \"https://twitter.com/OpenResShef/status/1255448311953309702\", mdx(\"span\", {\n    parentName: \"span\",\n    \"className\": \"token punctuation\"\n  }, \"\\\"\")), mdx(\"span\", {\n    parentName: \"span\",\n    \"className\": \"token punctuation\"\n  }, \">\")), \"April 29, 2020\", mdx(\"span\", {\n    parentName: \"code\",\n    \"className\": \"token tag\"\n  }, mdx(\"span\", {\n    parentName: \"span\",\n    \"className\": \"token tag\"\n  }, mdx(\"span\", {\n    parentName: \"span\",\n    \"className\": \"token punctuation\"\n  }, \"</\"), \"a\"), mdx(\"span\", {\n    parentName: \"span\",\n    \"className\": \"token punctuation\"\n  }, \">\")), \"\\n\", mdx(\"span\", {\n    parentName: \"code\",\n    \"className\": \"token tag\"\n  }, mdx(\"span\", {\n    parentName: \"span\",\n    \"className\": \"token tag\"\n  }, mdx(\"span\", {\n    parentName: \"span\",\n    \"className\": \"token punctuation\"\n  }, \"</\"), \"blockquote\"), mdx(\"span\", {\n    parentName: \"span\",\n    \"className\": \"token punctuation\"\n  }, \">\")), \"\\n\\nTo center the twitter card, use second option and wrap it with DIV with className \\\"flex justify-center\\\"\"), mdx(\"span\", {\n    parentName: \"pre\",\n    \"aria-hidden\": \"true\",\n    \"className\": \"line-numbers-rows\",\n    \"style\": {\n      \"whiteSpace\": \"normal\",\n      \"width\": \"auto\",\n      \"left\": \"0\"\n    }\n  }, mdx(\"span\", {\n    parentName: \"span\"\n  }), mdx(\"span\", {\n    parentName: \"span\"\n  }), mdx(\"span\", {\n    parentName: \"span\"\n  }), mdx(\"span\", {\n    parentName: \"span\"\n  }), mdx(\"span\", {\n    parentName: \"span\"\n  }), mdx(\"span\", {\n    parentName: \"span\"\n  }), mdx(\"span\", {\n    parentName: \"span\"\n  }), mdx(\"span\", {\n    parentName: \"span\"\n  }), mdx(\"span\", {\n    parentName: \"span\"\n  }), mdx(\"span\", {\n    parentName: \"span\"\n  }), mdx(\"span\", {\n    parentName: \"span\"\n  }), mdx(\"span\", {\n    parentName: \"span\"\n  }), mdx(\"span\", {\n    parentName: \"span\"\n  }), mdx(\"span\", {\n    parentName: \"span\"\n  }), mdx(\"span\", {\n    parentName: \"span\"\n  })))), mdx(\"br\", null), mdx(\"p\", null, \"Embed codepen:\"), mdx(\"div\", {\n    \"className\": \"gatsby-highlight\",\n    \"data-language\": \"text\"\n  }, mdx(\"pre\", {\n    parentName: \"div\",\n    \"style\": {\n      \"counterReset\": \"linenumber NaN\"\n    },\n    \"className\": \"language-text line-numbers\"\n  }, mdx(\"code\", {\n    parentName: \"pre\",\n    \"className\": \"language-text\"\n  }, \"https://codepen.io/melvinidema/pen/ExVXzML\"), mdx(\"span\", {\n    parentName: \"pre\",\n    \"aria-hidden\": \"true\",\n    \"className\": \"line-numbers-rows\",\n    \"style\": {\n      \"whiteSpace\": \"normal\",\n      \"width\": \"auto\",\n      \"left\": \"0\"\n    }\n  }, mdx(\"span\", {\n    parentName: \"span\"\n  })))), mdx(\"p\", null, \"Embed CodeSandbox:\"), mdx(\"div\", {\n    \"className\": \"gatsby-highlight\",\n    \"data-language\": \"text\"\n  }, mdx(\"pre\", {\n    parentName: \"div\",\n    \"style\": {\n      \"counterReset\": \"linenumber NaN\"\n    },\n    \"className\": \"language-text line-numbers\"\n  }, mdx(\"code\", {\n    parentName: \"pre\",\n    \"className\": \"language-text\"\n  }, \"// Add \\\"?view=split\\\" to the end\\nhttps://codesandbox.io/s/ynn88nx9x?view=split\"), mdx(\"span\", {\n    parentName: \"pre\",\n    \"aria-hidden\": \"true\",\n    \"className\": \"line-numbers-rows\",\n    \"style\": {\n      \"whiteSpace\": \"normal\",\n      \"width\": \"auto\",\n      \"left\": \"0\"\n    }\n  }, mdx(\"span\", {\n    parentName: \"span\"\n  }), mdx(\"span\", {\n    parentName: \"span\"\n  })))), mdx(\"h1\", {\n    \"id\": \"files\",\n    \"style\": {\n      \"position\": \"relative\"\n    }\n  }, mdx(\"a\", {\n    parentName: \"h1\",\n    \"href\": \"#files\",\n    \"aria-label\": \"files permalink\",\n    \"className\": \"anchor before\"\n  }, mdx(\"undefined\", {\n    parentName: \"a\"\n  })), \"Files\"), mdx(\"p\", null, \"To make a file available to readers, place the file under the post directory and add something like this:\"), mdx(\"div\", {\n    \"className\": \"gatsby-highlight\",\n    \"data-language\": \"text\"\n  }, mdx(\"pre\", {\n    parentName: \"div\",\n    \"style\": {\n      \"counterReset\": \"linenumber NaN\"\n    },\n    \"className\": \"language-text line-numbers\"\n  }, mdx(\"code\", {\n    parentName: \"pre\",\n    \"className\": \"language-text\"\n  }, \"<a href=\\\"./filename.pdf\\\">Download</a>\"), mdx(\"span\", {\n    parentName: \"pre\",\n    \"aria-hidden\": \"true\",\n    \"className\": \"line-numbers-rows\",\n    \"style\": {\n      \"whiteSpace\": \"normal\",\n      \"width\": \"auto\",\n      \"left\": \"0\"\n    }\n  }, mdx(\"span\", {\n    parentName: \"span\"\n  })))), mdx(\"h1\", {\n    \"id\": \"image\",\n    \"style\": {\n      \"position\": \"relative\"\n    }\n  }, mdx(\"a\", {\n    parentName: \"h1\",\n    \"href\": \"#image\",\n    \"aria-label\": \"image permalink\",\n    \"className\": \"anchor before\"\n  }, mdx(\"undefined\", {\n    parentName: \"a\"\n  })), \"Image\"), mdx(\"p\", null, \"This is how you would embed add an local image (remember to add your images in the same directory of your md/mdx file):\"), mdx(\"div\", {\n    \"className\": \"gatsby-highlight\",\n    \"data-language\": \"md\"\n  }, mdx(\"pre\", {\n    parentName: \"div\",\n    \"style\": {\n      \"counterReset\": \"linenumber NaN\"\n    },\n    \"className\": \"language-md line-numbers\"\n  }, mdx(\"code\", {\n    parentName: \"pre\",\n    \"className\": \"language-md\"\n  }, mdx(\"span\", {\n    parentName: \"code\",\n    \"className\": \"token url\"\n  }, mdx(\"span\", {\n    parentName: \"span\",\n    \"className\": \"token operator\"\n  }, \"!\"), \"[\", mdx(\"span\", {\n    parentName: \"span\",\n    \"className\": \"token content\"\n  }, \"my image description\"), \"](\", mdx(\"span\", {\n    parentName: \"span\",\n    \"className\": \"token url\"\n  }, \"./temp.jpg\"), \" \", mdx(\"span\", {\n    parentName: \"span\",\n    \"className\": \"token string\"\n  }, \"\\\"Here is the title after url\\\"\"), \")\")), mdx(\"span\", {\n    parentName: \"pre\",\n    \"aria-hidden\": \"true\",\n    \"className\": \"line-numbers-rows\",\n    \"style\": {\n      \"whiteSpace\": \"normal\",\n      \"width\": \"auto\",\n      \"left\": \"0\"\n    }\n  }, mdx(\"span\", {\n    parentName: \"span\"\n  })))), mdx(\"p\", null, \"Alternatively:\"), mdx(\"div\", {\n    \"className\": \"gatsby-highlight\",\n    \"data-language\": \"md\"\n  }, mdx(\"pre\", {\n    parentName: \"div\",\n    \"style\": {\n      \"counterReset\": \"linenumber NaN\"\n    },\n    \"className\": \"language-md line-numbers\"\n  }, mdx(\"code\", {\n    parentName: \"pre\",\n    \"className\": \"language-md\"\n  }, mdx(\"span\", {\n    parentName: \"code\",\n    \"className\": \"token tag\"\n  }, mdx(\"span\", {\n    parentName: \"span\",\n    \"className\": \"token tag\"\n  }, mdx(\"span\", {\n    parentName: \"span\",\n    \"className\": \"token punctuation\"\n  }, \"<\"), \"img\"), \" \", mdx(\"span\", {\n    parentName: \"span\",\n    \"className\": \"token attr-name\"\n  }, \"alt\"), mdx(\"span\", {\n    parentName: \"span\",\n    \"className\": \"token attr-value\"\n  }, mdx(\"span\", {\n    parentName: \"span\",\n    \"className\": \"token punctuation attr-equals\"\n  }, \"=\"), mdx(\"span\", {\n    parentName: \"span\",\n    \"className\": \"token punctuation\"\n  }, \"\\\"\"), \"my image description\", mdx(\"span\", {\n    parentName: \"span\",\n    \"className\": \"token punctuation\"\n  }, \"\\\"\")), \" \", mdx(\"span\", {\n    parentName: \"span\",\n    \"className\": \"token attr-name\"\n  }, \"src\"), mdx(\"span\", {\n    parentName: \"span\",\n    \"className\": \"token attr-value\"\n  }, mdx(\"span\", {\n    parentName: \"span\",\n    \"className\": \"token punctuation attr-equals\"\n  }, \"=\"), mdx(\"span\", {\n    parentName: \"span\",\n    \"className\": \"token punctuation\"\n  }, \"\\\"\"), \"./temp.jpg\", mdx(\"span\", {\n    parentName: \"span\",\n    \"className\": \"token punctuation\"\n  }, \"\\\"\")), \" \", mdx(\"span\", {\n    parentName: \"span\",\n    \"className\": \"token attr-name\"\n  }, \"title\"), mdx(\"span\", {\n    parentName: \"span\",\n    \"className\": \"token attr-value\"\n  }, mdx(\"span\", {\n    parentName: \"span\",\n    \"className\": \"token punctuation attr-equals\"\n  }, \"=\"), mdx(\"span\", {\n    parentName: \"span\",\n    \"className\": \"token punctuation\"\n  }, \"\\\"\"), \"hello\", mdx(\"span\", {\n    parentName: \"span\",\n    \"className\": \"token punctuation\"\n  }, \"\\\"\")), \" \", mdx(\"span\", {\n    parentName: \"span\",\n    \"className\": \"token punctuation\"\n  }, \"/>\"))), mdx(\"span\", {\n    parentName: \"pre\",\n    \"aria-hidden\": \"true\",\n    \"className\": \"line-numbers-rows\",\n    \"style\": {\n      \"whiteSpace\": \"normal\",\n      \"width\": \"auto\",\n      \"left\": \"0\"\n    }\n  }, mdx(\"span\", {\n    parentName: \"span\"\n  })))), mdx(\"p\", null, \"To add caption for image:\"), mdx(\"div\", {\n    \"className\": \"gatsby-highlight\",\n    \"data-language\": \"jsx\"\n  }, mdx(\"pre\", {\n    parentName: \"div\",\n    \"style\": {\n      \"counterReset\": \"linenumber NaN\"\n    },\n    \"className\": \"language-jsx line-numbers\"\n  }, mdx(\"code\", {\n    parentName: \"pre\",\n    \"className\": \"language-jsx\"\n  }, mdx(\"span\", {\n    parentName: \"code\",\n    \"className\": \"token operator\"\n  }, \"!\"), mdx(\"span\", {\n    parentName: \"code\",\n    \"className\": \"token punctuation\"\n  }, \"[\"), \"my image description\", mdx(\"span\", {\n    parentName: \"code\",\n    \"className\": \"token punctuation\"\n  }, \"]\"), mdx(\"span\", {\n    parentName: \"code\",\n    \"className\": \"token punctuation\"\n  }, \"(\"), mdx(\"span\", {\n    parentName: \"code\",\n    \"className\": \"token punctuation\"\n  }, \".\"), mdx(\"span\", {\n    parentName: \"code\",\n    \"className\": \"token operator\"\n  }, \"/\"), \"temp\", mdx(\"span\", {\n    parentName: \"code\",\n    \"className\": \"token punctuation\"\n  }, \".\"), \"jpg \", mdx(\"span\", {\n    parentName: \"code\",\n    \"className\": \"token string\"\n  }, \"\\\"Here is the title after url\\\"\"), mdx(\"span\", {\n    parentName: \"code\",\n    \"className\": \"token punctuation\"\n  }, \")\"), \"\\n\", mdx(\"span\", {\n    parentName: \"code\",\n    \"className\": \"token operator\"\n  }, \"*\"), \"This is my image caption\", mdx(\"span\", {\n    parentName: \"code\",\n    \"className\": \"token operator\"\n  }, \"*\")), mdx(\"span\", {\n    parentName: \"pre\",\n    \"aria-hidden\": \"true\",\n    \"className\": \"line-numbers-rows\",\n    \"style\": {\n      \"whiteSpace\": \"normal\",\n      \"width\": \"auto\",\n      \"left\": \"0\"\n    }\n  }, mdx(\"span\", {\n    parentName: \"span\"\n  }), mdx(\"span\", {\n    parentName: \"span\"\n  })))), mdx(\"p\", null, \"Make sure you pressed SPACE key twice followed by ENTER key after the closing bracket, if successful captions should had become italic:\"), mdx(\"p\", null, mdx(\"img\", {\n    parentName: \"p\",\n    \"src\": \"/b4cbf28e22e521e30c82125257f309ca/temp.jpg\",\n    \"alt\": \"my image description\",\n    \"title\": \"Here is the title after url\"\n  }), mdx(\"br\", {\n    parentName: \"p\"\n  }), \"\\n\", mdx(\"em\", {\n    parentName: \"p\"\n  }, \"This is my image caption\")), mdx(\"p\", null, \"Alternatively (so you can add style for images):\"), mdx(\"div\", {\n    \"className\": \"gatsby-highlight\",\n    \"data-language\": \"jsx\"\n  }, mdx(\"pre\", {\n    parentName: \"div\",\n    \"style\": {\n      \"counterReset\": \"linenumber NaN\"\n    },\n    \"className\": \"language-jsx line-numbers\"\n  }, mdx(\"code\", {\n    parentName: \"pre\",\n    \"className\": \"language-jsx\"\n  }, mdx(\"span\", {\n    parentName: \"code\",\n    \"className\": \"token tag\"\n  }, mdx(\"span\", {\n    parentName: \"span\",\n    \"className\": \"token tag\"\n  }, mdx(\"span\", {\n    parentName: \"span\",\n    \"className\": \"token punctuation\"\n  }, \"<\"), \"img\"), \" \", mdx(\"span\", {\n    parentName: \"span\",\n    \"className\": \"token attr-name\"\n  }, \"style\"), mdx(\"span\", {\n    parentName: \"span\",\n    \"className\": \"token script language-javascript\"\n  }, mdx(\"span\", {\n    parentName: \"span\",\n    \"className\": \"token script-punctuation punctuation\"\n  }, \"=\"), mdx(\"span\", {\n    parentName: \"span\",\n    \"className\": \"token punctuation\"\n  }, \"{\"), mdx(\"span\", {\n    parentName: \"span\",\n    \"className\": \"token punctuation\"\n  }, \"{\"), mdx(\"span\", {\n    parentName: \"span\",\n    \"className\": \"token literal-property property\"\n  }, \"marginLeft\"), mdx(\"span\", {\n    parentName: \"span\",\n    \"className\": \"token operator\"\n  }, \":\"), \" \", mdx(\"span\", {\n    parentName: \"span\",\n    \"className\": \"token string\"\n  }, \"\\\"-100px\\\"\"), mdx(\"span\", {\n    parentName: \"span\",\n    \"className\": \"token punctuation\"\n  }, \",\"), \" \", mdx(\"span\", {\n    parentName: \"span\",\n    \"className\": \"token literal-property property\"\n  }, \"border\"), mdx(\"span\", {\n    parentName: \"span\",\n    \"className\": \"token operator\"\n  }, \":\"), \" \", mdx(\"span\", {\n    parentName: \"span\",\n    \"className\": \"token string\"\n  }, \"\\\"solid 4px #00aeef\\\"\"), mdx(\"span\", {\n    parentName: \"span\",\n    \"className\": \"token punctuation\"\n  }, \",\"), \" \", mdx(\"span\", {\n    parentName: \"span\",\n    \"className\": \"token literal-property property\"\n  }, \"height\"), mdx(\"span\", {\n    parentName: \"span\",\n    \"className\": \"token operator\"\n  }, \":\"), \" \", mdx(\"span\", {\n    parentName: \"span\",\n    \"className\": \"token string\"\n  }, \"\\\"300px\\\"\"), mdx(\"span\", {\n    parentName: \"span\",\n    \"className\": \"token punctuation\"\n  }, \",\"), \" \", mdx(\"span\", {\n    parentName: \"span\",\n    \"className\": \"token literal-property property\"\n  }, \"width\"), mdx(\"span\", {\n    parentName: \"span\",\n    \"className\": \"token operator\"\n  }, \":\"), \" \", mdx(\"span\", {\n    parentName: \"span\",\n    \"className\": \"token string\"\n  }, \"\\\"550px\\\"\"), mdx(\"span\", {\n    parentName: \"span\",\n    \"className\": \"token punctuation\"\n  }, \"}\"), mdx(\"span\", {\n    parentName: \"span\",\n    \"className\": \"token punctuation\"\n  }, \"}\")), \" \", mdx(\"span\", {\n    parentName: \"span\",\n    \"className\": \"token attr-name\"\n  }, \"src\"), mdx(\"span\", {\n    parentName: \"span\",\n    \"className\": \"token attr-value\"\n  }, mdx(\"span\", {\n    parentName: \"span\",\n    \"className\": \"token punctuation attr-equals\"\n  }, \"=\"), mdx(\"span\", {\n    parentName: \"span\",\n    \"className\": \"token punctuation\"\n  }, \"\\\"\"), \"./temp.jpg\", mdx(\"span\", {\n    parentName: \"span\",\n    \"className\": \"token punctuation\"\n  }, \"\\\"\")), \" \", mdx(\"span\", {\n    parentName: \"span\",\n    \"className\": \"token attr-name\"\n  }, \"alt\"), mdx(\"span\", {\n    parentName: \"span\",\n    \"className\": \"token attr-value\"\n  }, mdx(\"span\", {\n    parentName: \"span\",\n    \"className\": \"token punctuation attr-equals\"\n  }, \"=\"), mdx(\"span\", {\n    parentName: \"span\",\n    \"className\": \"token punctuation\"\n  }, \"\\\"\"), \"image1\", mdx(\"span\", {\n    parentName: \"span\",\n    \"className\": \"token punctuation\"\n  }, \"\\\"\")), \" \", mdx(\"span\", {\n    parentName: \"span\",\n    \"className\": \"token punctuation\"\n  }, \"/>\")), mdx(\"span\", {\n    parentName: \"code\",\n    \"className\": \"token tag\"\n  }, mdx(\"span\", {\n    parentName: \"span\",\n    \"className\": \"token tag\"\n  }, mdx(\"span\", {\n    parentName: \"span\",\n    \"className\": \"token punctuation\"\n  }, \"<\"), \"br\"), \" \", mdx(\"span\", {\n    parentName: \"span\",\n    \"className\": \"token punctuation\"\n  }, \"/>\")), \"\\n\", mdx(\"span\", {\n    parentName: \"code\",\n    \"className\": \"token tag\"\n  }, mdx(\"span\", {\n    parentName: \"span\",\n    \"className\": \"token tag\"\n  }, mdx(\"span\", {\n    parentName: \"span\",\n    \"className\": \"token punctuation\"\n  }, \"<\"), \"em\"), mdx(\"span\", {\n    parentName: \"span\",\n    \"className\": \"token punctuation\"\n  }, \">\")), mdx(\"span\", {\n    parentName: \"code\",\n    \"className\": \"token plain-text\"\n  }, \"image-caption\"), mdx(\"span\", {\n    parentName: \"code\",\n    \"className\": \"token tag\"\n  }, mdx(\"span\", {\n    parentName: \"span\",\n    \"className\": \"token tag\"\n  }, mdx(\"span\", {\n    parentName: \"span\",\n    \"className\": \"token punctuation\"\n  }, \"</\"), \"em\"), mdx(\"span\", {\n    parentName: \"span\",\n    \"className\": \"token punctuation\"\n  }, \">\"))), mdx(\"span\", {\n    parentName: \"pre\",\n    \"aria-hidden\": \"true\",\n    \"className\": \"line-numbers-rows\",\n    \"style\": {\n      \"whiteSpace\": \"normal\",\n      \"width\": \"auto\",\n      \"left\": \"0\"\n    }\n  }, mdx(\"span\", {\n    parentName: \"span\"\n  }), mdx(\"span\", {\n    parentName: \"span\"\n  })))), mdx(\"img\", {\n    style: {\n      marginLeft: \"-100px\",\n      border: \"solid 4px #00aeef\",\n      height: \"300px\",\n      width: \"550px\"\n    },\n    src: \"/b4cbf28e22e521e30c82125257f309ca/temp.jpg\",\n    alt: \"image3\"\n  }), mdx(\"br\", null), mdx(\"em\", null, \"image-caption\"), \" \", mdx(\"p\", null, \"For images available online, use their url.\"), mdx(\"p\", null, mdx(\"strong\", {\n    parentName: \"p\"\n  }, \"If you use the second way to add images, please don't forget to add alt text for each image to help users for some reason cannot view\\nit (because of slow connection, an error in the src attribute, or if the user uses a screen reader).\")), mdx(\"h1\", {\n    \"id\": \"link\",\n    \"style\": {\n      \"position\": \"relative\"\n    }\n  }, mdx(\"a\", {\n    parentName: \"h1\",\n    \"href\": \"#link\",\n    \"aria-label\": \"link permalink\",\n    \"className\": \"anchor before\"\n  }, mdx(\"undefined\", {\n    parentName: \"a\"\n  })), \"Link\"), mdx(\"ul\", null, mdx(\"li\", {\n    parentName: \"ul\"\n  }, mdx(\"p\", {\n    parentName: \"li\"\n  }, mdx(\"strong\", {\n    parentName: \"p\"\n  }, \"URL within the website\")), mdx(\"p\", {\n    parentName: \"li\"\n  }, \"The post you're writing might be a part of your blog series, and if you wish to include link of previous posts (or any other part of the website) within a post, you'll need \", mdx(\"strong\", {\n    parentName: \"p\"\n  }, \"Link\"), \" tag.\\nTo use \", mdx(\"strong\", {\n    parentName: \"p\"\n  }, \"Link\"), \" tag:\"), mdx(\"ol\", {\n    parentName: \"li\"\n  }, mdx(\"li\", {\n    parentName: \"ol\"\n  }, \"Make sure the file extension is .mdx\"), mdx(\"li\", {\n    parentName: \"ol\"\n  }, \"Use \", mdx(\"code\", {\n    parentName: \"li\",\n    \"className\": \"language-text\"\n  }, \"to\"), \" property instead of \", mdx(\"code\", {\n    parentName: \"li\",\n    \"className\": \"language-text\"\n  }, \"href\"), \", for internal pages you don't need to specify hostname (dataviz.shef.ac.uk):\", mdx(\"br\", {\n    parentName: \"li\"\n  }), mdx(\"code\", {\n    parentName: \"li\",\n    \"className\": \"language-text\"\n  }, \"<Link className=\\\"text-gray-700\\\" to=\\\"/blog\\\">To blog</Link>\")))), mdx(\"li\", {\n    parentName: \"ul\"\n  }, mdx(\"p\", {\n    parentName: \"li\"\n  }, mdx(\"strong\", {\n    parentName: \"p\"\n  }, \"Anchor within the post & URL outside the website\")), mdx(\"p\", {\n    parentName: \"li\"\n  }, \"Use \", mdx(\"code\", {\n    parentName: \"p\",\n    \"className\": \"language-text\"\n  }, \"a\"), \" tag, add \", mdx(\"strong\", {\n    parentName: \"p\"\n  }, \"anchor\"), \" keyword to the tag if the link is within the post.\"), mdx(\"div\", {\n    parentName: \"li\",\n    \"className\": \"gatsby-highlight\",\n    \"data-language\": \"html\"\n  }, mdx(\"pre\", {\n    parentName: \"div\",\n    \"style\": {\n      \"counterReset\": \"linenumber NaN\"\n    },\n    \"className\": \"language-html line-numbers\"\n  }, mdx(\"code\", {\n    parentName: \"pre\",\n    \"className\": \"language-html\"\n  }, \"Anchor:\\n\", mdx(\"span\", {\n    parentName: \"code\",\n    \"className\": \"token tag\"\n  }, mdx(\"span\", {\n    parentName: \"span\",\n    \"className\": \"token tag\"\n  }, mdx(\"span\", {\n    parentName: \"span\",\n    \"className\": \"token punctuation\"\n  }, \"<\"), \"a\"), \" \", mdx(\"span\", {\n    parentName: \"span\",\n    \"className\": \"token attr-name\"\n  }, \"href\"), mdx(\"span\", {\n    parentName: \"span\",\n    \"className\": \"token attr-value\"\n  }, mdx(\"span\", {\n    parentName: \"span\",\n    \"className\": \"token punctuation attr-equals\"\n  }, \"=\"), mdx(\"span\", {\n    parentName: \"span\",\n    \"className\": \"token punctuation\"\n  }, \"\\\"\"), \"#anchorLink\", mdx(\"span\", {\n    parentName: \"span\",\n    \"className\": \"token punctuation\"\n  }, \"\\\"\")), \" \", mdx(\"span\", {\n    parentName: \"span\",\n    \"className\": \"token attr-name\"\n  }, \"anchor\"), mdx(\"span\", {\n    parentName: \"span\",\n    \"className\": \"token punctuation\"\n  }, \">\")), \"Link within the post\", mdx(\"span\", {\n    parentName: \"code\",\n    \"className\": \"token tag\"\n  }, mdx(\"span\", {\n    parentName: \"span\",\n    \"className\": \"token tag\"\n  }, mdx(\"span\", {\n    parentName: \"span\",\n    \"className\": \"token punctuation\"\n  }, \"</\"), \"a\"), mdx(\"span\", {\n    parentName: \"span\",\n    \"className\": \"token punctuation\"\n  }, \">\")), \"\\n\\nExternal:\\n\", mdx(\"span\", {\n    parentName: \"code\",\n    \"className\": \"token tag\"\n  }, mdx(\"span\", {\n    parentName: \"span\",\n    \"className\": \"token tag\"\n  }, mdx(\"span\", {\n    parentName: \"span\",\n    \"className\": \"token punctuation\"\n  }, \"<\"), \"a\"), \" \", mdx(\"span\", {\n    parentName: \"span\",\n    \"className\": \"token attr-name\"\n  }, \"href\"), mdx(\"span\", {\n    parentName: \"span\",\n    \"className\": \"token attr-value\"\n  }, mdx(\"span\", {\n    parentName: \"span\",\n    \"className\": \"token punctuation attr-equals\"\n  }, \"=\"), mdx(\"span\", {\n    parentName: \"span\",\n    \"className\": \"token punctuation\"\n  }, \"\\\"\"), \"https://tailwindcss.com/docs/width\", mdx(\"span\", {\n    parentName: \"span\",\n    \"className\": \"token punctuation\"\n  }, \"\\\"\")), mdx(\"span\", {\n    parentName: \"span\",\n    \"className\": \"token punctuation\"\n  }, \">\")), \"tailwindCSS\", mdx(\"span\", {\n    parentName: \"code\",\n    \"className\": \"token tag\"\n  }, mdx(\"span\", {\n    parentName: \"span\",\n    \"className\": \"token tag\"\n  }, mdx(\"span\", {\n    parentName: \"span\",\n    \"className\": \"token punctuation\"\n  }, \"</\"), \"a\"), mdx(\"span\", {\n    parentName: \"span\",\n    \"className\": \"token punctuation\"\n  }, \">\")), \"\\nor [tailwindCSS](https://tailwindcss.com/docs/width)\"), mdx(\"span\", {\n    parentName: \"pre\",\n    \"aria-hidden\": \"true\",\n    \"className\": \"line-numbers-rows\",\n    \"style\": {\n      \"whiteSpace\": \"normal\",\n      \"width\": \"auto\",\n      \"left\": \"0\"\n    }\n  }, mdx(\"span\", {\n    parentName: \"span\"\n  }), mdx(\"span\", {\n    parentName: \"span\"\n  }), mdx(\"span\", {\n    parentName: \"span\"\n  }), mdx(\"span\", {\n    parentName: \"span\"\n  }), mdx(\"span\", {\n    parentName: \"span\"\n  }), mdx(\"span\", {\n    parentName: \"span\"\n  })))))), mdx(\"h1\", {\n    \"id\": \"tex-math\",\n    \"style\": {\n      \"position\": \"relative\"\n    }\n  }, mdx(\"a\", {\n    parentName: \"h1\",\n    \"href\": \"#tex-math\",\n    \"aria-label\": \"tex math permalink\",\n    \"className\": \"anchor before\"\n  }, mdx(\"undefined\", {\n    parentName: \"a\"\n  })), \"TeX math\"), mdx(\"p\", null, \"There are two ways to write math formulas and math symbols. For inline mode, surround your equation with $ to generate a math equation.\"), mdx(\"div\", {\n    \"className\": \"gatsby-highlight\",\n    \"data-language\": \"text\"\n  }, mdx(\"pre\", {\n    parentName: \"div\",\n    \"style\": {\n      \"counterReset\": \"linenumber NaN\"\n    },\n    \"className\": \"language-text line-numbers\"\n  }, mdx(\"code\", {\n    parentName: \"pre\",\n    \"className\": \"language-text\"\n  }, \"$a^2 + b^2 = c^2$\"), mdx(\"span\", {\n    parentName: \"pre\",\n    \"aria-hidden\": \"true\",\n    \"className\": \"line-numbers-rows\",\n    \"style\": {\n      \"whiteSpace\": \"normal\",\n      \"width\": \"auto\",\n      \"left\": \"0\"\n    }\n  }, mdx(\"span\", {\n    parentName: \"span\"\n  })))), mdx(\"p\", null, \"generates \", mdx(\"span\", {\n    parentName: \"p\",\n    \"className\": \"math math-inline\"\n  }, mdx(\"span\", {\n    parentName: \"span\",\n    \"className\": \"katex\"\n  }, mdx(\"span\", {\n    parentName: \"span\",\n    \"className\": \"katex-mathml\"\n  }, mdx(\"math\", {\n    parentName: \"span\",\n    \"xmlns\": \"http://www.w3.org/1998/Math/MathML\"\n  }, mdx(\"semantics\", {\n    parentName: \"math\"\n  }, mdx(\"mrow\", {\n    parentName: \"semantics\"\n  }, mdx(\"msup\", {\n    parentName: \"mrow\"\n  }, mdx(\"mi\", {\n    parentName: \"msup\"\n  }, \"a\"), mdx(\"mn\", {\n    parentName: \"msup\"\n  }, \"2\")), mdx(\"mo\", {\n    parentName: \"mrow\"\n  }, \"+\"), mdx(\"msup\", {\n    parentName: \"mrow\"\n  }, mdx(\"mi\", {\n    parentName: \"msup\"\n  }, \"b\"), mdx(\"mn\", {\n    parentName: \"msup\"\n  }, \"2\")), mdx(\"mo\", {\n    parentName: \"mrow\"\n  }, \"=\"), mdx(\"msup\", {\n    parentName: \"mrow\"\n  }, mdx(\"mi\", {\n    parentName: \"msup\"\n  }, \"c\"), mdx(\"mn\", {\n    parentName: \"msup\"\n  }, \"2\"))), mdx(\"annotation\", {\n    parentName: \"semantics\",\n    \"encoding\": \"application/x-tex\"\n  }, \"a^2 + b^2 = c^2\")))), mdx(\"span\", {\n    parentName: \"span\",\n    \"className\": \"katex-html\",\n    \"aria-hidden\": \"true\"\n  }, mdx(\"span\", {\n    parentName: \"span\",\n    \"className\": \"base\"\n  }, mdx(\"span\", {\n    parentName: \"span\",\n    \"className\": \"strut\",\n    \"style\": {\n      \"height\": \"0.8974em\",\n      \"verticalAlign\": \"-0.0833em\"\n    }\n  }), mdx(\"span\", {\n    parentName: \"span\",\n    \"className\": \"mord\"\n  }, mdx(\"span\", {\n    parentName: \"span\",\n    \"className\": \"mord mathnormal\"\n  }, \"a\"), mdx(\"span\", {\n    parentName: \"span\",\n    \"className\": \"msupsub\"\n  }, mdx(\"span\", {\n    parentName: \"span\",\n    \"className\": \"vlist-t\"\n  }, mdx(\"span\", {\n    parentName: \"span\",\n    \"className\": \"vlist-r\"\n  }, mdx(\"span\", {\n    parentName: \"span\",\n    \"className\": \"vlist\",\n    \"style\": {\n      \"height\": \"0.8141em\"\n    }\n  }, mdx(\"span\", {\n    parentName: \"span\",\n    \"style\": {\n      \"top\": \"-3.063em\",\n      \"marginRight\": \"0.05em\"\n    }\n  }, mdx(\"span\", {\n    parentName: \"span\",\n    \"className\": \"pstrut\",\n    \"style\": {\n      \"height\": \"2.7em\"\n    }\n  }), mdx(\"span\", {\n    parentName: \"span\",\n    \"className\": \"sizing reset-size6 size3 mtight\"\n  }, mdx(\"span\", {\n    parentName: \"span\",\n    \"className\": \"mord mtight\"\n  }, \"2\")))))))), mdx(\"span\", {\n    parentName: \"span\",\n    \"className\": \"mspace\",\n    \"style\": {\n      \"marginRight\": \"0.2222em\"\n    }\n  }), mdx(\"span\", {\n    parentName: \"span\",\n    \"className\": \"mbin\"\n  }, \"+\"), mdx(\"span\", {\n    parentName: \"span\",\n    \"className\": \"mspace\",\n    \"style\": {\n      \"marginRight\": \"0.2222em\"\n    }\n  })), mdx(\"span\", {\n    parentName: \"span\",\n    \"className\": \"base\"\n  }, mdx(\"span\", {\n    parentName: \"span\",\n    \"className\": \"strut\",\n    \"style\": {\n      \"height\": \"0.8141em\"\n    }\n  }), mdx(\"span\", {\n    parentName: \"span\",\n    \"className\": \"mord\"\n  }, mdx(\"span\", {\n    parentName: \"span\",\n    \"className\": \"mord mathnormal\"\n  }, \"b\"), mdx(\"span\", {\n    parentName: \"span\",\n    \"className\": \"msupsub\"\n  }, mdx(\"span\", {\n    parentName: \"span\",\n    \"className\": \"vlist-t\"\n  }, mdx(\"span\", {\n    parentName: \"span\",\n    \"className\": \"vlist-r\"\n  }, mdx(\"span\", {\n    parentName: \"span\",\n    \"className\": \"vlist\",\n    \"style\": {\n      \"height\": \"0.8141em\"\n    }\n  }, mdx(\"span\", {\n    parentName: \"span\",\n    \"style\": {\n      \"top\": \"-3.063em\",\n      \"marginRight\": \"0.05em\"\n    }\n  }, mdx(\"span\", {\n    parentName: \"span\",\n    \"className\": \"pstrut\",\n    \"style\": {\n      \"height\": \"2.7em\"\n    }\n  }), mdx(\"span\", {\n    parentName: \"span\",\n    \"className\": \"sizing reset-size6 size3 mtight\"\n  }, mdx(\"span\", {\n    parentName: \"span\",\n    \"className\": \"mord mtight\"\n  }, \"2\")))))))), mdx(\"span\", {\n    parentName: \"span\",\n    \"className\": \"mspace\",\n    \"style\": {\n      \"marginRight\": \"0.2778em\"\n    }\n  }), mdx(\"span\", {\n    parentName: \"span\",\n    \"className\": \"mrel\"\n  }, \"=\"), mdx(\"span\", {\n    parentName: \"span\",\n    \"className\": \"mspace\",\n    \"style\": {\n      \"marginRight\": \"0.2778em\"\n    }\n  })), mdx(\"span\", {\n    parentName: \"span\",\n    \"className\": \"base\"\n  }, mdx(\"span\", {\n    parentName: \"span\",\n    \"className\": \"strut\",\n    \"style\": {\n      \"height\": \"0.8141em\"\n    }\n  }), mdx(\"span\", {\n    parentName: \"span\",\n    \"className\": \"mord\"\n  }, mdx(\"span\", {\n    parentName: \"span\",\n    \"className\": \"mord mathnormal\"\n  }, \"c\"), mdx(\"span\", {\n    parentName: \"span\",\n    \"className\": \"msupsub\"\n  }, mdx(\"span\", {\n    parentName: \"span\",\n    \"className\": \"vlist-t\"\n  }, mdx(\"span\", {\n    parentName: \"span\",\n    \"className\": \"vlist-r\"\n  }, mdx(\"span\", {\n    parentName: \"span\",\n    \"className\": \"vlist\",\n    \"style\": {\n      \"height\": \"0.8141em\"\n    }\n  }, mdx(\"span\", {\n    parentName: \"span\",\n    \"style\": {\n      \"top\": \"-3.063em\",\n      \"marginRight\": \"0.05em\"\n    }\n  }, mdx(\"span\", {\n    parentName: \"span\",\n    \"className\": \"pstrut\",\n    \"style\": {\n      \"height\": \"2.7em\"\n    }\n  }), mdx(\"span\", {\n    parentName: \"span\",\n    \"className\": \"sizing reset-size6 size3 mtight\"\n  }, mdx(\"span\", {\n    parentName: \"span\",\n    \"className\": \"mord mtight\"\n  }, \"2\")))))))))))), \".\"), mdx(\"p\", null, \"For display mode, surround your equation with $$ and new-lines to generate a math equation.\"), mdx(\"div\", {\n    \"className\": \"gatsby-highlight\",\n    \"data-language\": \"text\"\n  }, mdx(\"pre\", {\n    parentName: \"div\",\n    \"style\": {\n      \"counterReset\": \"linenumber NaN\"\n    },\n    \"className\": \"language-text line-numbers\"\n  }, mdx(\"code\", {\n    parentName: \"pre\",\n    \"className\": \"language-text\"\n  }, \"$$\\n\\\\frac{1}{\\\\sigma \\\\sqrt{2 \\\\pi}} e^{-\\\\frac{1}{2}(\\\\frac{x- \\\\mu}{\\\\sigma})^{2}}\\n$$\"), mdx(\"span\", {\n    parentName: \"pre\",\n    \"aria-hidden\": \"true\",\n    \"className\": \"line-numbers-rows\",\n    \"style\": {\n      \"whiteSpace\": \"normal\",\n      \"width\": \"auto\",\n      \"left\": \"0\"\n    }\n  }, mdx(\"span\", {\n    parentName: \"span\"\n  }), mdx(\"span\", {\n    parentName: \"span\"\n  }), mdx(\"span\", {\n    parentName: \"span\"\n  })))), mdx(\"p\", null, \"generates\"), mdx(\"div\", {\n    \"className\": \"math math-display\"\n  }, mdx(\"span\", {\n    parentName: \"div\",\n    \"className\": \"katex-display\"\n  }, mdx(\"span\", {\n    parentName: \"span\",\n    \"className\": \"katex\"\n  }, mdx(\"span\", {\n    parentName: \"span\",\n    \"className\": \"katex-mathml\"\n  }, mdx(\"math\", {\n    parentName: \"span\",\n    \"xmlns\": \"http://www.w3.org/1998/Math/MathML\",\n    \"display\": \"block\"\n  }, mdx(\"semantics\", {\n    parentName: \"math\"\n  }, mdx(\"mrow\", {\n    parentName: \"semantics\"\n  }, mdx(\"mfrac\", {\n    parentName: \"mrow\"\n  }, mdx(\"mn\", {\n    parentName: \"mfrac\"\n  }, \"1\"), mdx(\"mrow\", {\n    parentName: \"mfrac\"\n  }, mdx(\"mi\", {\n    parentName: \"mrow\"\n  }, \"\\u03C3\"), mdx(\"msqrt\", {\n    parentName: \"mrow\"\n  }, mdx(\"mrow\", {\n    parentName: \"msqrt\"\n  }, mdx(\"mn\", {\n    parentName: \"mrow\"\n  }, \"2\"), mdx(\"mi\", {\n    parentName: \"mrow\"\n  }, \"\\u03C0\"))))), mdx(\"msup\", {\n    parentName: \"mrow\"\n  }, mdx(\"mi\", {\n    parentName: \"msup\"\n  }, \"e\"), mdx(\"mrow\", {\n    parentName: \"msup\"\n  }, mdx(\"mo\", {\n    parentName: \"mrow\"\n  }, \"\\u2212\"), mdx(\"mfrac\", {\n    parentName: \"mrow\"\n  }, mdx(\"mn\", {\n    parentName: \"mfrac\"\n  }, \"1\"), mdx(\"mn\", {\n    parentName: \"mfrac\"\n  }, \"2\")), mdx(\"mo\", {\n    parentName: \"mrow\",\n    \"stretchy\": \"false\"\n  }, \"(\"), mdx(\"mfrac\", {\n    parentName: \"mrow\"\n  }, mdx(\"mrow\", {\n    parentName: \"mfrac\"\n  }, mdx(\"mi\", {\n    parentName: \"mrow\"\n  }, \"x\"), mdx(\"mo\", {\n    parentName: \"mrow\"\n  }, \"\\u2212\"), mdx(\"mi\", {\n    parentName: \"mrow\"\n  }, \"\\u03BC\")), mdx(\"mi\", {\n    parentName: \"mfrac\"\n  }, \"\\u03C3\")), mdx(\"msup\", {\n    parentName: \"mrow\"\n  }, mdx(\"mo\", {\n    parentName: \"msup\",\n    \"stretchy\": \"false\"\n  }, \")\"), mdx(\"mn\", {\n    parentName: \"msup\"\n  }, \"2\"))))), mdx(\"annotation\", {\n    parentName: \"semantics\",\n    \"encoding\": \"application/x-tex\"\n  }, \"\\\\frac{1}{\\\\sigma \\\\sqrt{2 \\\\pi}} e^{-\\\\frac{1}{2}(\\\\frac{x- \\\\mu}{\\\\sigma})^{2}}\")))), mdx(\"span\", {\n    parentName: \"span\",\n    \"className\": \"katex-html\",\n    \"aria-hidden\": \"true\"\n  }, mdx(\"span\", {\n    parentName: \"span\",\n    \"className\": \"base\"\n  }, mdx(\"span\", {\n    parentName: \"span\",\n    \"className\": \"strut\",\n    \"style\": {\n      \"height\": \"2.2514em\",\n      \"verticalAlign\": \"-0.93em\"\n    }\n  }), mdx(\"span\", {\n    parentName: \"span\",\n    \"className\": \"mord\"\n  }, mdx(\"span\", {\n    parentName: \"span\",\n    \"className\": \"mopen nulldelimiter\"\n  }), mdx(\"span\", {\n    parentName: \"span\",\n    \"className\": \"mfrac\"\n  }, mdx(\"span\", {\n    parentName: \"span\",\n    \"className\": \"vlist-t vlist-t2\"\n  }, mdx(\"span\", {\n    parentName: \"span\",\n    \"className\": \"vlist-r\"\n  }, mdx(\"span\", {\n    parentName: \"span\",\n    \"className\": \"vlist\",\n    \"style\": {\n      \"height\": \"1.3214em\"\n    }\n  }, mdx(\"span\", {\n    parentName: \"span\",\n    \"style\": {\n      \"top\": \"-2.2028em\"\n    }\n  }, mdx(\"span\", {\n    parentName: \"span\",\n    \"className\": \"pstrut\",\n    \"style\": {\n      \"height\": \"3em\"\n    }\n  }), mdx(\"span\", {\n    parentName: \"span\",\n    \"className\": \"mord\"\n  }, mdx(\"span\", {\n    parentName: \"span\",\n    \"className\": \"mord mathnormal\",\n    \"style\": {\n      \"marginRight\": \"0.03588em\"\n    }\n  }, \"\\u03C3\"), mdx(\"span\", {\n    parentName: \"span\",\n    \"className\": \"mord sqrt\"\n  }, mdx(\"span\", {\n    parentName: \"span\",\n    \"className\": \"vlist-t vlist-t2\"\n  }, mdx(\"span\", {\n    parentName: \"span\",\n    \"className\": \"vlist-r\"\n  }, mdx(\"span\", {\n    parentName: \"span\",\n    \"className\": \"vlist\",\n    \"style\": {\n      \"height\": \"0.9072em\"\n    }\n  }, mdx(\"span\", {\n    parentName: \"span\",\n    \"className\": \"svg-align\",\n    \"style\": {\n      \"top\": \"-3em\"\n    }\n  }, mdx(\"span\", {\n    parentName: \"span\",\n    \"className\": \"pstrut\",\n    \"style\": {\n      \"height\": \"3em\"\n    }\n  }), mdx(\"span\", {\n    parentName: \"span\",\n    \"className\": \"mord\",\n    \"style\": {\n      \"paddingLeft\": \"0.833em\"\n    }\n  }, mdx(\"span\", {\n    parentName: \"span\",\n    \"className\": \"mord\"\n  }, \"2\"), mdx(\"span\", {\n    parentName: \"span\",\n    \"className\": \"mord mathnormal\",\n    \"style\": {\n      \"marginRight\": \"0.03588em\"\n    }\n  }, \"\\u03C0\"))), mdx(\"span\", {\n    parentName: \"span\",\n    \"style\": {\n      \"top\": \"-2.8672em\"\n    }\n  }, mdx(\"span\", {\n    parentName: \"span\",\n    \"className\": \"pstrut\",\n    \"style\": {\n      \"height\": \"3em\"\n    }\n  }), mdx(\"span\", {\n    parentName: \"span\",\n    \"className\": \"hide-tail\",\n    \"style\": {\n      \"minWidth\": \"0.853em\",\n      \"height\": \"1.08em\"\n    }\n  }, mdx(\"svg\", {\n    parentName: \"span\",\n    \"xmlns\": \"http://www.w3.org/2000/svg\",\n    \"width\": \"400em\",\n    \"height\": \"1.08em\",\n    \"viewBox\": \"0 0 400000 1080\",\n    \"preserveAspectRatio\": \"xMinYMin slice\"\n  }, mdx(\"path\", {\n    parentName: \"svg\",\n    \"d\": \"M95,702\\nc-2.7,0,-7.17,-2.7,-13.5,-8c-5.8,-5.3,-9.5,-10,-9.5,-14\\nc0,-2,0.3,-3.3,1,-4c1.3,-2.7,23.83,-20.7,67.5,-54\\nc44.2,-33.3,65.8,-50.3,66.5,-51c1.3,-1.3,3,-2,5,-2c4.7,0,8.7,3.3,12,10\\ns173,378,173,378c0.7,0,35.3,-71,104,-213c68.7,-142,137.5,-285,206.5,-429\\nc69,-144,104.5,-217.7,106.5,-221\\nl0 -0\\nc5.3,-9.3,12,-14,20,-14\\nH400000v40H845.2724\\ns-225.272,467,-225.272,467s-235,486,-235,486c-2.7,4.7,-9,7,-19,7\\nc-6,0,-10,-1,-12,-3s-194,-422,-194,-422s-65,47,-65,47z\\nM834 80h400000v40h-400000z\"\n  }))))), mdx(\"span\", {\n    parentName: \"span\",\n    \"className\": \"vlist-s\"\n  }, \"\\u200B\")), mdx(\"span\", {\n    parentName: \"span\",\n    \"className\": \"vlist-r\"\n  }, mdx(\"span\", {\n    parentName: \"span\",\n    \"className\": \"vlist\",\n    \"style\": {\n      \"height\": \"0.1328em\"\n    }\n  }, mdx(\"span\", {\n    parentName: \"span\"\n  }))))))), mdx(\"span\", {\n    parentName: \"span\",\n    \"style\": {\n      \"top\": \"-3.23em\"\n    }\n  }, mdx(\"span\", {\n    parentName: \"span\",\n    \"className\": \"pstrut\",\n    \"style\": {\n      \"height\": \"3em\"\n    }\n  }), mdx(\"span\", {\n    parentName: \"span\",\n    \"className\": \"frac-line\",\n    \"style\": {\n      \"borderBottomWidth\": \"0.04em\"\n    }\n  })), mdx(\"span\", {\n    parentName: \"span\",\n    \"style\": {\n      \"top\": \"-3.677em\"\n    }\n  }, mdx(\"span\", {\n    parentName: \"span\",\n    \"className\": \"pstrut\",\n    \"style\": {\n      \"height\": \"3em\"\n    }\n  }), mdx(\"span\", {\n    parentName: \"span\",\n    \"className\": \"mord\"\n  }, mdx(\"span\", {\n    parentName: \"span\",\n    \"className\": \"mord\"\n  }, \"1\")))), mdx(\"span\", {\n    parentName: \"span\",\n    \"className\": \"vlist-s\"\n  }, \"\\u200B\")), mdx(\"span\", {\n    parentName: \"span\",\n    \"className\": \"vlist-r\"\n  }, mdx(\"span\", {\n    parentName: \"span\",\n    \"className\": \"vlist\",\n    \"style\": {\n      \"height\": \"0.93em\"\n    }\n  }, mdx(\"span\", {\n    parentName: \"span\"\n  }))))), mdx(\"span\", {\n    parentName: \"span\",\n    \"className\": \"mclose nulldelimiter\"\n  })), mdx(\"span\", {\n    parentName: \"span\",\n    \"className\": \"mord\"\n  }, mdx(\"span\", {\n    parentName: \"span\",\n    \"className\": \"mord mathnormal\"\n  }, \"e\"), mdx(\"span\", {\n    parentName: \"span\",\n    \"className\": \"msupsub\"\n  }, mdx(\"span\", {\n    parentName: \"span\",\n    \"className\": \"vlist-t\"\n  }, mdx(\"span\", {\n    parentName: \"span\",\n    \"className\": \"vlist-r\"\n  }, mdx(\"span\", {\n    parentName: \"span\",\n    \"className\": \"vlist\",\n    \"style\": {\n      \"height\": \"1.0369em\"\n    }\n  }, mdx(\"span\", {\n    parentName: \"span\",\n    \"style\": {\n      \"top\": \"-3.413em\",\n      \"marginRight\": \"0.05em\"\n    }\n  }, mdx(\"span\", {\n    parentName: \"span\",\n    \"className\": \"pstrut\",\n    \"style\": {\n      \"height\": \"3em\"\n    }\n  }), mdx(\"span\", {\n    parentName: \"span\",\n    \"className\": \"sizing reset-size6 size3 mtight\"\n  }, mdx(\"span\", {\n    parentName: \"span\",\n    \"className\": \"mord mtight\"\n  }, mdx(\"span\", {\n    parentName: \"span\",\n    \"className\": \"mord mtight\"\n  }, \"\\u2212\"), mdx(\"span\", {\n    parentName: \"span\",\n    \"className\": \"mord mtight\"\n  }, mdx(\"span\", {\n    parentName: \"span\",\n    \"className\": \"mopen nulldelimiter sizing reset-size3 size6\"\n  }), mdx(\"span\", {\n    parentName: \"span\",\n    \"className\": \"mfrac\"\n  }, mdx(\"span\", {\n    parentName: \"span\",\n    \"className\": \"vlist-t vlist-t2\"\n  }, mdx(\"span\", {\n    parentName: \"span\",\n    \"className\": \"vlist-r\"\n  }, mdx(\"span\", {\n    parentName: \"span\",\n    \"className\": \"vlist\",\n    \"style\": {\n      \"height\": \"0.8443em\"\n    }\n  }, mdx(\"span\", {\n    parentName: \"span\",\n    \"style\": {\n      \"top\": \"-2.656em\"\n    }\n  }, mdx(\"span\", {\n    parentName: \"span\",\n    \"className\": \"pstrut\",\n    \"style\": {\n      \"height\": \"3em\"\n    }\n  }), mdx(\"span\", {\n    parentName: \"span\",\n    \"className\": \"sizing reset-size3 size1 mtight\"\n  }, mdx(\"span\", {\n    parentName: \"span\",\n    \"className\": \"mord mtight\"\n  }, mdx(\"span\", {\n    parentName: \"span\",\n    \"className\": \"mord mtight\"\n  }, \"2\")))), mdx(\"span\", {\n    parentName: \"span\",\n    \"style\": {\n      \"top\": \"-3.2255em\"\n    }\n  }, mdx(\"span\", {\n    parentName: \"span\",\n    \"className\": \"pstrut\",\n    \"style\": {\n      \"height\": \"3em\"\n    }\n  }), mdx(\"span\", {\n    parentName: \"span\",\n    \"className\": \"frac-line mtight\",\n    \"style\": {\n      \"borderBottomWidth\": \"0.049em\"\n    }\n  })), mdx(\"span\", {\n    parentName: \"span\",\n    \"style\": {\n      \"top\": \"-3.384em\"\n    }\n  }, mdx(\"span\", {\n    parentName: \"span\",\n    \"className\": \"pstrut\",\n    \"style\": {\n      \"height\": \"3em\"\n    }\n  }), mdx(\"span\", {\n    parentName: \"span\",\n    \"className\": \"sizing reset-size3 size1 mtight\"\n  }, mdx(\"span\", {\n    parentName: \"span\",\n    \"className\": \"mord mtight\"\n  }, mdx(\"span\", {\n    parentName: \"span\",\n    \"className\": \"mord mtight\"\n  }, \"1\"))))), mdx(\"span\", {\n    parentName: \"span\",\n    \"className\": \"vlist-s\"\n  }, \"\\u200B\")), mdx(\"span\", {\n    parentName: \"span\",\n    \"className\": \"vlist-r\"\n  }, mdx(\"span\", {\n    parentName: \"span\",\n    \"className\": \"vlist\",\n    \"style\": {\n      \"height\": \"0.344em\"\n    }\n  }, mdx(\"span\", {\n    parentName: \"span\"\n  }))))), mdx(\"span\", {\n    parentName: \"span\",\n    \"className\": \"mclose nulldelimiter sizing reset-size3 size6\"\n  })), mdx(\"span\", {\n    parentName: \"span\",\n    \"className\": \"mopen mtight\"\n  }, \"(\"), mdx(\"span\", {\n    parentName: \"span\",\n    \"className\": \"mord mtight\"\n  }, mdx(\"span\", {\n    parentName: \"span\",\n    \"className\": \"mopen nulldelimiter sizing reset-size3 size6\"\n  }), mdx(\"span\", {\n    parentName: \"span\",\n    \"className\": \"mfrac\"\n  }, mdx(\"span\", {\n    parentName: \"span\",\n    \"className\": \"vlist-t vlist-t2\"\n  }, mdx(\"span\", {\n    parentName: \"span\",\n    \"className\": \"vlist-r\"\n  }, mdx(\"span\", {\n    parentName: \"span\",\n    \"className\": \"vlist\",\n    \"style\": {\n      \"height\": \"0.879em\"\n    }\n  }, mdx(\"span\", {\n    parentName: \"span\",\n    \"style\": {\n      \"top\": \"-2.656em\"\n    }\n  }, mdx(\"span\", {\n    parentName: \"span\",\n    \"className\": \"pstrut\",\n    \"style\": {\n      \"height\": \"3em\"\n    }\n  }), mdx(\"span\", {\n    parentName: \"span\",\n    \"className\": \"sizing reset-size3 size1 mtight\"\n  }, mdx(\"span\", {\n    parentName: \"span\",\n    \"className\": \"mord mtight\"\n  }, mdx(\"span\", {\n    parentName: \"span\",\n    \"className\": \"mord mathnormal mtight\",\n    \"style\": {\n      \"marginRight\": \"0.03588em\"\n    }\n  }, \"\\u03C3\")))), mdx(\"span\", {\n    parentName: \"span\",\n    \"style\": {\n      \"top\": \"-3.2255em\"\n    }\n  }, mdx(\"span\", {\n    parentName: \"span\",\n    \"className\": \"pstrut\",\n    \"style\": {\n      \"height\": \"3em\"\n    }\n  }), mdx(\"span\", {\n    parentName: \"span\",\n    \"className\": \"frac-line mtight\",\n    \"style\": {\n      \"borderBottomWidth\": \"0.049em\"\n    }\n  })), mdx(\"span\", {\n    parentName: \"span\",\n    \"style\": {\n      \"top\": \"-3.4624em\"\n    }\n  }, mdx(\"span\", {\n    parentName: \"span\",\n    \"className\": \"pstrut\",\n    \"style\": {\n      \"height\": \"3em\"\n    }\n  }), mdx(\"span\", {\n    parentName: \"span\",\n    \"className\": \"sizing reset-size3 size1 mtight\"\n  }, mdx(\"span\", {\n    parentName: \"span\",\n    \"className\": \"mord mtight\"\n  }, mdx(\"span\", {\n    parentName: \"span\",\n    \"className\": \"mord mathnormal mtight\"\n  }, \"x\"), mdx(\"span\", {\n    parentName: \"span\",\n    \"className\": \"mbin mtight\"\n  }, \"\\u2212\"), mdx(\"span\", {\n    parentName: \"span\",\n    \"className\": \"mord mathnormal mtight\"\n  }, \"\\u03BC\"))))), mdx(\"span\", {\n    parentName: \"span\",\n    \"className\": \"vlist-s\"\n  }, \"\\u200B\")), mdx(\"span\", {\n    parentName: \"span\",\n    \"className\": \"vlist-r\"\n  }, mdx(\"span\", {\n    parentName: \"span\",\n    \"className\": \"vlist\",\n    \"style\": {\n      \"height\": \"0.344em\"\n    }\n  }, mdx(\"span\", {\n    parentName: \"span\"\n  }))))), mdx(\"span\", {\n    parentName: \"span\",\n    \"className\": \"mclose nulldelimiter sizing reset-size3 size6\"\n  })), mdx(\"span\", {\n    parentName: \"span\",\n    \"className\": \"mclose mtight\"\n  }, mdx(\"span\", {\n    parentName: \"span\",\n    \"className\": \"mclose mtight\"\n  }, \")\"), mdx(\"span\", {\n    parentName: \"span\",\n    \"className\": \"msupsub\"\n  }, mdx(\"span\", {\n    parentName: \"span\",\n    \"className\": \"vlist-t\"\n  }, mdx(\"span\", {\n    parentName: \"span\",\n    \"className\": \"vlist-r\"\n  }, mdx(\"span\", {\n    parentName: \"span\",\n    \"className\": \"vlist\",\n    \"style\": {\n      \"height\": \"0.8913em\"\n    }\n  }, mdx(\"span\", {\n    parentName: \"span\",\n    \"style\": {\n      \"top\": \"-2.931em\",\n      \"marginRight\": \"0.0714em\"\n    }\n  }, mdx(\"span\", {\n    parentName: \"span\",\n    \"className\": \"pstrut\",\n    \"style\": {\n      \"height\": \"2.5em\"\n    }\n  }), mdx(\"span\", {\n    parentName: \"span\",\n    \"className\": \"sizing reset-size3 size1 mtight\"\n  }, mdx(\"span\", {\n    parentName: \"span\",\n    \"className\": \"mord mtight\"\n  }, mdx(\"span\", {\n    parentName: \"span\",\n    \"className\": \"mord mtight\"\n  }, \"2\")))))))))))))))))))))));\n}\n;\nMDXContent.isMDXComponent = true;","tableOfContents":{"items":[{"url":"#introduction","title":"Introduction"},{"url":"#setup","title":"Setup","items":[{"url":"#installation","title":"Installation"}]},{"url":"#write-a-post","title":"Write a post","items":[{"url":"#upload-via-githubcom","title":"Upload via github.com"}]},{"url":"#table-of-content","title":"Table of content"},{"url":"#styling","title":"Styling"},{"url":"#accordion","title":"Accordion"},{"url":"#code","title":"Code"},{"url":"#d3js","title":"D3.js"},{"url":"#embed-well-known-services","title":"Embed well known services"},{"url":"#files","title":"Files"},{"url":"#image","title":"Image"},{"url":"#link","title":"Link"},{"url":"#tex-math","title":"TeX math"}]},"fields":{"slug":"/docs/22/03/2020/contribute-blog-post","readingTime":{"text":"13 min read"},"slugOrigin":"/2020-03-22-contribute-blog-post/"},"frontmatter":{"type":"docs","title":"Contribute blog posts","date":"22 March 2020","description":"(UPDATED on 21 Apr 2021) This article will guide you to setup a development environment, relevant steps for produce a blog post, and introduce you to useful syntax for styling the blog post and adding resources such as images, videos, and codes.","tag":null,"category":null,"featured":false,"thumbnail":{"childImageSharp":{"gatsbyImageData":{"layout":"fullWidth","backgroundColor":"#282828","images":{"fallback":{"src":"/static/b4cbf28e22e521e30c82125257f309ca/a764f/temp.jpg","srcSet":"/static/b4cbf28e22e521e30c82125257f309ca/37bba/temp.jpg 750w,\n/static/b4cbf28e22e521e30c82125257f309ca/61c72/temp.jpg 1080w,\n/static/b4cbf28e22e521e30c82125257f309ca/d61e8/temp.jpg 1366w,\n/static/b4cbf28e22e521e30c82125257f309ca/a764f/temp.jpg 1920w","sizes":"100vw"},"sources":[{"srcSet":"/static/b4cbf28e22e521e30c82125257f309ca/a66aa/temp.webp 750w,\n/static/b4cbf28e22e521e30c82125257f309ca/65dd5/temp.webp 1080w,\n/static/b4cbf28e22e521e30c82125257f309ca/4fad6/temp.webp 1366w,\n/static/b4cbf28e22e521e30c82125257f309ca/c512e/temp.webp 1920w","type":"image/webp","sizes":"100vw"}]},"width":1,"height":0.5625}}},"author":[{"name":"Yu Liang Weng","avatar":{"childImageSharp":{"gatsbyImageData":{"layout":"fullWidth","backgroundColor":"#f8f8f8","images":{"fallback":{"src":"/static/0b4fd531c4d7e2b13cad834b37cad1fc/28b02/Y.L_Weng.jpg","srcSet":"/static/0b4fd531c4d7e2b13cad834b37cad1fc/28b02/Y.L_Weng.jpg 591w","sizes":"100vw"},"sources":[{"srcSet":"/static/0b4fd531c4d7e2b13cad834b37cad1fc/dacf8/Y.L_Weng.webp 591w","type":"image/webp","sizes":"100vw"}]},"width":1,"height":0.9475465313028765}}}}],"disableTOC":false,"d3":["https://unpkg.com/topojson@3","dataviz.js"]}}},"pageContext":{"id":"a9d942dc-8d84-56c0-9ed7-744ef1d87843","slug":"/docs/22/03/2020/contribute-blog-post","prev":{"node":{"id":"2ba8ebba-de53-5ab0-be62-a29e0f060f23","fields":{"slug":"/docs/22/03/2020/datavizhub-guide"},"frontmatter":{"template":"custom","title":"Data Visualisation","date":"Sunday 22nd March 2020","category":null,"tag":null,"d3":null,"type":"docs","published":null}}}}},"staticQueryHashes":["160810946","3815917638","3976606562"]}