{
    "componentChunkName": "component---src-templates-docs-docs-template-jsx",
    "path": "/docs/18/03/2021/LearningPath-Statistical-Modeling-2",
    "result": {"data":{"mdx":{"id":"e22e0478-5c30-5fcc-a5ba-f865e170f1f5","body":"var _excluded = [\"components\"];\n\nfunction _extends() { _extends = Object.assign || function (target) { for (var i = 1; i < arguments.length; i++) { var source = arguments[i]; for (var key in source) { if (Object.prototype.hasOwnProperty.call(source, key)) { target[key] = source[key]; } } } return target; }; return _extends.apply(this, arguments); }\n\nfunction _objectWithoutProperties(source, excluded) { if (source == null) return {}; var target = _objectWithoutPropertiesLoose(source, excluded); var key, i; if (Object.getOwnPropertySymbols) { var sourceSymbolKeys = Object.getOwnPropertySymbols(source); for (i = 0; i < sourceSymbolKeys.length; i++) { key = sourceSymbolKeys[i]; if (excluded.indexOf(key) >= 0) continue; if (!Object.prototype.propertyIsEnumerable.call(source, key)) continue; target[key] = source[key]; } } return target; }\n\nfunction _objectWithoutPropertiesLoose(source, excluded) { if (source == null) return {}; var target = {}; var sourceKeys = Object.keys(source); var key, i; for (i = 0; i < sourceKeys.length; i++) { key = sourceKeys[i]; if (excluded.indexOf(key) >= 0) continue; target[key] = source[key]; } return target; }\n\n/* @jsxRuntime classic */\n\n/* @jsx mdx */\nvar _frontmatter = {\n  \"type\": \"docs\",\n  \"author\": [\"Dataviz Team\", \"Jean Russell\"],\n  \"title\": \"Sampling\",\n  \"thumbnail\": null,\n  \"description\": \"Statistical Modeling Part 2 - What is sampling? Sampling from a distribution? How to describe a sample?\",\n  \"date\": \"2021-03-18T00:00:00.000Z\"\n};\n\nvar makeShortcode = function makeShortcode(name) {\n  return function MDXDefaultShortcode(props) {\n    console.warn(\"Component \" + name + \" was not imported, exported, or provided by MDXProvider as global scope\");\n    return mdx(\"div\", props);\n  };\n};\n\nvar Link = makeShortcode(\"Link\");\nvar Accordion = makeShortcode(\"Accordion\");\nvar AccordionItem = makeShortcode(\"AccordionItem\");\nvar AccordionItemHeading = makeShortcode(\"AccordionItemHeading\");\nvar AccordionItemButton = makeShortcode(\"AccordionItemButton\");\nvar AccordionItemPanel = makeShortcode(\"AccordionItemPanel\");\nvar layoutProps = {\n  _frontmatter: _frontmatter\n};\nvar MDXLayout = \"wrapper\";\nreturn function MDXContent(_ref) {\n  var components = _ref.components,\n      props = _objectWithoutProperties(_ref, _excluded);\n\n  return mdx(MDXLayout, _extends({}, layoutProps, props, {\n    components: components,\n    mdxType: \"MDXLayout\"\n  }), mdx(\"h2\", {\n    \"id\": \"introduction\",\n    \"style\": {\n      \"position\": \"relative\"\n    }\n  }, mdx(\"a\", {\n    parentName: \"h2\",\n    \"href\": \"#introduction\",\n    \"aria-label\": \"introduction permalink\",\n    \"className\": \"anchor before\"\n  }, mdx(\"undefined\", {\n    parentName: \"a\"\n  })), \"Introduction\"), mdx(\"p\", null, \"Sampling is the process of selecting a number of individuals to study from the entire population. In practice, it is often impractical if not infeasible to get hold of many entire populations due to many reasons such as the scale, time, and cost. A typical situation when it is impossible is when the population is theoretically infinite such as all the 5 year old cats in the world throughout time. However, even a finite population can take too long or be too expensive such as every household in Sheffield on a specific date. One of the most recent examples is the national census 2021 which is very complicated and time consuming. The answer is therefore to sample.\"), mdx(\"p\", null, \"There are two types of sampling: random sampling and non-random sampling (you can also refer them as probability sampling and non-probability sampling). The former refers to sampling methods that draws samples from the population in accordance with the principle of randomisation where it does not carry any subjectivity. The latter are methods of extracting samples based on the researcher's opinions, experience, or relevant knowledge, therefore is subjective. Typical methods are convenience sampling, Voluntary sampling, snowball sampling, and selective sampling.  \"), mdx(\"p\", null, \"There are some key points to consider before building a model because we would like the characteristic of samples to be as close to the population as possible. We should always try our best to avoid sampling bias, reduce sampling error, and yield a true representative sample of the population. \"), mdx(\"p\", null, \"In this material we will be looking at two sampling methods and ways to describe a sample. If you are also interested in how to sampling from a distribution using computational methods, visit the optional chapter \", mdx(Link, {\n    to: \"/docs/18/03/2021/LearningPath-Statistical-Modeling-2-optional\",\n    mdxType: \"Link\"\n  }, \"Sampling - Computational Statistics\"), \".  \"), mdx(\"h2\", {\n    \"id\": \"prerequisites\",\n    \"style\": {\n      \"position\": \"relative\"\n    }\n  }, mdx(\"a\", {\n    parentName: \"h2\",\n    \"href\": \"#prerequisites\",\n    \"aria-label\": \"prerequisites permalink\",\n    \"className\": \"anchor before\"\n  }, mdx(\"undefined\", {\n    parentName: \"a\"\n  })), \"Prerequisites\"), mdx(\"div\", {\n    className: \"bg-white shadow-md p-3 md:p-5 rounded-3xl text-base text-black border-1 border-gray-50\"\n  }, mdx(\"div\", null, mdx(\"span\", {\n    className: \"py-1 px-2 bg-shefYellow text-black hover:bg-yellow-400 transition duration-300 cursor-pointer text-base font-semibold rounded-md mr-3\"\n  }, \"Required\"), mdx(\"p\", {\n    className: \"mt-2\"\n  }, mdx(Link, {\n    to: \"/docs/18/03/2021/LearningPath-Statistical-Modeling-1\",\n    mdxType: \"Link\"\n  }, \"Probability Distributions\"))), mdx(\"div\", {\n    className: \"mt-6\"\n  }, mdx(\"span\", {\n    className: \"py-1 px-2 text-white bg-shefGreen hover:bg-green-700 transition duration-300 cursor-pointer text-base font-semibold rounded-md mr-3\"\n  }, \"Recommended\"), mdx(\"p\", {\n    className: \"mt-2\"\n  }, \"Mean, Median, Mode, Range, Standard Deviation, Z-Score\")), mdx(\"div\", {\n    className: \"mt-6\"\n  }, mdx(\"span\", {\n    className: \"py-1 px-2 text-white bg-shefBlue hover:bg-blue-900 transition duration-300 cursor-pointer text-base font-semibold rounded-md mr-3\"\n  }, \"Optional\"), mdx(\"p\", {\n    className: \"mb-0 mt-2\"\n  }, \"None\"))), mdx(\"h2\", {\n    \"id\": \"two-basic-sampling-methods\",\n    \"style\": {\n      \"position\": \"relative\"\n    }\n  }, mdx(\"a\", {\n    parentName: \"h2\",\n    \"href\": \"#two-basic-sampling-methods\",\n    \"aria-label\": \"two basic sampling methods permalink\",\n    \"className\": \"anchor before\"\n  }, mdx(\"undefined\", {\n    parentName: \"a\"\n  })), \"Two basic sampling methods\"), mdx(\"p\", null, \"In this section we will introduce you to two sampling methods - simple random sampling and selective sampling. If you would like to know other sampling methods, You might be interested in \", mdx(Link, {\n    to: \"/docs/18/03/2021/LearningPath-Statistical-Modeling-2-more-random-sampling\",\n    mdxType: \"Link\"\n  }, \"random sampling\"), \" and \", mdx(Link, {\n    to: \"/docs/18/03/2021/LearningPath-Statistical-Modeling-2-non-random-sampling\",\n    mdxType: \"Link\"\n  }, \"non-random sampling\"), \".\"), mdx(\"h3\", {\n    \"id\": \"simple-random\",\n    \"style\": {\n      \"position\": \"relative\"\n    }\n  }, mdx(\"a\", {\n    parentName: \"h3\",\n    \"href\": \"#simple-random\",\n    \"aria-label\": \"simple random permalink\",\n    \"className\": \"anchor before\"\n  }, mdx(\"undefined\", {\n    parentName: \"a\"\n  })), \"Simple random\"), mdx(\"p\", null, \"The simple random sampling (and every other random sampling methods) ensures individuals in the population have equal probability of getting chosen. To ensure randomness, we usually assign individuals a unique number beforehand and use computers to generate random numbers, then choose individuals according to the generated number. However, very few sampling processes meet this criteria (equal probability). One reason is that in order to achieve you will need to have a listing for every single member of the population. There is therefore usually some systematic element to the sampling in a study.  \"), mdx(\"p\", null, mdx(\"strong\", {\n    parentName: \"p\"\n  }, \"Disadvantages\"), \": every individual is chosen at random but sometimes there is no way to ensure we have a representative sample for all subgroups.\"), mdx(\"h3\", {\n    \"id\": \"selective\",\n    \"style\": {\n      \"position\": \"relative\"\n    }\n  }, mdx(\"a\", {\n    parentName: \"h3\",\n    \"href\": \"#selective\",\n    \"aria-label\": \"selective permalink\",\n    \"className\": \"anchor before\"\n  }, mdx(\"undefined\", {\n    parentName: \"a\"\n  })), \"Selective\"), mdx(\"p\", null, \"The opposite to random sampling is selective sampling. Selective (or purposive, judgemental) sampling refers to when the researcher is familiar with his/her research field and has a good understanding of the overall survey, then a highly representative sample may be obtained by selecting objects/individuals entirely based on experiences. This sampling method is mostly used when the population is small and the internal differences are large, and when the overall boundary cannot be determined or because resources are limited. For example, a company wishes to investigate the tourism market in England, relevant departments select tourist spots such as London, Oxford, Cambridge, and York.  \"), mdx(\"p\", null, mdx(\"strong\", {\n    parentName: \"p\"\n  }, \"Disadvantages\"), \": Sample is greatly affected by the tendency of the researcher. If the subjective judgment is biased, it is easy to cause sampling bias. In addition, samples are not suitable to infer the overall population.  \"), mdx(\"p\", null, \"Here are two thought scenarioes we want you to take: \"), mdx(Accordion, {\n    allowZeroExpanded: \"true\",\n    mdxType: \"Accordion\"\n  }, mdx(AccordionItem, {\n    mdxType: \"AccordionItem\"\n  }, mdx(AccordionItemHeading, {\n    mdxType: \"AccordionItemHeading\"\n  }, mdx(AccordionItemButton, {\n    mdxType: \"AccordionItemButton\"\n  }, \"Scenario 1 - Compare men and women in various courses at the University\")), mdx(AccordionItemPanel, {\n    mdxType: \"AccordionItemPanel\"\n  }, mdx(\"b\", null, \"Q:\"), \" You want to compare men and women in various courses at the University but you also want to know average heights in each subject. So you decided to recruit equal numbers of men and women from each course. What problem does this have when providing the estimates?\", mdx(\"br\", null), mdx(\"br\", null), \"Hint: how many women are there normally on a physics degree?\", mdx(\"br\", null), mdx(\"br\", null), \"It is particularly useful to think about who is excluded from a sampling technique. For instance, weekday park users might be very different from weekend park users.\")), mdx(AccordionItem, {\n    mdxType: \"AccordionItem\"\n  }, mdx(AccordionItemHeading, {\n    mdxType: \"AccordionItemHeading\"\n  }, mdx(AccordionItemButton, {\n    mdxType: \"AccordionItemButton\"\n  }, \"Scenario 2 - Use Weibo to recruit overseas students to answer a survey\")), mdx(AccordionItemPanel, {\n    mdxType: \"AccordionItemPanel\"\n  }, mdx(\"b\", null, \"Q:\"), \" A Chinese student uses Weibo (a social media platform similar to Twitter) to recruit overseas students at Sheffield to answer a survey about International Students at Sheffield experience at the University. What problems would this make for sampling?\", mdx(\"br\", null), mdx(\"br\", null), \"Hint: How many students from Nigeria or Poland would be on Weibo?\"))), mdx(\"h3\", {\n    \"id\": \"online-sampling-tools\",\n    \"style\": {\n      \"position\": \"relative\"\n    }\n  }, mdx(\"a\", {\n    parentName: \"h3\",\n    \"href\": \"#online-sampling-tools\",\n    \"aria-label\": \"online sampling tools permalink\",\n    \"className\": \"anchor before\"\n  }, mdx(\"undefined\", {\n    parentName: \"a\"\n  })), \"Online sampling tools\"), mdx(\"p\", null, \"Tool No.1. \", mdx(\"a\", {\n    parentName: \"p\",\n    \"href\": \"https://onlinestatbook.com/stat_sim/sampling_dist/\"\n  }, \"This tool\"), \" provided by \", mdx(\"strong\", {\n    parentName: \"p\"\n  }, \"OnlineStatBook.com\"), \" allows you to simulate sampling distributions. In the example shown below, the first graph is a customisable population distribution and in this case we have used mouse to created a very different distribution (pathological distribution). You can press the \", mdx(\"em\", {\n    parentName: \"p\"\n  }, \"Animated\"), \" button and it will draw a sample of size 5 by default. You can alter this using the third set of boxes down and select from 2, 5, 10, 16, 20 and 25. \"), mdx(\"p\", null, mdx(\"img\", {\n    parentName: \"p\",\n    \"src\": \"/b11d9802af6beae3a9d002b9f7446c98/example.png\",\n    \"alt\": \"Simulate sampling distributions\"\n  })), mdx(\"p\", null, \"In the example shown above we drawn 10,000 samples of size 2 and size 25. You can see visually that when sample size is 2 the distribution cannot be identified or it is hard to say what distribution it has. When the sample size is 25 the sample mean distribution is slightly skewed, but you can tell it is following a Gaussian distribution. If the sample size is 100 then the mean will be following a Gaussian distribution and we'll see why (and the importance of Gaussian distribution) in \", mdx(Link, {\n    to: \"/docs/12/04/2021/LearningPath-Statistical-Modeling-5\",\n    mdxType: \"Link\"\n  }, \"Chapter 5 - The Central Limit Theorem\"), \". In this chapter you only need to know that sample means are approximately normally distributed if there is random sampling such that \", mdx(\"strong\", {\n    parentName: \"p\"\n  }, \"all units in the population are equally likely to be chosen\"), \". Why is this important? Imagine one of the few units at the right hand side of the graph have high probability of being selected, then this would make the sample mean be a lot higher than the population mean, which would make significant impact in most sampling techniques.   \"), mdx(\"p\", null, \"Tool No.2. \", mdx(\"a\", {\n    parentName: \"p\",\n    \"href\": \"https://www.essycode.com/distribution-viewer/\"\n  }, \"The essycode website\"), \" have a really useful tool that allows users to see probability mass/density functions and cumulative distribution functions for a range of probability distributions. You can also enter different parameters and distributions will be changed accordingly.  \"), mdx(\"p\", null, \"We also recommend you to use the \", mdx(\"strong\", {\n    parentName: \"p\"\n  }, \"Sample\"), \" button at the top right corner of that website and try to generate samples in 10, 100, 1000, 10,000, and 100,000 to see the difference in the generated graphs. You will find that as the sample size increases, the sampling distribution generated at the bottom will approximate the theoretical distribution at the top. Samples are always discrete distributions but can approximate continuous distributions if the sample size is large enough. \"), mdx(\"h2\", {\n    \"id\": \"describe-a-sample\",\n    \"style\": {\n      \"position\": \"relative\"\n    }\n  }, mdx(\"a\", {\n    parentName: \"h2\",\n    \"href\": \"#describe-a-sample\",\n    \"aria-label\": \"describe a sample permalink\",\n    \"className\": \"anchor before\"\n  }, mdx(\"undefined\", {\n    parentName: \"a\"\n  })), \"Describe a sample\"), mdx(\"p\", null, \"Once we have samples from a distribution or a population, we should consider using some measures such as dispersion and central tendency to describe the characteristic of the samples. Samples from different distributions would likely be treated differently.\"), mdx(\"h3\", {\n    \"id\": \"binary-variable\",\n    \"style\": {\n      \"position\": \"relative\"\n    }\n  }, mdx(\"a\", {\n    parentName: \"h3\",\n    \"href\": \"#binary-variable\",\n    \"aria-label\": \"binary variable permalink\",\n    \"className\": \"anchor before\"\n  }, mdx(\"undefined\", {\n    parentName: \"a\"\n  })), \"Binary variable\"), mdx(\"p\", null, \"For samples from a binary variable, we can use the percentage (%) to get the ratio of two categories. For example, suppose the Dataviz.Shef has 1,290 visitors this month and we have a variable that tells us whether the visitor uses a mobile device to visit our website. We take five samples with a sample size of ten each and on average 3 people use mobile devices to visit the website. Then we can use 30% to describe this statistic instead of plain numbers.\"), mdx(\"h3\", {\n    \"id\": \"multinomial\",\n    \"style\": {\n      \"position\": \"relative\"\n    }\n  }, mdx(\"a\", {\n    parentName: \"h3\",\n    \"href\": \"#multinomial\",\n    \"aria-label\": \"multinomial permalink\",\n    \"className\": \"anchor before\"\n  }, mdx(\"undefined\", {\n    parentName: \"a\"\n  })), \"Multinomial\"), mdx(\"p\", null, \"For samples with multiple categories, consider using mode in addition to percentages. The mode will tell us what value/category has the highest proportion in the distribution. Note that the distribution can have more than one mode.\"), mdx(\"h3\", {\n    \"id\": \"ordinal\",\n    \"style\": {\n      \"position\": \"relative\"\n    }\n  }, mdx(\"a\", {\n    parentName: \"h3\",\n    \"href\": \"#ordinal\",\n    \"aria-label\": \"ordinal permalink\",\n    \"className\": \"anchor before\"\n  }, mdx(\"undefined\", {\n    parentName: \"a\"\n  })), \"Ordinal\"), mdx(\"p\", null, \"Similar to multinomial and binary variables, we should consider use percentages for ordinal data. However, median will be used instead of mode since categories are ordered in ordinal data and we are interested in the central tendency.\"), mdx(\"h3\", {\n    \"id\": \"discrete\",\n    \"style\": {\n      \"position\": \"relative\"\n    }\n  }, mdx(\"a\", {\n    parentName: \"h3\",\n    \"href\": \"#discrete\",\n    \"aria-label\": \"discrete permalink\",\n    \"className\": \"anchor before\"\n  }, mdx(\"undefined\", {\n    parentName: \"a\"\n  })), \"Discrete\"), mdx(\"p\", null, \"The choices for discrete data will be wider and more common. Some measures we can use are minimum, maximum, mean, median, and standard deviation. In addition, one might also consider interquartile range (IQR) and variance.\"), mdx(\"h3\", {\n    \"id\": \"continuous\",\n    \"style\": {\n      \"position\": \"relative\"\n    }\n  }, mdx(\"a\", {\n    parentName: \"h3\",\n    \"href\": \"#continuous\",\n    \"aria-label\": \"continuous permalink\",\n    \"className\": \"anchor before\"\n  }, mdx(\"undefined\", {\n    parentName: \"a\"\n  })), \"Continuous\"), mdx(\"p\", null, \"In addition to measures mentioned for discrete data, kurtosis and skewness are often used to describe the shape of the distribution. Kurtosis describes the tail of the distribution whereas skewness measures the asymmetry.\"), mdx(\"h2\", {\n    \"id\": \"next-step\",\n    \"style\": {\n      \"position\": \"relative\"\n    }\n  }, mdx(\"a\", {\n    parentName: \"h2\",\n    \"href\": \"#next-step\",\n    \"aria-label\": \"next step permalink\",\n    \"className\": \"anchor before\"\n  }, mdx(\"undefined\", {\n    parentName: \"a\"\n  })), \"Next step\"), mdx(\"p\", null, \"In this material we have seen different sampling methods and ways to describe samples. In the next part we will be looking at statistical models.  \"), mdx(\"h2\", {\n    \"id\": \"recommended-reading\",\n    \"style\": {\n      \"position\": \"relative\"\n    }\n  }, mdx(\"a\", {\n    parentName: \"h2\",\n    \"href\": \"#recommended-reading\",\n    \"aria-label\": \"recommended reading permalink\",\n    \"className\": \"anchor before\"\n  }, mdx(\"undefined\", {\n    parentName: \"a\"\n  })), \"Recommended reading\"), mdx(\"ul\", null, mdx(\"li\", {\n    parentName: \"ul\"\n  }, mdx(\"a\", {\n    parentName: \"li\",\n    \"href\": \"https://www.linkedin.com/learning/statistics-foundations-2/sample-considerations?u=36248012\"\n  }, \"(Video) Sampling - Statistics Foundations: 2\"), \" \"), mdx(\"li\", {\n    parentName: \"ul\"\n  }, mdx(\"a\", {\n    parentName: \"li\",\n    \"href\": \"https://humansofdata.atlan.com/2017/07/6-sampling-techniques-choose-representative-subset/\"\n  }, \"6 Sampling Techniques\")), mdx(\"li\", {\n    parentName: \"ul\"\n  }, mdx(\"a\", {\n    parentName: \"li\",\n    \"href\": \"https://ocw.jhsph.edu/courses/statmethodsforsamplesurveys/lectureNotes.cfm\"\n  }, \"Sampling - JHSPH OpenCourseWare\")), mdx(\"li\", {\n    parentName: \"ul\"\n  }, mdx(\"a\", {\n    parentName: \"li\",\n    \"href\": \"https://www.math.niu.edu/~richard/Math101/sp07/stats3_ho.pdf\"\n  }, \"Sampling Lecture Notes - Northern Illinois University\"))));\n}\n;\nMDXContent.isMDXComponent = true;","tableOfContents":{"items":[{"url":"#introduction","title":"Introduction"},{"url":"#prerequisites","title":"Prerequisites"},{"url":"#two-basic-sampling-methods","title":"Two basic sampling methods","items":[{"url":"#simple-random","title":"Simple random"},{"url":"#selective","title":"Selective"},{"url":"#online-sampling-tools","title":"Online sampling tools"}]},{"url":"#describe-a-sample","title":"Describe a sample","items":[{"url":"#binary-variable","title":"Binary variable"},{"url":"#multinomial","title":"Multinomial"},{"url":"#ordinal","title":"Ordinal"},{"url":"#discrete","title":"Discrete"},{"url":"#continuous","title":"Continuous"}]},{"url":"#next-step","title":"Next step"},{"url":"#recommended-reading","title":"Recommended reading"}]},"fields":{"slug":"/docs/18/03/2021/LearningPath-Statistical-Modeling-2","readingTime":{"text":"9 min read"},"slugOrigin":"/2021-03-18-LearningPath-Statistical-Modeling-2/"},"frontmatter":{"type":"docs","title":"Sampling","date":"18 March 2021","description":"Statistical Modeling Part 2 - What is sampling? Sampling from a distribution? How to describe a sample?","tag":null,"category":null,"featured":null,"thumbnail":null,"author":[{"name":"Dataviz Team","avatar":{"childImageSharp":{"gatsbyImageData":{"layout":"fullWidth","backgroundColor":"#f8f8f8","images":{"fallback":{"src":"/static/871859109b0659b0d6a48ae540cb439e/780cc/dataviz.png","srcSet":"/static/871859109b0659b0d6a48ae540cb439e/780cc/dataviz.png 214w","sizes":"100vw"},"sources":[{"srcSet":"/static/871859109b0659b0d6a48ae540cb439e/6c5cc/dataviz.webp 214w","type":"image/webp","sizes":"100vw"}]},"width":1,"height":0.9158878504672897}}}},{"name":"Jean Russell","avatar":{"childImageSharp":{"gatsbyImageData":{"layout":"fullWidth","backgroundColor":"#e8e8e8","images":{"fallback":{"src":"/static/0241dc4c544ec54fee0c378b40ca6bc6/0be83/default.png","srcSet":"/static/0241dc4c544ec54fee0c378b40ca6bc6/f054e/default.png 750w,\n/static/0241dc4c544ec54fee0c378b40ca6bc6/ae1c8/default.png 1080w,\n/static/0241dc4c544ec54fee0c378b40ca6bc6/0be83/default.png 1280w","sizes":"100vw"},"sources":[{"srcSet":"/static/0241dc4c544ec54fee0c378b40ca6bc6/4f03f/default.webp 750w,\n/static/0241dc4c544ec54fee0c378b40ca6bc6/4f506/default.webp 1080w,\n/static/0241dc4c544ec54fee0c378b40ca6bc6/9e21f/default.webp 1280w","type":"image/webp","sizes":"100vw"}]},"width":1,"height":1}}}}],"disableTOC":null,"d3":null}}},"pageContext":{"id":"e22e0478-5c30-5fcc-a5ba-f865e170f1f5","slug":"/docs/18/03/2021/LearningPath-Statistical-Modeling-2","prev":{"node":{"id":"7688a787-1e06-5068-8e17-ac0b21fbb206","fields":{"slug":"/docs/18/03/2021/LearningPath-Statistical-Modeling-2-more-random-sampling"},"frontmatter":{"template":null,"title":"More random sampling methods","date":"Thursday 18th March 2021","category":null,"tag":null,"d3":null,"type":"docs","published":null}}},"next":{"node":{"id":"794f00ae-1d28-55bf-ba02-24b9395d5e93","fields":{"slug":"/docs/18/03/2021/LearningPath-Statistical-Modeling-2-optional"},"frontmatter":{"template":null,"title":"Sampling - Computational Statistics","date":"Thursday 18th March 2021","category":null,"tag":null,"d3":null,"type":"docs","published":null}}}}},
    "staticQueryHashes": ["160810946","3815917638","3976606562"]}