{
    "componentChunkName": "component---src-templates-docs-docs-template-jsx",
    "path": "/docs/18/03/2021/LearningPath-Statistical-Modeling-1",
    "result": {"data":{"mdx":{"id":"87c8a6e1-1dc9-5a25-a64b-c406a3289606","body":"var _excluded = [\"components\"];\n\nfunction _extends() { _extends = Object.assign || function (target) { for (var i = 1; i < arguments.length; i++) { var source = arguments[i]; for (var key in source) { if (Object.prototype.hasOwnProperty.call(source, key)) { target[key] = source[key]; } } } return target; }; return _extends.apply(this, arguments); }\n\nfunction _objectWithoutProperties(source, excluded) { if (source == null) return {}; var target = _objectWithoutPropertiesLoose(source, excluded); var key, i; if (Object.getOwnPropertySymbols) { var sourceSymbolKeys = Object.getOwnPropertySymbols(source); for (i = 0; i < sourceSymbolKeys.length; i++) { key = sourceSymbolKeys[i]; if (excluded.indexOf(key) >= 0) continue; if (!Object.prototype.propertyIsEnumerable.call(source, key)) continue; target[key] = source[key]; } } return target; }\n\nfunction _objectWithoutPropertiesLoose(source, excluded) { if (source == null) return {}; var target = {}; var sourceKeys = Object.keys(source); var key, i; for (i = 0; i < sourceKeys.length; i++) { key = sourceKeys[i]; if (excluded.indexOf(key) >= 0) continue; target[key] = source[key]; } return target; }\n\n/* @jsxRuntime classic */\n\n/* @jsx mdx */\nvar _frontmatter = {\n  \"type\": \"docs\",\n  \"author\": [\"Dataviz Team\", \"Jean Russell\"],\n  \"title\": \"Probability Distributions\",\n  \"thumbnail\": null,\n  \"description\": \"Statistical Modeling Part 1 - In this chapter we will be exploring probability distributions by variable types.\",\n  \"date\": \"2021-03-18T00:00:00.000Z\"\n};\n\nvar makeShortcode = function makeShortcode(name) {\n  return function MDXDefaultShortcode(props) {\n    console.warn(\"Component \" + name + \" was not imported, exported, or provided by MDXProvider as global scope\");\n    return mdx(\"div\", props);\n  };\n};\n\nvar Link = makeShortcode(\"Link\");\nvar layoutProps = {\n  _frontmatter: _frontmatter\n};\nvar MDXLayout = \"wrapper\";\nreturn function MDXContent(_ref) {\n  var components = _ref.components,\n      props = _objectWithoutProperties(_ref, _excluded);\n\n  return mdx(MDXLayout, _extends({}, layoutProps, props, {\n    components: components,\n    mdxType: \"MDXLayout\"\n  }), mdx(\"h2\", {\n    \"id\": \"introduction\",\n    \"style\": {\n      \"position\": \"relative\"\n    }\n  }, mdx(\"a\", {\n    parentName: \"h2\",\n    \"href\": \"#introduction\",\n    \"aria-label\": \"introduction permalink\",\n    \"className\": \"anchor before\"\n  }, mdx(\"undefined\", {\n    parentName: \"a\"\n  })), \"Introduction\"), mdx(\"p\", null, \"A \", mdx(\"strong\", {\n    parentName: \"p\"\n  }, mdx(\"a\", {\n    parentName: \"strong\",\n    \"href\": \"https://www.stat.yale.edu/Courses/1997-98/101/ranvar.htm\"\n  }, \"random variable\")), \" is a numerical representation (can be either a set of values or a function mapped to a continuous range) of an experiment's outcomes. A \", mdx(\"strong\", {\n    parentName: \"p\"\n  }, mdx(\"a\", {\n    parentName: \"strong\",\n    \"href\": \"https://www.itl.nist.gov/div898/handbook/eda/section3/eda361.htm\"\n  }, \"probability distribution\")), \" is a mathematical function that gives the probabilities for different possible outcomes of the experiment. Consider an experiment of drawing a ball three times with replacement from an urn which consists of seven red balls and three blue balls. If a random variable \", mdx(\"strong\", {\n    parentName: \"p\"\n  }, \"X\"), \" represents the total number of times we draw a blue ball, then the set of possible values that \", mdx(\"strong\", {\n    parentName: \"p\"\n  }, \"X\"), \" can be are:  {\", mdx(\"span\", {\n    parentName: \"p\",\n    \"className\": \"math math-inline\"\n  }, mdx(\"span\", {\n    parentName: \"span\",\n    \"className\": \"katex\"\n  }, mdx(\"span\", {\n    parentName: \"span\",\n    \"className\": \"katex-mathml\"\n  }, mdx(\"math\", {\n    parentName: \"span\",\n    \"xmlns\": \"http://www.w3.org/1998/Math/MathML\"\n  }, mdx(\"semantics\", {\n    parentName: \"math\"\n  }, mdx(\"mrow\", {\n    parentName: \"semantics\"\n  }, mdx(\"mn\", {\n    parentName: \"mrow\"\n  }, \"0\"), mdx(\"mo\", {\n    parentName: \"mrow\",\n    \"separator\": \"true\"\n  }, \",\"), mdx(\"mn\", {\n    parentName: \"mrow\"\n  }, \"1\"), mdx(\"mo\", {\n    parentName: \"mrow\",\n    \"separator\": \"true\"\n  }, \",\"), mdx(\"mn\", {\n    parentName: \"mrow\"\n  }, \"2\"), mdx(\"mo\", {\n    parentName: \"mrow\",\n    \"separator\": \"true\"\n  }, \",\"), mdx(\"mn\", {\n    parentName: \"mrow\"\n  }, \"3\")), mdx(\"annotation\", {\n    parentName: \"semantics\",\n    \"encoding\": \"application/x-tex\"\n  }, \"0, 1, 2, 3\")))), mdx(\"span\", {\n    parentName: \"span\",\n    \"className\": \"katex-html\",\n    \"aria-hidden\": \"true\"\n  }, mdx(\"span\", {\n    parentName: \"span\",\n    \"className\": \"base\"\n  }, mdx(\"span\", {\n    parentName: \"span\",\n    \"className\": \"strut\",\n    \"style\": {\n      \"height\": \"0.8389em\",\n      \"verticalAlign\": \"-0.1944em\"\n    }\n  }), mdx(\"span\", {\n    parentName: \"span\",\n    \"className\": \"mord\"\n  }, \"0\"), mdx(\"span\", {\n    parentName: \"span\",\n    \"className\": \"mpunct\"\n  }, \",\"), mdx(\"span\", {\n    parentName: \"span\",\n    \"className\": \"mspace\",\n    \"style\": {\n      \"marginRight\": \"0.1667em\"\n    }\n  }), mdx(\"span\", {\n    parentName: \"span\",\n    \"className\": \"mord\"\n  }, \"1\"), mdx(\"span\", {\n    parentName: \"span\",\n    \"className\": \"mpunct\"\n  }, \",\"), mdx(\"span\", {\n    parentName: \"span\",\n    \"className\": \"mspace\",\n    \"style\": {\n      \"marginRight\": \"0.1667em\"\n    }\n  }), mdx(\"span\", {\n    parentName: \"span\",\n    \"className\": \"mord\"\n  }, \"2\"), mdx(\"span\", {\n    parentName: \"span\",\n    \"className\": \"mpunct\"\n  }, \",\"), mdx(\"span\", {\n    parentName: \"span\",\n    \"className\": \"mspace\",\n    \"style\": {\n      \"marginRight\": \"0.1667em\"\n    }\n  }), mdx(\"span\", {\n    parentName: \"span\",\n    \"className\": \"mord\"\n  }, \"3\"))))), \"}. Then the probability distribution for the random variable \", mdx(\"strong\", {\n    parentName: \"p\"\n  }, \"X\"), \" gives the probabilities for these outcomes to happen. For example, the chance of getting blue balls from the urn in all three draws will be \", mdx(\"span\", {\n    parentName: \"p\",\n    \"className\": \"math math-inline\"\n  }, mdx(\"span\", {\n    parentName: \"span\",\n    \"className\": \"katex\"\n  }, mdx(\"span\", {\n    parentName: \"span\",\n    \"className\": \"katex-mathml\"\n  }, mdx(\"math\", {\n    parentName: \"span\",\n    \"xmlns\": \"http://www.w3.org/1998/Math/MathML\"\n  }, mdx(\"semantics\", {\n    parentName: \"math\"\n  }, mdx(\"mrow\", {\n    parentName: \"semantics\"\n  }, mdx(\"mo\", {\n    parentName: \"mrow\",\n    \"stretchy\": \"false\"\n  }, \"(\"), mdx(\"mfrac\", {\n    parentName: \"mrow\"\n  }, mdx(\"mn\", {\n    parentName: \"mfrac\"\n  }, \"3\"), mdx(\"mn\", {\n    parentName: \"mfrac\"\n  }, \"10\")), mdx(\"msup\", {\n    parentName: \"mrow\"\n  }, mdx(\"mo\", {\n    parentName: \"msup\",\n    \"stretchy\": \"false\"\n  }, \")\"), mdx(\"mn\", {\n    parentName: \"msup\"\n  }, \"3\")), mdx(\"mo\", {\n    parentName: \"mrow\"\n  }, \"=\"), mdx(\"mfrac\", {\n    parentName: \"mrow\"\n  }, mdx(\"mn\", {\n    parentName: \"mfrac\"\n  }, \"27\"), mdx(\"mn\", {\n    parentName: \"mfrac\"\n  }, \"1000\")), mdx(\"mo\", {\n    parentName: \"mrow\"\n  }, \"=\"), mdx(\"mn\", {\n    parentName: \"mrow\"\n  }, \"2.7\"), mdx(\"mi\", {\n    parentName: \"mrow\",\n    \"mathvariant\": \"normal\"\n  }, \"%\")), mdx(\"annotation\", {\n    parentName: \"semantics\",\n    \"encoding\": \"application/x-tex\"\n  }, \"(\\\\frac{3}{10})^{3} = \\\\frac{27}{1000} = 2.7\\\\%\")))), mdx(\"span\", {\n    parentName: \"span\",\n    \"className\": \"katex-html\",\n    \"aria-hidden\": \"true\"\n  }, mdx(\"span\", {\n    parentName: \"span\",\n    \"className\": \"base\"\n  }, mdx(\"span\", {\n    parentName: \"span\",\n    \"className\": \"strut\",\n    \"style\": {\n      \"height\": \"1.1901em\",\n      \"verticalAlign\": \"-0.345em\"\n    }\n  }), mdx(\"span\", {\n    parentName: \"span\",\n    \"className\": \"mopen\"\n  }, \"(\"), mdx(\"span\", {\n    parentName: \"span\",\n    \"className\": \"mord\"\n  }, mdx(\"span\", {\n    parentName: \"span\",\n    \"className\": \"mopen nulldelimiter\"\n  }), mdx(\"span\", {\n    parentName: \"span\",\n    \"className\": \"mfrac\"\n  }, mdx(\"span\", {\n    parentName: \"span\",\n    \"className\": \"vlist-t vlist-t2\"\n  }, mdx(\"span\", {\n    parentName: \"span\",\n    \"className\": \"vlist-r\"\n  }, mdx(\"span\", {\n    parentName: \"span\",\n    \"className\": \"vlist\",\n    \"style\": {\n      \"height\": \"0.8451em\"\n    }\n  }, mdx(\"span\", {\n    parentName: \"span\",\n    \"style\": {\n      \"top\": \"-2.655em\"\n    }\n  }, mdx(\"span\", {\n    parentName: \"span\",\n    \"className\": \"pstrut\",\n    \"style\": {\n      \"height\": \"3em\"\n    }\n  }), mdx(\"span\", {\n    parentName: \"span\",\n    \"className\": \"sizing reset-size6 size3 mtight\"\n  }, mdx(\"span\", {\n    parentName: \"span\",\n    \"className\": \"mord mtight\"\n  }, mdx(\"span\", {\n    parentName: \"span\",\n    \"className\": \"mord mtight\"\n  }, \"10\")))), mdx(\"span\", {\n    parentName: \"span\",\n    \"style\": {\n      \"top\": \"-3.23em\"\n    }\n  }, mdx(\"span\", {\n    parentName: \"span\",\n    \"className\": \"pstrut\",\n    \"style\": {\n      \"height\": \"3em\"\n    }\n  }), mdx(\"span\", {\n    parentName: \"span\",\n    \"className\": \"frac-line\",\n    \"style\": {\n      \"borderBottomWidth\": \"0.04em\"\n    }\n  })), mdx(\"span\", {\n    parentName: \"span\",\n    \"style\": {\n      \"top\": \"-3.394em\"\n    }\n  }, mdx(\"span\", {\n    parentName: \"span\",\n    \"className\": \"pstrut\",\n    \"style\": {\n      \"height\": \"3em\"\n    }\n  }), mdx(\"span\", {\n    parentName: \"span\",\n    \"className\": \"sizing reset-size6 size3 mtight\"\n  }, mdx(\"span\", {\n    parentName: \"span\",\n    \"className\": \"mord mtight\"\n  }, mdx(\"span\", {\n    parentName: \"span\",\n    \"className\": \"mord mtight\"\n  }, \"3\"))))), mdx(\"span\", {\n    parentName: \"span\",\n    \"className\": \"vlist-s\"\n  }, \"\\u200B\")), mdx(\"span\", {\n    parentName: \"span\",\n    \"className\": \"vlist-r\"\n  }, mdx(\"span\", {\n    parentName: \"span\",\n    \"className\": \"vlist\",\n    \"style\": {\n      \"height\": \"0.345em\"\n    }\n  }, mdx(\"span\", {\n    parentName: \"span\"\n  }))))), mdx(\"span\", {\n    parentName: \"span\",\n    \"className\": \"mclose nulldelimiter\"\n  })), mdx(\"span\", {\n    parentName: \"span\",\n    \"className\": \"mclose\"\n  }, mdx(\"span\", {\n    parentName: \"span\",\n    \"className\": \"mclose\"\n  }, \")\"), mdx(\"span\", {\n    parentName: \"span\",\n    \"className\": \"msupsub\"\n  }, mdx(\"span\", {\n    parentName: \"span\",\n    \"className\": \"vlist-t\"\n  }, mdx(\"span\", {\n    parentName: \"span\",\n    \"className\": \"vlist-r\"\n  }, mdx(\"span\", {\n    parentName: \"span\",\n    \"className\": \"vlist\",\n    \"style\": {\n      \"height\": \"0.8141em\"\n    }\n  }, mdx(\"span\", {\n    parentName: \"span\",\n    \"style\": {\n      \"top\": \"-3.063em\",\n      \"marginRight\": \"0.05em\"\n    }\n  }, mdx(\"span\", {\n    parentName: \"span\",\n    \"className\": \"pstrut\",\n    \"style\": {\n      \"height\": \"2.7em\"\n    }\n  }), mdx(\"span\", {\n    parentName: \"span\",\n    \"className\": \"sizing reset-size6 size3 mtight\"\n  }, mdx(\"span\", {\n    parentName: \"span\",\n    \"className\": \"mord mtight\"\n  }, mdx(\"span\", {\n    parentName: \"span\",\n    \"className\": \"mord mtight\"\n  }, \"3\"))))))))), mdx(\"span\", {\n    parentName: \"span\",\n    \"className\": \"mspace\",\n    \"style\": {\n      \"marginRight\": \"0.2778em\"\n    }\n  }), mdx(\"span\", {\n    parentName: \"span\",\n    \"className\": \"mrel\"\n  }, \"=\"), mdx(\"span\", {\n    parentName: \"span\",\n    \"className\": \"mspace\",\n    \"style\": {\n      \"marginRight\": \"0.2778em\"\n    }\n  })), mdx(\"span\", {\n    parentName: \"span\",\n    \"className\": \"base\"\n  }, mdx(\"span\", {\n    parentName: \"span\",\n    \"className\": \"strut\",\n    \"style\": {\n      \"height\": \"1.1901em\",\n      \"verticalAlign\": \"-0.345em\"\n    }\n  }), mdx(\"span\", {\n    parentName: \"span\",\n    \"className\": \"mord\"\n  }, mdx(\"span\", {\n    parentName: \"span\",\n    \"className\": \"mopen nulldelimiter\"\n  }), mdx(\"span\", {\n    parentName: \"span\",\n    \"className\": \"mfrac\"\n  }, mdx(\"span\", {\n    parentName: \"span\",\n    \"className\": \"vlist-t vlist-t2\"\n  }, mdx(\"span\", {\n    parentName: \"span\",\n    \"className\": \"vlist-r\"\n  }, mdx(\"span\", {\n    parentName: \"span\",\n    \"className\": \"vlist\",\n    \"style\": {\n      \"height\": \"0.8451em\"\n    }\n  }, mdx(\"span\", {\n    parentName: \"span\",\n    \"style\": {\n      \"top\": \"-2.655em\"\n    }\n  }, mdx(\"span\", {\n    parentName: \"span\",\n    \"className\": \"pstrut\",\n    \"style\": {\n      \"height\": \"3em\"\n    }\n  }), mdx(\"span\", {\n    parentName: \"span\",\n    \"className\": \"sizing reset-size6 size3 mtight\"\n  }, mdx(\"span\", {\n    parentName: \"span\",\n    \"className\": \"mord mtight\"\n  }, mdx(\"span\", {\n    parentName: \"span\",\n    \"className\": \"mord mtight\"\n  }, \"1000\")))), mdx(\"span\", {\n    parentName: \"span\",\n    \"style\": {\n      \"top\": \"-3.23em\"\n    }\n  }, mdx(\"span\", {\n    parentName: \"span\",\n    \"className\": \"pstrut\",\n    \"style\": {\n      \"height\": \"3em\"\n    }\n  }), mdx(\"span\", {\n    parentName: \"span\",\n    \"className\": \"frac-line\",\n    \"style\": {\n      \"borderBottomWidth\": \"0.04em\"\n    }\n  })), mdx(\"span\", {\n    parentName: \"span\",\n    \"style\": {\n      \"top\": \"-3.394em\"\n    }\n  }, mdx(\"span\", {\n    parentName: \"span\",\n    \"className\": \"pstrut\",\n    \"style\": {\n      \"height\": \"3em\"\n    }\n  }), mdx(\"span\", {\n    parentName: \"span\",\n    \"className\": \"sizing reset-size6 size3 mtight\"\n  }, mdx(\"span\", {\n    parentName: \"span\",\n    \"className\": \"mord mtight\"\n  }, mdx(\"span\", {\n    parentName: \"span\",\n    \"className\": \"mord mtight\"\n  }, \"27\"))))), mdx(\"span\", {\n    parentName: \"span\",\n    \"className\": \"vlist-s\"\n  }, \"\\u200B\")), mdx(\"span\", {\n    parentName: \"span\",\n    \"className\": \"vlist-r\"\n  }, mdx(\"span\", {\n    parentName: \"span\",\n    \"className\": \"vlist\",\n    \"style\": {\n      \"height\": \"0.345em\"\n    }\n  }, mdx(\"span\", {\n    parentName: \"span\"\n  }))))), mdx(\"span\", {\n    parentName: \"span\",\n    \"className\": \"mclose nulldelimiter\"\n  })), mdx(\"span\", {\n    parentName: \"span\",\n    \"className\": \"mspace\",\n    \"style\": {\n      \"marginRight\": \"0.2778em\"\n    }\n  }), mdx(\"span\", {\n    parentName: \"span\",\n    \"className\": \"mrel\"\n  }, \"=\"), mdx(\"span\", {\n    parentName: \"span\",\n    \"className\": \"mspace\",\n    \"style\": {\n      \"marginRight\": \"0.2778em\"\n    }\n  })), mdx(\"span\", {\n    parentName: \"span\",\n    \"className\": \"base\"\n  }, mdx(\"span\", {\n    parentName: \"span\",\n    \"className\": \"strut\",\n    \"style\": {\n      \"height\": \"0.8056em\",\n      \"verticalAlign\": \"-0.0556em\"\n    }\n  }), mdx(\"span\", {\n    parentName: \"span\",\n    \"className\": \"mord\"\n  }, \"2.7%\"))))), \". If \", mdx(\"strong\", {\n    parentName: \"p\"\n  }, \"Y\"), \" is a discrete random variable then it has a corresponding discrete probability distribution; If \", mdx(\"strong\", {\n    parentName: \"p\"\n  }, \"Y\"), \" is a continuous random variable then its corresponding probability distribution will also be continuous.  \"), mdx(\"p\", null, \"In practice, datasets can be described as samples of the population or outcomes of random variables (features that we have collected). Each dataset usually has two or more variables and each variable could have different probability distributions. It is often our interest to identify a dataset's distribution so that we can make assumptions on the dataset's nature and/or relationships between variables, and develop statistical models based on these assumptions.  \"), mdx(\"p\", null, \"We will be exploring probability distributions for common variable types such as binary, ordinal, nominal, and continuous. For each probability distribution (where possible) we will also give an example and tips on when to use. For a longer list of probability distributions, please see the \", mdx(\"a\", {\n    parentName: \"p\",\n    \"href\": \"https://www.stat.tamu.edu/~twehrly/611/distab.pdf\"\n  }, \"pdf\"), \".  \"), mdx(\"h2\", {\n    \"id\": \"prerequisites\",\n    \"style\": {\n      \"position\": \"relative\"\n    }\n  }, mdx(\"a\", {\n    parentName: \"h2\",\n    \"href\": \"#prerequisites\",\n    \"aria-label\": \"prerequisites permalink\",\n    \"className\": \"anchor before\"\n  }, mdx(\"undefined\", {\n    parentName: \"a\"\n  })), \"Prerequisites\"), mdx(\"p\", null, \"This chapter (Part 1) does not have strict requirements on what you should know, but it would be nice if you are familiar with the following concepts:  \"), mdx(\"div\", {\n    className: \"bg-white shadow-md p-3 md:p-5 rounded-3xl text-base text-black border-1 border-gray-50\"\n  }, mdx(\"div\", null, mdx(\"span\", {\n    className: \"py-1 px-2 bg-shefYellow text-black hover:bg-yellow-400 transition duration-300 cursor-pointer text-base font-semibold rounded-md mr-3\"\n  }, \"Required\"), mdx(\"p\", {\n    className: \"mt-2\"\n  }, \"None\")), mdx(\"div\", {\n    className: \"mt-6\"\n  }, mdx(\"span\", {\n    className: \"py-1 px-2 text-white bg-shefGreen hover:bg-green-700 transition duration-300 cursor-pointer text-base font-semibold rounded-md mr-3\"\n  }, \"Recommended\"), mdx(\"p\", {\n    className: \"mt-2\"\n  }, \"Mean, Median, Mode, Range, Standard Deviation, Z-Score, Probability, Continuous/Discrete/Categorical variable\")), mdx(\"div\", {\n    className: \"mt-6\"\n  }, mdx(\"span\", {\n    className: \"py-1 px-2 text-white bg-shefBlue hover:bg-blue-900 transition duration-300 cursor-pointer text-base font-semibold rounded-md mr-3\"\n  }, \"Optional\"), mdx(\"p\", {\n    className: \"mb-0 mt-2\"\n  }, \"Probability Mass Function, Probability Density Function\"))), mdx(\"h2\", {\n    \"id\": \"discrete\",\n    \"style\": {\n      \"position\": \"relative\"\n    }\n  }, mdx(\"a\", {\n    parentName: \"h2\",\n    \"href\": \"#discrete\",\n    \"aria-label\": \"discrete permalink\",\n    \"className\": \"anchor before\"\n  }, mdx(\"undefined\", {\n    parentName: \"a\"\n  })), \"Discrete\"), mdx(\"p\", null, \"As mentioned in the introduction, a discrete random variable \", mdx(\"span\", {\n    parentName: \"p\",\n    \"className\": \"math math-inline\"\n  }, mdx(\"span\", {\n    parentName: \"span\",\n    \"className\": \"katex\"\n  }, mdx(\"span\", {\n    parentName: \"span\",\n    \"className\": \"katex-mathml\"\n  }, mdx(\"math\", {\n    parentName: \"span\",\n    \"xmlns\": \"http://www.w3.org/1998/Math/MathML\"\n  }, mdx(\"semantics\", {\n    parentName: \"math\"\n  }, mdx(\"mrow\", {\n    parentName: \"semantics\"\n  }, mdx(\"mi\", {\n    parentName: \"mrow\"\n  }, \"X\")), mdx(\"annotation\", {\n    parentName: \"semantics\",\n    \"encoding\": \"application/x-tex\"\n  }, \"X\")))), mdx(\"span\", {\n    parentName: \"span\",\n    \"className\": \"katex-html\",\n    \"aria-hidden\": \"true\"\n  }, mdx(\"span\", {\n    parentName: \"span\",\n    \"className\": \"base\"\n  }, mdx(\"span\", {\n    parentName: \"span\",\n    \"className\": \"strut\",\n    \"style\": {\n      \"height\": \"0.6833em\"\n    }\n  }), mdx(\"span\", {\n    parentName: \"span\",\n    \"className\": \"mord mathnormal\",\n    \"style\": {\n      \"marginRight\": \"0.07847em\"\n    }\n  }, \"X\"))))), \" has a finite number of outcomes and the discrete probability distribution of \", mdx(\"span\", {\n    parentName: \"p\",\n    \"className\": \"math math-inline\"\n  }, mdx(\"span\", {\n    parentName: \"span\",\n    \"className\": \"katex\"\n  }, mdx(\"span\", {\n    parentName: \"span\",\n    \"className\": \"katex-mathml\"\n  }, mdx(\"math\", {\n    parentName: \"span\",\n    \"xmlns\": \"http://www.w3.org/1998/Math/MathML\"\n  }, mdx(\"semantics\", {\n    parentName: \"math\"\n  }, mdx(\"mrow\", {\n    parentName: \"semantics\"\n  }, mdx(\"mi\", {\n    parentName: \"mrow\"\n  }, \"X\")), mdx(\"annotation\", {\n    parentName: \"semantics\",\n    \"encoding\": \"application/x-tex\"\n  }, \"X\")))), mdx(\"span\", {\n    parentName: \"span\",\n    \"className\": \"katex-html\",\n    \"aria-hidden\": \"true\"\n  }, mdx(\"span\", {\n    parentName: \"span\",\n    \"className\": \"base\"\n  }, mdx(\"span\", {\n    parentName: \"span\",\n    \"className\": \"strut\",\n    \"style\": {\n      \"height\": \"0.6833em\"\n    }\n  }), mdx(\"span\", {\n    parentName: \"span\",\n    \"className\": \"mord mathnormal\",\n    \"style\": {\n      \"marginRight\": \"0.07847em\"\n    }\n  }, \"X\"))))), \" is a space that describes the likelihood of occurrence of each outcome. In this section we will learn common discrete probability distributions and what variable type they can match to. You might found the following definitions useful:  \"), mdx(\"div\", {\n    className: \"bg-shefPurple shadow-md p-5 md:p-8 rounded-3xl text-base text-white\"\n  }, mdx(\"p\", {\n    className: \"mt-0\"\n  }, mdx(\"b\", null, \"Binary variables\"), \" are variables which have only two possible values, typical examples are Boolean - True or False, Yes or No, 0 or 1, type 1 or type 2, and many more. In addition, one might create a binary variable from an existing variable to find some useful insight. For example, dividing students into two groups based on whether they have taken a specific course.\"), mdx(\"p\", null, \"A \", mdx(\"b\", null, \"nominal variable\"), \" is a variable that has two or more unordered categories or groups. Examples of categorical variables are gender, age, hair colour, answers to True or False questions, faculties within the university, blood type, etc.\"), mdx(\"p\", null, mdx(\"b\", null, \"Ordinal variables\"), \" are similar to nominal variables but now the order matters. For example, a survey might ask surveyees to rate something at a scale from 0 to 9. Ordinal distributions are exceedingly rare and are often created by combining discrete distributions or applying restrictions on a multinomial distribution. This makes them statistically difficult to handle. You do need a statistician to model ordinal data properly. Alternatively, approximated by splitting into positive and negative results then using a bernoulli or by treating as a scalar thus using Gaussian distribution.\"), mdx(\"p\", {\n    className: \"mb-0\"\n  }, mdx(\"b\", null, \"Discrete variables\"), \" are numerical and countable, whereas the previous three variables were categorical (qualitative). Examples of discrete variables are daily average temperatures over a period of time, number of papers that a researcher has published, and the distance that a cyclist has cycled.\")), mdx(\"br\", null), mdx(\"p\", null, \"For each distribution we have created a graph containing subplots, and you will see how the distribution responds to the change of parameters. If you would like a copy of codes that generates these graphs, \", mdx(\"a\", {\n    parentName: \"p\",\n    \"href\": \"/959957e9369cc6b8ded054c94b70e6b4/Discrete.r\"\n  }, \"download it here\"), \". Note that these graphs are histograms and if you would like to convert them into probability mass functions, replace \", mdx(\"code\", {\n    parentName: \"p\",\n    \"className\": \"language-text\"\n  }, \"geom_histogram()\"), \" by \", mdx(\"code\", {\n    parentName: \"p\",\n    \"className\": \"language-text\"\n  }, \"geom_density()\"), \".\"), mdx(\"p\", null, \"We also recommend you visit the \", mdx(\"a\", {\n    parentName: \"p\",\n    \"href\": \"https://www.essycode.com/distribution-viewer/\"\n  }, \"distribution viewer\"), \" website and as it would help you to explore different distributions dynamically.  \"), mdx(\"h3\", {\n    \"id\": \"bernoulli\",\n    \"style\": {\n      \"position\": \"relative\"\n    }\n  }, mdx(\"a\", {\n    parentName: \"h3\",\n    \"href\": \"#bernoulli\",\n    \"aria-label\": \"bernoulli permalink\",\n    \"className\": \"anchor before\"\n  }, mdx(\"undefined\", {\n    parentName: \"a\"\n  })), \"Bernoulli\"), mdx(\"p\", null, mdx(\"img\", {\n    parentName: \"p\",\n    \"src\": \"/d61a299f670cb43507564c65c3595c92/dice.jpg\",\n    \"alt\": \"Dice image\"\n  }), \"  \"), mdx(\"p\", null, \"A bernoulli distribution is a single Bernoulli trial (a random experiment with exactly two possible outcomes) in which the probability of success (True, 1, Yes) is \", mdx(\"span\", {\n    parentName: \"p\",\n    \"className\": \"math math-inline\"\n  }, mdx(\"span\", {\n    parentName: \"span\",\n    \"className\": \"katex\"\n  }, mdx(\"span\", {\n    parentName: \"span\",\n    \"className\": \"katex-mathml\"\n  }, mdx(\"math\", {\n    parentName: \"span\",\n    \"xmlns\": \"http://www.w3.org/1998/Math/MathML\"\n  }, mdx(\"semantics\", {\n    parentName: \"math\"\n  }, mdx(\"mrow\", {\n    parentName: \"semantics\"\n  }, mdx(\"mi\", {\n    parentName: \"mrow\"\n  }, \"p\")), mdx(\"annotation\", {\n    parentName: \"semantics\",\n    \"encoding\": \"application/x-tex\"\n  }, \"p\")))), mdx(\"span\", {\n    parentName: \"span\",\n    \"className\": \"katex-html\",\n    \"aria-hidden\": \"true\"\n  }, mdx(\"span\", {\n    parentName: \"span\",\n    \"className\": \"base\"\n  }, mdx(\"span\", {\n    parentName: \"span\",\n    \"className\": \"strut\",\n    \"style\": {\n      \"height\": \"0.625em\",\n      \"verticalAlign\": \"-0.1944em\"\n    }\n  }), mdx(\"span\", {\n    parentName: \"span\",\n    \"className\": \"mord mathnormal\"\n  }, \"p\"))))), \" and the probability of failure (False, 0, No) is \", mdx(\"span\", {\n    parentName: \"p\",\n    \"className\": \"math math-inline\"\n  }, mdx(\"span\", {\n    parentName: \"span\",\n    \"className\": \"katex\"\n  }, mdx(\"span\", {\n    parentName: \"span\",\n    \"className\": \"katex-mathml\"\n  }, mdx(\"math\", {\n    parentName: \"span\",\n    \"xmlns\": \"http://www.w3.org/1998/Math/MathML\"\n  }, mdx(\"semantics\", {\n    parentName: \"math\"\n  }, mdx(\"mrow\", {\n    parentName: \"semantics\"\n  }, mdx(\"mn\", {\n    parentName: \"mrow\"\n  }, \"1\"), mdx(\"mo\", {\n    parentName: \"mrow\"\n  }, \"\\u2212\"), mdx(\"mi\", {\n    parentName: \"mrow\"\n  }, \"p\")), mdx(\"annotation\", {\n    parentName: \"semantics\",\n    \"encoding\": \"application/x-tex\"\n  }, \"1-p\")))), mdx(\"span\", {\n    parentName: \"span\",\n    \"className\": \"katex-html\",\n    \"aria-hidden\": \"true\"\n  }, mdx(\"span\", {\n    parentName: \"span\",\n    \"className\": \"base\"\n  }, mdx(\"span\", {\n    parentName: \"span\",\n    \"className\": \"strut\",\n    \"style\": {\n      \"height\": \"0.7278em\",\n      \"verticalAlign\": \"-0.0833em\"\n    }\n  }), mdx(\"span\", {\n    parentName: \"span\",\n    \"className\": \"mord\"\n  }, \"1\"), mdx(\"span\", {\n    parentName: \"span\",\n    \"className\": \"mspace\",\n    \"style\": {\n      \"marginRight\": \"0.2222em\"\n    }\n  }), mdx(\"span\", {\n    parentName: \"span\",\n    \"className\": \"mbin\"\n  }, \"\\u2212\"), mdx(\"span\", {\n    parentName: \"span\",\n    \"className\": \"mspace\",\n    \"style\": {\n      \"marginRight\": \"0.2222em\"\n    }\n  })), mdx(\"span\", {\n    parentName: \"span\",\n    \"className\": \"base\"\n  }, mdx(\"span\", {\n    parentName: \"span\",\n    \"className\": \"strut\",\n    \"style\": {\n      \"height\": \"0.625em\",\n      \"verticalAlign\": \"-0.1944em\"\n    }\n  }), mdx(\"span\", {\n    parentName: \"span\",\n    \"className\": \"mord mathnormal\"\n  }, \"p\"))))), \". Therefore, this distribution is a great match for an experiment in which the outcomes are binary variables (Yes or No, True or False). For example, will it rain in the next hour in Sheffield, a rolled dice will show my chosen number between 1 and 6, and whether my pizza be delivered before 6pm. \"), mdx(\"div\", {\n    className: \"bg-shefYellow shadow-md p-3 md:p-5 rounded-3xl text-base text-black\"\n  }, mdx(\"h2\", {\n    className: \"mt-0 flex items-center\"\n  }, mdx(HiOutlineLightBulb, {\n    className: \"inline-block text-4xl mr-2\",\n    mdxType: \"HiOutlineLightBulb\"\n  }), \" When to use?\"), mdx(\"ul\", {\n    className: \"my-0\"\n  }, mdx(\"li\", null, \"Binary or bimodal variable\"))), mdx(\"h3\", {\n    \"id\": \"binomial\",\n    \"style\": {\n      \"position\": \"relative\"\n    }\n  }, mdx(\"a\", {\n    parentName: \"h3\",\n    \"href\": \"#binomial\",\n    \"aria-label\": \"binomial permalink\",\n    \"className\": \"anchor before\"\n  }, mdx(\"undefined\", {\n    parentName: \"a\"\n  })), \"Binomial\"), mdx(\"p\", null, \"A binomial distribution is a set of \", mdx(\"span\", {\n    parentName: \"p\",\n    \"className\": \"math math-inline\"\n  }, mdx(\"span\", {\n    parentName: \"span\",\n    \"className\": \"katex\"\n  }, mdx(\"span\", {\n    parentName: \"span\",\n    \"className\": \"katex-mathml\"\n  }, mdx(\"math\", {\n    parentName: \"span\",\n    \"xmlns\": \"http://www.w3.org/1998/Math/MathML\"\n  }, mdx(\"semantics\", {\n    parentName: \"math\"\n  }, mdx(\"mrow\", {\n    parentName: \"semantics\"\n  }, mdx(\"mi\", {\n    parentName: \"mrow\"\n  }, \"n\")), mdx(\"annotation\", {\n    parentName: \"semantics\",\n    \"encoding\": \"application/x-tex\"\n  }, \"n\")))), mdx(\"span\", {\n    parentName: \"span\",\n    \"className\": \"katex-html\",\n    \"aria-hidden\": \"true\"\n  }, mdx(\"span\", {\n    parentName: \"span\",\n    \"className\": \"base\"\n  }, mdx(\"span\", {\n    parentName: \"span\",\n    \"className\": \"strut\",\n    \"style\": {\n      \"height\": \"0.4306em\"\n    }\n  }), mdx(\"span\", {\n    parentName: \"span\",\n    \"className\": \"mord mathnormal\"\n  }, \"n\"))))), \" \", mdx(\"a\", {\n    parentName: \"p\",\n    \"href\": \"https://www.statisticshowto.com/iid-statistics/\"\n  }, \"independent and identically distributed\"), \" Bernoulli trials with exactly two outcomes on every single trials, and the probability of success remains the same across all trials. You might find this distribution useful if you were interested in the number of successes has occurred out of a given number of repeated trials. If you would like to see a proof of Bernoullis to a Binomial, \", mdx(\"a\", {\n    parentName: \"p\",\n    \"href\": \"https://math.la.asu.edu/~jtaylor/teaching/Fall2010/STP421/lectures/lecture11.pdf\"\n  }, \"click here\"), \".  \"), mdx(\"p\", null, mdx(\"img\", {\n    parentName: \"p\",\n    \"src\": \"/ebb305d2daf3f07cb80b90e654f0286d/coin.jpg\",\n    \"alt\": \"Coin\"\n  })), mdx(\"p\", null, \"Some examples that conform the binomial distribution:\"), mdx(\"ul\", null, mdx(\"li\", {\n    parentName: \"ul\"\n  }, \"the probability of getting only 2 heads out of 10 coin tosses\"), mdx(\"li\", {\n    parentName: \"ul\"\n  }, \"given a box contains 4 red balls and 6 green balls, what's the probability of getting red balls 5 times out of 10 draws with replacement\"), mdx(\"li\", {\n    parentName: \"ul\"\n  }, \"a student taking a same test three times, the probability of fail the test is 0.2 and tests are independent to each other. What's the probability of the student failed all three tests in a row?  \")), mdx(\"p\", null, mdx(\"strong\", {\n    parentName: \"p\"\n  }, \"Multinomial\"), mdx(\"br\", {\n    parentName: \"p\"\n  }), \"\\n\", \"The multinomial distribution is a generalisation of the binomial distribution. Everything remains the same (including the number of trials and assumptions) except the multinomial experiment now has more than two possible outcomes. Consider a random experiment of drawing 5 balls with replacement from an urn containing 10 red balls, 5 blue balls, 3 yellow balls, and 1 green ball. We can use the multinomial distribution to work the probability of selecting exactly 3 red balls, 1 yellow ball, and 1 green ball.\"), mdx(\"p\", null, mdx(\"img\", {\n    parentName: \"p\",\n    \"src\": \"/a758c75f593a3d454208322e32737024/binomial.png\",\n    \"alt\": \"Sampling distribution\"\n  }), mdx(\"br\", {\n    parentName: \"p\"\n  }), \"\\n\", mdx(\"em\", {\n    parentName: \"p\"\n  }, \"Sampling distribution of binomial distribution with four different possible outcomes and 0.2 as the probability of success\"), \"  \"), mdx(\"div\", {\n    className: \"bg-shefYellow shadow-md p-3 md:p-5 rounded-3xl text-base text-black\"\n  }, mdx(\"h2\", {\n    className: \"mt-0 flex items-center\"\n  }, mdx(HiOutlineLightBulb, {\n    className: \"inline-block text-4xl mr-2\",\n    mdxType: \"HiOutlineLightBulb\"\n  }), \" When to use?\"), mdx(\"p\", null, \"Providing that trials are independent, the number of trials is fixed, and the probability of success remains the same:\"), mdx(\"ul\", {\n    className: \"my-0\"\n  }, mdx(\"li\", null, \"Categorical variable\"), mdx(\"li\", null, \"There is a need to compute the probability of a specific outcome (multinomial for multiple outcomes) will occur over a fixed number of trials\"))), mdx(\"h3\", {\n    \"id\": \"discrete-uniform\",\n    \"style\": {\n      \"position\": \"relative\"\n    }\n  }, mdx(\"a\", {\n    parentName: \"h3\",\n    \"href\": \"#discrete-uniform\",\n    \"aria-label\": \"discrete uniform permalink\",\n    \"className\": \"anchor before\"\n  }, mdx(\"undefined\", {\n    parentName: \"a\"\n  })), \"Discrete Uniform\"), mdx(\"p\", null, \"Given that the outcomes of a random variable \", mdx(\"span\", {\n    parentName: \"p\",\n    \"className\": \"math math-inline\"\n  }, mdx(\"span\", {\n    parentName: \"span\",\n    \"className\": \"katex\"\n  }, mdx(\"span\", {\n    parentName: \"span\",\n    \"className\": \"katex-mathml\"\n  }, mdx(\"math\", {\n    parentName: \"span\",\n    \"xmlns\": \"http://www.w3.org/1998/Math/MathML\"\n  }, mdx(\"semantics\", {\n    parentName: \"math\"\n  }, mdx(\"mrow\", {\n    parentName: \"semantics\"\n  }, mdx(\"mi\", {\n    parentName: \"mrow\"\n  }, \"U\")), mdx(\"annotation\", {\n    parentName: \"semantics\",\n    \"encoding\": \"application/x-tex\"\n  }, \"U\")))), mdx(\"span\", {\n    parentName: \"span\",\n    \"className\": \"katex-html\",\n    \"aria-hidden\": \"true\"\n  }, mdx(\"span\", {\n    parentName: \"span\",\n    \"className\": \"base\"\n  }, mdx(\"span\", {\n    parentName: \"span\",\n    \"className\": \"strut\",\n    \"style\": {\n      \"height\": \"0.6833em\"\n    }\n  }), mdx(\"span\", {\n    parentName: \"span\",\n    \"className\": \"mord mathnormal\",\n    \"style\": {\n      \"marginRight\": \"0.10903em\"\n    }\n  }, \"U\"))))), \" is a set of \", mdx(\"span\", {\n    parentName: \"p\",\n    \"className\": \"math math-inline\"\n  }, mdx(\"span\", {\n    parentName: \"span\",\n    \"className\": \"katex\"\n  }, mdx(\"span\", {\n    parentName: \"span\",\n    \"className\": \"katex-mathml\"\n  }, mdx(\"math\", {\n    parentName: \"span\",\n    \"xmlns\": \"http://www.w3.org/1998/Math/MathML\"\n  }, mdx(\"semantics\", {\n    parentName: \"math\"\n  }, mdx(\"mrow\", {\n    parentName: \"semantics\"\n  }, mdx(\"mi\", {\n    parentName: \"mrow\"\n  }, \"k\")), mdx(\"annotation\", {\n    parentName: \"semantics\",\n    \"encoding\": \"application/x-tex\"\n  }, \"k\")))), mdx(\"span\", {\n    parentName: \"span\",\n    \"className\": \"katex-html\",\n    \"aria-hidden\": \"true\"\n  }, mdx(\"span\", {\n    parentName: \"span\",\n    \"className\": \"base\"\n  }, mdx(\"span\", {\n    parentName: \"span\",\n    \"className\": \"strut\",\n    \"style\": {\n      \"height\": \"0.6944em\"\n    }\n  }), mdx(\"span\", {\n    parentName: \"span\",\n    \"className\": \"mord mathnormal\",\n    \"style\": {\n      \"marginRight\": \"0.03148em\"\n    }\n  }, \"k\"))))), \" numerical values and the probability of occurrence of each outcome is the same (i.e. \", mdx(\"span\", {\n    parentName: \"p\",\n    \"className\": \"math math-inline\"\n  }, mdx(\"span\", {\n    parentName: \"span\",\n    \"className\": \"katex\"\n  }, mdx(\"span\", {\n    parentName: \"span\",\n    \"className\": \"katex-mathml\"\n  }, mdx(\"math\", {\n    parentName: \"span\",\n    \"xmlns\": \"http://www.w3.org/1998/Math/MathML\"\n  }, mdx(\"semantics\", {\n    parentName: \"math\"\n  }, mdx(\"mrow\", {\n    parentName: \"semantics\"\n  }, mdx(\"mfrac\", {\n    parentName: \"mrow\"\n  }, mdx(\"mn\", {\n    parentName: \"mfrac\"\n  }, \"1\"), mdx(\"mi\", {\n    parentName: \"mfrac\"\n  }, \"k\"))), mdx(\"annotation\", {\n    parentName: \"semantics\",\n    \"encoding\": \"application/x-tex\"\n  }, \"\\\\frac{1}{k}\")))), mdx(\"span\", {\n    parentName: \"span\",\n    \"className\": \"katex-html\",\n    \"aria-hidden\": \"true\"\n  }, mdx(\"span\", {\n    parentName: \"span\",\n    \"className\": \"base\"\n  }, mdx(\"span\", {\n    parentName: \"span\",\n    \"className\": \"strut\",\n    \"style\": {\n      \"height\": \"1.1901em\",\n      \"verticalAlign\": \"-0.345em\"\n    }\n  }), mdx(\"span\", {\n    parentName: \"span\",\n    \"className\": \"mord\"\n  }, mdx(\"span\", {\n    parentName: \"span\",\n    \"className\": \"mopen nulldelimiter\"\n  }), mdx(\"span\", {\n    parentName: \"span\",\n    \"className\": \"mfrac\"\n  }, mdx(\"span\", {\n    parentName: \"span\",\n    \"className\": \"vlist-t vlist-t2\"\n  }, mdx(\"span\", {\n    parentName: \"span\",\n    \"className\": \"vlist-r\"\n  }, mdx(\"span\", {\n    parentName: \"span\",\n    \"className\": \"vlist\",\n    \"style\": {\n      \"height\": \"0.8451em\"\n    }\n  }, mdx(\"span\", {\n    parentName: \"span\",\n    \"style\": {\n      \"top\": \"-2.655em\"\n    }\n  }, mdx(\"span\", {\n    parentName: \"span\",\n    \"className\": \"pstrut\",\n    \"style\": {\n      \"height\": \"3em\"\n    }\n  }), mdx(\"span\", {\n    parentName: \"span\",\n    \"className\": \"sizing reset-size6 size3 mtight\"\n  }, mdx(\"span\", {\n    parentName: \"span\",\n    \"className\": \"mord mtight\"\n  }, mdx(\"span\", {\n    parentName: \"span\",\n    \"className\": \"mord mathnormal mtight\",\n    \"style\": {\n      \"marginRight\": \"0.03148em\"\n    }\n  }, \"k\")))), mdx(\"span\", {\n    parentName: \"span\",\n    \"style\": {\n      \"top\": \"-3.23em\"\n    }\n  }, mdx(\"span\", {\n    parentName: \"span\",\n    \"className\": \"pstrut\",\n    \"style\": {\n      \"height\": \"3em\"\n    }\n  }), mdx(\"span\", {\n    parentName: \"span\",\n    \"className\": \"frac-line\",\n    \"style\": {\n      \"borderBottomWidth\": \"0.04em\"\n    }\n  })), mdx(\"span\", {\n    parentName: \"span\",\n    \"style\": {\n      \"top\": \"-3.394em\"\n    }\n  }, mdx(\"span\", {\n    parentName: \"span\",\n    \"className\": \"pstrut\",\n    \"style\": {\n      \"height\": \"3em\"\n    }\n  }), mdx(\"span\", {\n    parentName: \"span\",\n    \"className\": \"sizing reset-size6 size3 mtight\"\n  }, mdx(\"span\", {\n    parentName: \"span\",\n    \"className\": \"mord mtight\"\n  }, mdx(\"span\", {\n    parentName: \"span\",\n    \"className\": \"mord mtight\"\n  }, \"1\"))))), mdx(\"span\", {\n    parentName: \"span\",\n    \"className\": \"vlist-s\"\n  }, \"\\u200B\")), mdx(\"span\", {\n    parentName: \"span\",\n    \"className\": \"vlist-r\"\n  }, mdx(\"span\", {\n    parentName: \"span\",\n    \"className\": \"vlist\",\n    \"style\": {\n      \"height\": \"0.345em\"\n    }\n  }, mdx(\"span\", {\n    parentName: \"span\"\n  }))))), mdx(\"span\", {\n    parentName: \"span\",\n    \"className\": \"mclose nulldelimiter\"\n  })))))), \"), then the probability distribution of the random variable \", mdx(\"span\", {\n    parentName: \"p\",\n    \"className\": \"math math-inline\"\n  }, mdx(\"span\", {\n    parentName: \"span\",\n    \"className\": \"katex\"\n  }, mdx(\"span\", {\n    parentName: \"span\",\n    \"className\": \"katex-mathml\"\n  }, mdx(\"math\", {\n    parentName: \"span\",\n    \"xmlns\": \"http://www.w3.org/1998/Math/MathML\"\n  }, mdx(\"semantics\", {\n    parentName: \"math\"\n  }, mdx(\"mrow\", {\n    parentName: \"semantics\"\n  }, mdx(\"mi\", {\n    parentName: \"mrow\"\n  }, \"U\")), mdx(\"annotation\", {\n    parentName: \"semantics\",\n    \"encoding\": \"application/x-tex\"\n  }, \"U\")))), mdx(\"span\", {\n    parentName: \"span\",\n    \"className\": \"katex-html\",\n    \"aria-hidden\": \"true\"\n  }, mdx(\"span\", {\n    parentName: \"span\",\n    \"className\": \"base\"\n  }, mdx(\"span\", {\n    parentName: \"span\",\n    \"className\": \"strut\",\n    \"style\": {\n      \"height\": \"0.6833em\"\n    }\n  }), mdx(\"span\", {\n    parentName: \"span\",\n    \"className\": \"mord mathnormal\",\n    \"style\": {\n      \"marginRight\": \"0.10903em\"\n    }\n  }, \"U\"))))), \" is called the \", mdx(\"strong\", {\n    parentName: \"p\"\n  }, \"discrete uniform distribution\"), \". A fairly common example will be rolling a dice, where each side has equal probabilities.\"), mdx(\"p\", null, mdx(\"img\", {\n    parentName: \"p\",\n    \"src\": \"/c4cf8856ce5d04288b2d0937f1bf8d8c/uniform.png\",\n    \"alt\": \"Uniform\"\n  })), mdx(\"p\", null, \"The graph shown on above was generated from the discrete uniform distribution, however, as you might have observed the counts for each possible dice number are not equal when in theory the probability is the same for every number. But if the sample size is large enough (approaches infinity), then the counts will almost surely converge to \", mdx(\"span\", {\n    parentName: \"p\",\n    \"className\": \"math math-inline\"\n  }, mdx(\"span\", {\n    parentName: \"span\",\n    \"className\": \"katex\"\n  }, mdx(\"span\", {\n    parentName: \"span\",\n    \"className\": \"katex-mathml\"\n  }, mdx(\"math\", {\n    parentName: \"span\",\n    \"xmlns\": \"http://www.w3.org/1998/Math/MathML\"\n  }, mdx(\"semantics\", {\n    parentName: \"math\"\n  }, mdx(\"mrow\", {\n    parentName: \"semantics\"\n  }, mdx(\"mfrac\", {\n    parentName: \"mrow\"\n  }, mdx(\"mn\", {\n    parentName: \"mfrac\"\n  }, \"1\"), mdx(\"mn\", {\n    parentName: \"mfrac\"\n  }, \"6\"))), mdx(\"annotation\", {\n    parentName: \"semantics\",\n    \"encoding\": \"application/x-tex\"\n  }, \"\\\\frac{1}{6}\")))), mdx(\"span\", {\n    parentName: \"span\",\n    \"className\": \"katex-html\",\n    \"aria-hidden\": \"true\"\n  }, mdx(\"span\", {\n    parentName: \"span\",\n    \"className\": \"base\"\n  }, mdx(\"span\", {\n    parentName: \"span\",\n    \"className\": \"strut\",\n    \"style\": {\n      \"height\": \"1.1901em\",\n      \"verticalAlign\": \"-0.345em\"\n    }\n  }), mdx(\"span\", {\n    parentName: \"span\",\n    \"className\": \"mord\"\n  }, mdx(\"span\", {\n    parentName: \"span\",\n    \"className\": \"mopen nulldelimiter\"\n  }), mdx(\"span\", {\n    parentName: \"span\",\n    \"className\": \"mfrac\"\n  }, mdx(\"span\", {\n    parentName: \"span\",\n    \"className\": \"vlist-t vlist-t2\"\n  }, mdx(\"span\", {\n    parentName: \"span\",\n    \"className\": \"vlist-r\"\n  }, mdx(\"span\", {\n    parentName: \"span\",\n    \"className\": \"vlist\",\n    \"style\": {\n      \"height\": \"0.8451em\"\n    }\n  }, mdx(\"span\", {\n    parentName: \"span\",\n    \"style\": {\n      \"top\": \"-2.655em\"\n    }\n  }, mdx(\"span\", {\n    parentName: \"span\",\n    \"className\": \"pstrut\",\n    \"style\": {\n      \"height\": \"3em\"\n    }\n  }), mdx(\"span\", {\n    parentName: \"span\",\n    \"className\": \"sizing reset-size6 size3 mtight\"\n  }, mdx(\"span\", {\n    parentName: \"span\",\n    \"className\": \"mord mtight\"\n  }, mdx(\"span\", {\n    parentName: \"span\",\n    \"className\": \"mord mtight\"\n  }, \"6\")))), mdx(\"span\", {\n    parentName: \"span\",\n    \"style\": {\n      \"top\": \"-3.23em\"\n    }\n  }, mdx(\"span\", {\n    parentName: \"span\",\n    \"className\": \"pstrut\",\n    \"style\": {\n      \"height\": \"3em\"\n    }\n  }), mdx(\"span\", {\n    parentName: \"span\",\n    \"className\": \"frac-line\",\n    \"style\": {\n      \"borderBottomWidth\": \"0.04em\"\n    }\n  })), mdx(\"span\", {\n    parentName: \"span\",\n    \"style\": {\n      \"top\": \"-3.394em\"\n    }\n  }, mdx(\"span\", {\n    parentName: \"span\",\n    \"className\": \"pstrut\",\n    \"style\": {\n      \"height\": \"3em\"\n    }\n  }), mdx(\"span\", {\n    parentName: \"span\",\n    \"className\": \"sizing reset-size6 size3 mtight\"\n  }, mdx(\"span\", {\n    parentName: \"span\",\n    \"className\": \"mord mtight\"\n  }, mdx(\"span\", {\n    parentName: \"span\",\n    \"className\": \"mord mtight\"\n  }, \"1\"))))), mdx(\"span\", {\n    parentName: \"span\",\n    \"className\": \"vlist-s\"\n  }, \"\\u200B\")), mdx(\"span\", {\n    parentName: \"span\",\n    \"className\": \"vlist-r\"\n  }, mdx(\"span\", {\n    parentName: \"span\",\n    \"className\": \"vlist\",\n    \"style\": {\n      \"height\": \"0.345em\"\n    }\n  }, mdx(\"span\", {\n    parentName: \"span\"\n  }))))), mdx(\"span\", {\n    parentName: \"span\",\n    \"className\": \"mclose nulldelimiter\"\n  })))))), \" by the \", mdx(\"a\", {\n    parentName: \"p\",\n    \"href\": \"https://en.wikipedia.org/wiki/Law_of_large_numbers\"\n  }, \"Law of large numbers\"), \". At the same time, the sample mean and the sample variance will follow an approximate normal distribution by the \", mdx(\"strong\", {\n    parentName: \"p\"\n  }, \"Central Limit Theorem\"), \" (we will discuss more on this in Part 5).  \"), mdx(\"div\", {\n    className: \"bg-shefYellow shadow-md p-3 md:p-5 rounded-3xl text-base text-black\"\n  }, mdx(\"h2\", {\n    className: \"mt-0 flex items-center\"\n  }, mdx(HiOutlineLightBulb, {\n    className: \"inline-block text-4xl mr-2\",\n    mdxType: \"HiOutlineLightBulb\"\n  }), \" When to use?\"), mdx(\"ul\", {\n    className: \"my-0\"\n  }, mdx(\"li\", null, \"Outcomes has equal probability of occurrence\"), mdx(\"li\", null, \"Variable is countable and discrete\"))), mdx(\"h3\", {\n    \"id\": \"poisson\",\n    \"style\": {\n      \"position\": \"relative\"\n    }\n  }, mdx(\"a\", {\n    parentName: \"h3\",\n    \"href\": \"#poisson\",\n    \"aria-label\": \"poisson permalink\",\n    \"className\": \"anchor before\"\n  }, mdx(\"undefined\", {\n    parentName: \"a\"\n  })), \"Poisson\"), mdx(\"p\", null, \"The Poisson distribution is used to model the counts (could be infinity!) of random events in a given time interval, providing that we already know the average counts (the lambda \", mdx(\"span\", {\n    parentName: \"p\",\n    \"className\": \"math math-inline\"\n  }, mdx(\"span\", {\n    parentName: \"span\",\n    \"className\": \"katex\"\n  }, mdx(\"span\", {\n    parentName: \"span\",\n    \"className\": \"katex-mathml\"\n  }, mdx(\"math\", {\n    parentName: \"span\",\n    \"xmlns\": \"http://www.w3.org/1998/Math/MathML\"\n  }, mdx(\"semantics\", {\n    parentName: \"math\"\n  }, mdx(\"mrow\", {\n    parentName: \"semantics\"\n  }, mdx(\"mi\", {\n    parentName: \"mrow\"\n  }, \"\\u03BB\")), mdx(\"annotation\", {\n    parentName: \"semantics\",\n    \"encoding\": \"application/x-tex\"\n  }, \"\\\\lambda\")))), mdx(\"span\", {\n    parentName: \"span\",\n    \"className\": \"katex-html\",\n    \"aria-hidden\": \"true\"\n  }, mdx(\"span\", {\n    parentName: \"span\",\n    \"className\": \"base\"\n  }, mdx(\"span\", {\n    parentName: \"span\",\n    \"className\": \"strut\",\n    \"style\": {\n      \"height\": \"0.6944em\"\n    }\n  }), mdx(\"span\", {\n    parentName: \"span\",\n    \"className\": \"mord mathnormal\"\n  }, \"\\u03BB\"))))), \" parameter in the probability mass function) of random events occurred over that time interval. One example might be: we know the average number of students visiting the university website per hour on the exam results release day was 876, what is the probability of exactly 900 students visiting the website in a given hour? The answer is \", mdx(\"span\", {\n    parentName: \"p\",\n    \"className\": \"math math-inline\"\n  }, mdx(\"span\", {\n    parentName: \"span\",\n    \"className\": \"katex\"\n  }, mdx(\"span\", {\n    parentName: \"span\",\n    \"className\": \"katex-mathml\"\n  }, mdx(\"math\", {\n    parentName: \"span\",\n    \"xmlns\": \"http://www.w3.org/1998/Math/MathML\"\n  }, mdx(\"semantics\", {\n    parentName: \"math\"\n  }, mdx(\"mrow\", {\n    parentName: \"semantics\"\n  }, mdx(\"mn\", {\n    parentName: \"mrow\"\n  }, \"0.96\"), mdx(\"mi\", {\n    parentName: \"mrow\",\n    \"mathvariant\": \"normal\"\n  }, \"%\")), mdx(\"annotation\", {\n    parentName: \"semantics\",\n    \"encoding\": \"application/x-tex\"\n  }, \"0.96\\\\%\")))), mdx(\"span\", {\n    parentName: \"span\",\n    \"className\": \"katex-html\",\n    \"aria-hidden\": \"true\"\n  }, mdx(\"span\", {\n    parentName: \"span\",\n    \"className\": \"base\"\n  }, mdx(\"span\", {\n    parentName: \"span\",\n    \"className\": \"strut\",\n    \"style\": {\n      \"height\": \"0.8056em\",\n      \"verticalAlign\": \"-0.0556em\"\n    }\n  }), mdx(\"span\", {\n    parentName: \"span\",\n    \"className\": \"mord\"\n  }, \"0.96%\"))))), \". And we can also calculate the following probabilities:\"), mdx(\"ul\", null, mdx(\"li\", {\n    parentName: \"ul\"\n  }, \"Less than 900 students: \", mdx(\"span\", {\n    parentName: \"li\",\n    \"className\": \"math math-inline\"\n  }, mdx(\"span\", {\n    parentName: \"span\",\n    \"className\": \"katex\"\n  }, mdx(\"span\", {\n    parentName: \"span\",\n    \"className\": \"katex-mathml\"\n  }, mdx(\"math\", {\n    parentName: \"span\",\n    \"xmlns\": \"http://www.w3.org/1998/Math/MathML\"\n  }, mdx(\"semantics\", {\n    parentName: \"math\"\n  }, mdx(\"mrow\", {\n    parentName: \"semantics\"\n  }, mdx(\"mn\", {\n    parentName: \"mrow\"\n  }, \"78.7\"), mdx(\"mi\", {\n    parentName: \"mrow\",\n    \"mathvariant\": \"normal\"\n  }, \"%\")), mdx(\"annotation\", {\n    parentName: \"semantics\",\n    \"encoding\": \"application/x-tex\"\n  }, \"78.7\\\\%\")))), mdx(\"span\", {\n    parentName: \"span\",\n    \"className\": \"katex-html\",\n    \"aria-hidden\": \"true\"\n  }, mdx(\"span\", {\n    parentName: \"span\",\n    \"className\": \"base\"\n  }, mdx(\"span\", {\n    parentName: \"span\",\n    \"className\": \"strut\",\n    \"style\": {\n      \"height\": \"0.8056em\",\n      \"verticalAlign\": \"-0.0556em\"\n    }\n  }), mdx(\"span\", {\n    parentName: \"span\",\n    \"className\": \"mord\"\n  }, \"78.7%\")))))), mdx(\"li\", {\n    parentName: \"ul\"\n  }, \"More than 900 students: \", mdx(\"span\", {\n    parentName: \"li\",\n    \"className\": \"math math-inline\"\n  }, mdx(\"span\", {\n    parentName: \"span\",\n    \"className\": \"katex\"\n  }, mdx(\"span\", {\n    parentName: \"span\",\n    \"className\": \"katex-mathml\"\n  }, mdx(\"math\", {\n    parentName: \"span\",\n    \"xmlns\": \"http://www.w3.org/1998/Math/MathML\"\n  }, mdx(\"semantics\", {\n    parentName: \"math\"\n  }, mdx(\"mrow\", {\n    parentName: \"semantics\"\n  }, mdx(\"mn\", {\n    parentName: \"mrow\"\n  }, \"20.3\"), mdx(\"mi\", {\n    parentName: \"mrow\",\n    \"mathvariant\": \"normal\"\n  }, \"%\")), mdx(\"annotation\", {\n    parentName: \"semantics\",\n    \"encoding\": \"application/x-tex\"\n  }, \"20.3\\\\%\")))), mdx(\"span\", {\n    parentName: \"span\",\n    \"className\": \"katex-html\",\n    \"aria-hidden\": \"true\"\n  }, mdx(\"span\", {\n    parentName: \"span\",\n    \"className\": \"base\"\n  }, mdx(\"span\", {\n    parentName: \"span\",\n    \"className\": \"strut\",\n    \"style\": {\n      \"height\": \"0.8056em\",\n      \"verticalAlign\": \"-0.0556em\"\n    }\n  }), mdx(\"span\", {\n    parentName: \"span\",\n    \"className\": \"mord\"\n  }, \"20.3%\"))))))), mdx(\"p\", null, mdx(\"img\", {\n    parentName: \"p\",\n    \"src\": \"/e4abee0834b12631ccc1ddf3b96db4e6/poisson.png\",\n    \"alt\": \"Poisson distribution\"\n  })), mdx(\"p\", null, \"One aspect of the Poisson distribution is the mean and variance are equal, resulting in very high outliers if the mean is large. Therefore, when we model the mean we also model increased variation around the mean, as the mean increases. If we failed to model data using Gaussian distribution then a mean versas variance graph should be plotted to check if it shows the characteristics of the Poisson or lognormal distribution.\"), mdx(\"div\", {\n    className: \"bg-shefYellow shadow-md p-3 md:p-5 rounded-3xl text-base text-black\"\n  }, mdx(\"h2\", {\n    className: \"mt-0 flex items-center\"\n  }, mdx(HiOutlineLightBulb, {\n    className: \"inline-block text-4xl mr-2\",\n    mdxType: \"HiOutlineLightBulb\"\n  }), \" When to use?\"), mdx(\"ul\", {\n    className: \"my-0\"\n  }, mdx(\"li\", null, \"Model count data\"), mdx(\"li\", null, \"Prediction of events in a given time interval (providing that the mean is given)\"), mdx(\"li\", null, \"The mean and variance are equal\"))), mdx(\"h3\", {\n    \"id\": \"geometric\",\n    \"style\": {\n      \"position\": \"relative\"\n    }\n  }, mdx(\"a\", {\n    parentName: \"h3\",\n    \"href\": \"#geometric\",\n    \"aria-label\": \"geometric permalink\",\n    \"className\": \"anchor before\"\n  }, mdx(\"undefined\", {\n    parentName: \"a\"\n  })), \"Geometric\"), mdx(\"p\", null, mdx(\"img\", {\n    parentName: \"p\",\n    \"src\": \"/ae0b5d9add235bbfd22c6370c317ac1b/geometricWeather.png\",\n    \"alt\": \"Weather example\"\n  }), \"   \"), mdx(\"p\", null, \"The geometric distribution is a special case of the negative binomial distribution. Suppose we have a sequence of independent trials (Bernoulli) with the probability of success \", mdx(\"span\", {\n    parentName: \"p\",\n    \"className\": \"math math-inline\"\n  }, mdx(\"span\", {\n    parentName: \"span\",\n    \"className\": \"katex\"\n  }, mdx(\"span\", {\n    parentName: \"span\",\n    \"className\": \"katex-mathml\"\n  }, mdx(\"math\", {\n    parentName: \"span\",\n    \"xmlns\": \"http://www.w3.org/1998/Math/MathML\"\n  }, mdx(\"semantics\", {\n    parentName: \"math\"\n  }, mdx(\"mrow\", {\n    parentName: \"semantics\"\n  }, mdx(\"mi\", {\n    parentName: \"mrow\"\n  }, \"p\")), mdx(\"annotation\", {\n    parentName: \"semantics\",\n    \"encoding\": \"application/x-tex\"\n  }, \"p\")))), mdx(\"span\", {\n    parentName: \"span\",\n    \"className\": \"katex-html\",\n    \"aria-hidden\": \"true\"\n  }, mdx(\"span\", {\n    parentName: \"span\",\n    \"className\": \"base\"\n  }, mdx(\"span\", {\n    parentName: \"span\",\n    \"className\": \"strut\",\n    \"style\": {\n      \"height\": \"0.625em\",\n      \"verticalAlign\": \"-0.1944em\"\n    }\n  }), mdx(\"span\", {\n    parentName: \"span\",\n    \"className\": \"mord mathnormal\"\n  }, \"p\"))))), \" in each trial, then the probability distribution of a random variable \", mdx(\"span\", {\n    parentName: \"p\",\n    \"className\": \"math math-inline\"\n  }, mdx(\"span\", {\n    parentName: \"span\",\n    \"className\": \"katex\"\n  }, mdx(\"span\", {\n    parentName: \"span\",\n    \"className\": \"katex-mathml\"\n  }, mdx(\"math\", {\n    parentName: \"span\",\n    \"xmlns\": \"http://www.w3.org/1998/Math/MathML\"\n  }, mdx(\"semantics\", {\n    parentName: \"math\"\n  }, mdx(\"mrow\", {\n    parentName: \"semantics\"\n  }, mdx(\"mi\", {\n    parentName: \"mrow\"\n  }, \"G\")), mdx(\"annotation\", {\n    parentName: \"semantics\",\n    \"encoding\": \"application/x-tex\"\n  }, \"G\")))), mdx(\"span\", {\n    parentName: \"span\",\n    \"className\": \"katex-html\",\n    \"aria-hidden\": \"true\"\n  }, mdx(\"span\", {\n    parentName: \"span\",\n    \"className\": \"base\"\n  }, mdx(\"span\", {\n    parentName: \"span\",\n    \"className\": \"strut\",\n    \"style\": {\n      \"height\": \"0.6833em\"\n    }\n  }), mdx(\"span\", {\n    parentName: \"span\",\n    \"className\": \"mord mathnormal\"\n  }, \"G\"))))), \", where its outcomes are the possible number of (failure) trials required until the first successful trial (in this case the number of total trials is not fixed), is called the geometric distribution. For examples:\"), mdx(\"ul\", null, mdx(\"li\", {\n    parentName: \"ul\"\n  }, \"suppose the probability of a sunny day is 0.15 in Sheffield and 0.85 for other, what's the probability of a day being sunny weather followed by 5 secutive days of other weathers.\"), mdx(\"li\", {\n    parentName: \"ul\"\n  }, \"a person tossing coins, what's the probability of seeing a head after 5 tails in a row\")), mdx(\"p\", null, mdx(\"img\", {\n    parentName: \"p\",\n    \"src\": \"/32a7cf16ebaa9afbf8054da823819360/geometric.png\",\n    \"alt\": \"Geometric sampling distribution\"\n  })), mdx(\"div\", {\n    className: \"bg-shefYellow shadow-md p-3 md:p-5 rounded-3xl text-base text-black\"\n  }, mdx(\"h2\", {\n    className: \"mt-0 flex items-center\"\n  }, mdx(HiOutlineLightBulb, {\n    className: \"inline-block text-4xl mr-2\",\n    mdxType: \"HiOutlineLightBulb\"\n  }), \" When to use?\"), mdx(\"ul\", {\n    className: \"my-0\"\n  }, mdx(\"li\", null, \"Model the number of failure trials until the first success\"))), mdx(\"h3\", {\n    \"id\": \"negative-binomial\",\n    \"style\": {\n      \"position\": \"relative\"\n    }\n  }, mdx(\"a\", {\n    parentName: \"h3\",\n    \"href\": \"#negative-binomial\",\n    \"aria-label\": \"negative binomial permalink\",\n    \"className\": \"anchor before\"\n  }, mdx(\"undefined\", {\n    parentName: \"a\"\n  })), \"Negative Binomial\"), mdx(\"p\", null, \"The negative binomial distribution is for modeling the distribution of outcomes of a random variable \", mdx(\"span\", {\n    parentName: \"p\",\n    \"className\": \"math math-inline\"\n  }, mdx(\"span\", {\n    parentName: \"span\",\n    \"className\": \"katex\"\n  }, mdx(\"span\", {\n    parentName: \"span\",\n    \"className\": \"katex-mathml\"\n  }, mdx(\"math\", {\n    parentName: \"span\",\n    \"xmlns\": \"http://www.w3.org/1998/Math/MathML\"\n  }, mdx(\"semantics\", {\n    parentName: \"math\"\n  }, mdx(\"mrow\", {\n    parentName: \"semantics\"\n  }, mdx(\"mi\", {\n    parentName: \"mrow\"\n  }, \"B\")), mdx(\"annotation\", {\n    parentName: \"semantics\",\n    \"encoding\": \"application/x-tex\"\n  }, \"B\")))), mdx(\"span\", {\n    parentName: \"span\",\n    \"className\": \"katex-html\",\n    \"aria-hidden\": \"true\"\n  }, mdx(\"span\", {\n    parentName: \"span\",\n    \"className\": \"base\"\n  }, mdx(\"span\", {\n    parentName: \"span\",\n    \"className\": \"strut\",\n    \"style\": {\n      \"height\": \"0.6833em\"\n    }\n  }), mdx(\"span\", {\n    parentName: \"span\",\n    \"className\": \"mord mathnormal\",\n    \"style\": {\n      \"marginRight\": \"0.05017em\"\n    }\n  }, \"B\"))))), \", where the outcomes are the number of bernoulli trials \", mdx(\"span\", {\n    parentName: \"p\",\n    \"className\": \"math math-inline\"\n  }, mdx(\"span\", {\n    parentName: \"span\",\n    \"className\": \"katex\"\n  }, mdx(\"span\", {\n    parentName: \"span\",\n    \"className\": \"katex-mathml\"\n  }, mdx(\"math\", {\n    parentName: \"span\",\n    \"xmlns\": \"http://www.w3.org/1998/Math/MathML\"\n  }, mdx(\"semantics\", {\n    parentName: \"math\"\n  }, mdx(\"mrow\", {\n    parentName: \"semantics\"\n  }, mdx(\"mi\", {\n    parentName: \"mrow\"\n  }, \"r\"), mdx(\"mo\", {\n    parentName: \"mrow\"\n  }, \"+\"), mdx(\"mi\", {\n    parentName: \"mrow\"\n  }, \"k\"), mdx(\"mo\", {\n    parentName: \"mrow\"\n  }, \"\\u2212\"), mdx(\"mn\", {\n    parentName: \"mrow\"\n  }, \"1\")), mdx(\"annotation\", {\n    parentName: \"semantics\",\n    \"encoding\": \"application/x-tex\"\n  }, \"r+k-1\")))), mdx(\"span\", {\n    parentName: \"span\",\n    \"className\": \"katex-html\",\n    \"aria-hidden\": \"true\"\n  }, mdx(\"span\", {\n    parentName: \"span\",\n    \"className\": \"base\"\n  }, mdx(\"span\", {\n    parentName: \"span\",\n    \"className\": \"strut\",\n    \"style\": {\n      \"height\": \"0.6667em\",\n      \"verticalAlign\": \"-0.0833em\"\n    }\n  }), mdx(\"span\", {\n    parentName: \"span\",\n    \"className\": \"mord mathnormal\",\n    \"style\": {\n      \"marginRight\": \"0.02778em\"\n    }\n  }, \"r\"), mdx(\"span\", {\n    parentName: \"span\",\n    \"className\": \"mspace\",\n    \"style\": {\n      \"marginRight\": \"0.2222em\"\n    }\n  }), mdx(\"span\", {\n    parentName: \"span\",\n    \"className\": \"mbin\"\n  }, \"+\"), mdx(\"span\", {\n    parentName: \"span\",\n    \"className\": \"mspace\",\n    \"style\": {\n      \"marginRight\": \"0.2222em\"\n    }\n  })), mdx(\"span\", {\n    parentName: \"span\",\n    \"className\": \"base\"\n  }, mdx(\"span\", {\n    parentName: \"span\",\n    \"className\": \"strut\",\n    \"style\": {\n      \"height\": \"0.7778em\",\n      \"verticalAlign\": \"-0.0833em\"\n    }\n  }), mdx(\"span\", {\n    parentName: \"span\",\n    \"className\": \"mord mathnormal\",\n    \"style\": {\n      \"marginRight\": \"0.03148em\"\n    }\n  }, \"k\"), mdx(\"span\", {\n    parentName: \"span\",\n    \"className\": \"mspace\",\n    \"style\": {\n      \"marginRight\": \"0.2222em\"\n    }\n  }), mdx(\"span\", {\n    parentName: \"span\",\n    \"className\": \"mbin\"\n  }, \"\\u2212\"), mdx(\"span\", {\n    parentName: \"span\",\n    \"className\": \"mspace\",\n    \"style\": {\n      \"marginRight\": \"0.2222em\"\n    }\n  })), mdx(\"span\", {\n    parentName: \"span\",\n    \"className\": \"base\"\n  }, mdx(\"span\", {\n    parentName: \"span\",\n    \"className\": \"strut\",\n    \"style\": {\n      \"height\": \"0.6444em\"\n    }\n  }), mdx(\"span\", {\n    parentName: \"span\",\n    \"className\": \"mord\"\n  }, \"1\"))))), \" (regardless failure or successful) until the \", mdx(\"span\", {\n    parentName: \"p\",\n    \"className\": \"math math-inline\"\n  }, mdx(\"span\", {\n    parentName: \"span\",\n    \"className\": \"katex\"\n  }, mdx(\"span\", {\n    parentName: \"span\",\n    \"className\": \"katex-mathml\"\n  }, mdx(\"math\", {\n    parentName: \"span\",\n    \"xmlns\": \"http://www.w3.org/1998/Math/MathML\"\n  }, mdx(\"semantics\", {\n    parentName: \"math\"\n  }, mdx(\"mrow\", {\n    parentName: \"semantics\"\n  }, mdx(\"mi\", {\n    parentName: \"mrow\"\n  }, \"r\")), mdx(\"annotation\", {\n    parentName: \"semantics\",\n    \"encoding\": \"application/x-tex\"\n  }, \"r\")))), mdx(\"span\", {\n    parentName: \"span\",\n    \"className\": \"katex-html\",\n    \"aria-hidden\": \"true\"\n  }, mdx(\"span\", {\n    parentName: \"span\",\n    \"className\": \"base\"\n  }, mdx(\"span\", {\n    parentName: \"span\",\n    \"className\": \"strut\",\n    \"style\": {\n      \"height\": \"0.4306em\"\n    }\n  }), mdx(\"span\", {\n    parentName: \"span\",\n    \"className\": \"mord mathnormal\",\n    \"style\": {\n      \"marginRight\": \"0.02778em\"\n    }\n  }, \"r\"))))), \"th successful trial. The number of trials is not fixed and the probability of success remains the same. Thus, it is an extension of the geometric distribution.  \"), mdx(\"p\", null, \"Another possible application of the negative binomial distribution is when the data appears to be overdispersion - the variance of data is significantly greater than the variance of the chosen distribution. If you have observed the variance in the Poisson is greater than expected, then maybe consider using this distribution (although there are a huge variety of ways of doing overdispersion including modelling the dispersion problem). To learn more about the origin of negative binomial and more examples, \", mdx(\"a\", {\n    parentName: \"p\",\n    \"href\": \"https://stattrek.com/probability-distributions/negative-binomial.aspx\"\n  }, \"click this link\"), \".  \"), mdx(\"p\", null, mdx(\"img\", {\n    parentName: \"p\",\n    \"src\": \"/2106b334090eaf051605bc87802d78c7/negativeB.png\",\n    \"alt\": \"Negative Binomial\"\n  })), mdx(\"div\", {\n    className: \"bg-shefYellow shadow-md p-3 md:p-5 rounded-3xl text-base text-black\"\n  }, mdx(\"h2\", {\n    className: \"mt-0 flex items-center\"\n  }, mdx(HiOutlineLightBulb, {\n    className: \"inline-block text-4xl mr-2\",\n    mdxType: \"HiOutlineLightBulb\"\n  }), \" When to use?\"), mdx(\"ul\", {\n    className: \"my-0\"\n  }, mdx(\"li\", null, \"Model count data\"), mdx(\"li\", null, \"Variance is greater than expected, Poisson does not work well in this case\"), mdx(\"li\", null, \"Interested in the number of trials required before the \", mdx(\"b\", null, \"k\"), \"th happens\"))), mdx(\"h2\", {\n    \"id\": \"continuous\",\n    \"style\": {\n      \"position\": \"relative\"\n    }\n  }, mdx(\"a\", {\n    parentName: \"h2\",\n    \"href\": \"#continuous\",\n    \"aria-label\": \"continuous permalink\",\n    \"className\": \"anchor before\"\n  }, mdx(\"undefined\", {\n    parentName: \"a\"\n  })), \"Continuous\"), mdx(\"p\", null, \"Before we move on to continuous distributions, let's recap the definition of a continuous random variable. A continuous random variable is a numerical representation of an experiment's outcomes, where these numerical representations can take a range of values (uncountably infinite). For example, random variables could take values in these intervals: \", mdx(\"span\", {\n    parentName: \"p\",\n    \"className\": \"math math-inline\"\n  }, mdx(\"span\", {\n    parentName: \"span\",\n    \"className\": \"katex\"\n  }, mdx(\"span\", {\n    parentName: \"span\",\n    \"className\": \"katex-mathml\"\n  }, mdx(\"math\", {\n    parentName: \"span\",\n    \"xmlns\": \"http://www.w3.org/1998/Math/MathML\"\n  }, mdx(\"semantics\", {\n    parentName: \"math\"\n  }, mdx(\"mrow\", {\n    parentName: \"semantics\"\n  }, mdx(\"mo\", {\n    parentName: \"mrow\",\n    \"stretchy\": \"false\"\n  }, \"[\"), mdx(\"mn\", {\n    parentName: \"mrow\"\n  }, \"0\"), mdx(\"mo\", {\n    parentName: \"mrow\",\n    \"separator\": \"true\"\n  }, \",\"), mdx(\"mn\", {\n    parentName: \"mrow\"\n  }, \"1\"), mdx(\"mo\", {\n    parentName: \"mrow\",\n    \"stretchy\": \"false\"\n  }, \"]\")), mdx(\"annotation\", {\n    parentName: \"semantics\",\n    \"encoding\": \"application/x-tex\"\n  }, \"[0, 1]\")))), mdx(\"span\", {\n    parentName: \"span\",\n    \"className\": \"katex-html\",\n    \"aria-hidden\": \"true\"\n  }, mdx(\"span\", {\n    parentName: \"span\",\n    \"className\": \"base\"\n  }, mdx(\"span\", {\n    parentName: \"span\",\n    \"className\": \"strut\",\n    \"style\": {\n      \"height\": \"1em\",\n      \"verticalAlign\": \"-0.25em\"\n    }\n  }), mdx(\"span\", {\n    parentName: \"span\",\n    \"className\": \"mopen\"\n  }, \"[\"), mdx(\"span\", {\n    parentName: \"span\",\n    \"className\": \"mord\"\n  }, \"0\"), mdx(\"span\", {\n    parentName: \"span\",\n    \"className\": \"mpunct\"\n  }, \",\"), mdx(\"span\", {\n    parentName: \"span\",\n    \"className\": \"mspace\",\n    \"style\": {\n      \"marginRight\": \"0.1667em\"\n    }\n  }), mdx(\"span\", {\n    parentName: \"span\",\n    \"className\": \"mord\"\n  }, \"1\"), mdx(\"span\", {\n    parentName: \"span\",\n    \"className\": \"mclose\"\n  }, \"]\"))))), \", \", mdx(\"span\", {\n    parentName: \"p\",\n    \"className\": \"math math-inline\"\n  }, mdx(\"span\", {\n    parentName: \"span\",\n    \"className\": \"katex\"\n  }, mdx(\"span\", {\n    parentName: \"span\",\n    \"className\": \"katex-mathml\"\n  }, mdx(\"math\", {\n    parentName: \"span\",\n    \"xmlns\": \"http://www.w3.org/1998/Math/MathML\"\n  }, mdx(\"semantics\", {\n    parentName: \"math\"\n  }, mdx(\"mrow\", {\n    parentName: \"semantics\"\n  }, mdx(\"mo\", {\n    parentName: \"mrow\",\n    \"stretchy\": \"false\"\n  }, \"(\"), mdx(\"mo\", {\n    parentName: \"mrow\"\n  }, \"\\u2212\"), mdx(\"mn\", {\n    parentName: \"mrow\"\n  }, \"1\"), mdx(\"mo\", {\n    parentName: \"mrow\",\n    \"separator\": \"true\"\n  }, \",\"), mdx(\"mn\", {\n    parentName: \"mrow\"\n  }, \"1\"), mdx(\"mo\", {\n    parentName: \"mrow\",\n    \"stretchy\": \"false\"\n  }, \")\")), mdx(\"annotation\", {\n    parentName: \"semantics\",\n    \"encoding\": \"application/x-tex\"\n  }, \"(-1, 1)\")))), mdx(\"span\", {\n    parentName: \"span\",\n    \"className\": \"katex-html\",\n    \"aria-hidden\": \"true\"\n  }, mdx(\"span\", {\n    parentName: \"span\",\n    \"className\": \"base\"\n  }, mdx(\"span\", {\n    parentName: \"span\",\n    \"className\": \"strut\",\n    \"style\": {\n      \"height\": \"1em\",\n      \"verticalAlign\": \"-0.25em\"\n    }\n  }), mdx(\"span\", {\n    parentName: \"span\",\n    \"className\": \"mopen\"\n  }, \"(\"), mdx(\"span\", {\n    parentName: \"span\",\n    \"className\": \"mord\"\n  }, \"\\u2212\"), mdx(\"span\", {\n    parentName: \"span\",\n    \"className\": \"mord\"\n  }, \"1\"), mdx(\"span\", {\n    parentName: \"span\",\n    \"className\": \"mpunct\"\n  }, \",\"), mdx(\"span\", {\n    parentName: \"span\",\n    \"className\": \"mspace\",\n    \"style\": {\n      \"marginRight\": \"0.1667em\"\n    }\n  }), mdx(\"span\", {\n    parentName: \"span\",\n    \"className\": \"mord\"\n  }, \"1\"), mdx(\"span\", {\n    parentName: \"span\",\n    \"className\": \"mclose\"\n  }, \")\"))))), \", \", mdx(\"span\", {\n    parentName: \"p\",\n    \"className\": \"math math-inline\"\n  }, mdx(\"span\", {\n    parentName: \"span\",\n    \"className\": \"katex\"\n  }, mdx(\"span\", {\n    parentName: \"span\",\n    \"className\": \"katex-mathml\"\n  }, mdx(\"math\", {\n    parentName: \"span\",\n    \"xmlns\": \"http://www.w3.org/1998/Math/MathML\"\n  }, mdx(\"semantics\", {\n    parentName: \"math\"\n  }, mdx(\"mrow\", {\n    parentName: \"semantics\"\n  }, mdx(\"mo\", {\n    parentName: \"mrow\",\n    \"stretchy\": \"false\"\n  }, \"(\"), mdx(\"mo\", {\n    parentName: \"mrow\"\n  }, \"\\u2212\"), mdx(\"mi\", {\n    parentName: \"mrow\",\n    \"mathvariant\": \"normal\"\n  }, \"\\u221E\"), mdx(\"mo\", {\n    parentName: \"mrow\",\n    \"separator\": \"true\"\n  }, \",\"), mdx(\"mn\", {\n    parentName: \"mrow\"\n  }, \"0\"), mdx(\"mo\", {\n    parentName: \"mrow\",\n    \"stretchy\": \"false\"\n  }, \")\")), mdx(\"annotation\", {\n    parentName: \"semantics\",\n    \"encoding\": \"application/x-tex\"\n  }, \"(-\\\\infty, 0)\")))), mdx(\"span\", {\n    parentName: \"span\",\n    \"className\": \"katex-html\",\n    \"aria-hidden\": \"true\"\n  }, mdx(\"span\", {\n    parentName: \"span\",\n    \"className\": \"base\"\n  }, mdx(\"span\", {\n    parentName: \"span\",\n    \"className\": \"strut\",\n    \"style\": {\n      \"height\": \"1em\",\n      \"verticalAlign\": \"-0.25em\"\n    }\n  }), mdx(\"span\", {\n    parentName: \"span\",\n    \"className\": \"mopen\"\n  }, \"(\"), mdx(\"span\", {\n    parentName: \"span\",\n    \"className\": \"mord\"\n  }, \"\\u2212\"), mdx(\"span\", {\n    parentName: \"span\",\n    \"className\": \"mord\"\n  }, \"\\u221E\"), mdx(\"span\", {\n    parentName: \"span\",\n    \"className\": \"mpunct\"\n  }, \",\"), mdx(\"span\", {\n    parentName: \"span\",\n    \"className\": \"mspace\",\n    \"style\": {\n      \"marginRight\": \"0.1667em\"\n    }\n  }), mdx(\"span\", {\n    parentName: \"span\",\n    \"className\": \"mord\"\n  }, \"0\"), mdx(\"span\", {\n    parentName: \"span\",\n    \"className\": \"mclose\"\n  }, \")\"))))), \", and \", mdx(\"span\", {\n    parentName: \"p\",\n    \"className\": \"math math-inline\"\n  }, mdx(\"span\", {\n    parentName: \"span\",\n    \"className\": \"katex\"\n  }, mdx(\"span\", {\n    parentName: \"span\",\n    \"className\": \"katex-mathml\"\n  }, mdx(\"math\", {\n    parentName: \"span\",\n    \"xmlns\": \"http://www.w3.org/1998/Math/MathML\"\n  }, mdx(\"semantics\", {\n    parentName: \"math\"\n  }, mdx(\"mrow\", {\n    parentName: \"semantics\"\n  }, mdx(\"mo\", {\n    parentName: \"mrow\",\n    \"stretchy\": \"false\"\n  }, \"[\"), mdx(\"mi\", {\n    parentName: \"mrow\"\n  }, \"a\"), mdx(\"mo\", {\n    parentName: \"mrow\",\n    \"separator\": \"true\"\n  }, \",\"), mdx(\"mi\", {\n    parentName: \"mrow\"\n  }, \"b\"), mdx(\"mo\", {\n    parentName: \"mrow\",\n    \"stretchy\": \"false\"\n  }, \"]\")), mdx(\"annotation\", {\n    parentName: \"semantics\",\n    \"encoding\": \"application/x-tex\"\n  }, \"[a, b]\")))), mdx(\"span\", {\n    parentName: \"span\",\n    \"className\": \"katex-html\",\n    \"aria-hidden\": \"true\"\n  }, mdx(\"span\", {\n    parentName: \"span\",\n    \"className\": \"base\"\n  }, mdx(\"span\", {\n    parentName: \"span\",\n    \"className\": \"strut\",\n    \"style\": {\n      \"height\": \"1em\",\n      \"verticalAlign\": \"-0.25em\"\n    }\n  }), mdx(\"span\", {\n    parentName: \"span\",\n    \"className\": \"mopen\"\n  }, \"[\"), mdx(\"span\", {\n    parentName: \"span\",\n    \"className\": \"mord mathnormal\"\n  }, \"a\"), mdx(\"span\", {\n    parentName: \"span\",\n    \"className\": \"mpunct\"\n  }, \",\"), mdx(\"span\", {\n    parentName: \"span\",\n    \"className\": \"mspace\",\n    \"style\": {\n      \"marginRight\": \"0.1667em\"\n    }\n  }), mdx(\"span\", {\n    parentName: \"span\",\n    \"className\": \"mord mathnormal\"\n  }, \"b\"), mdx(\"span\", {\n    parentName: \"span\",\n    \"className\": \"mclose\"\n  }, \"]\"))))), \". Some real-life examples of continuous random variables are time, mass, volume, length, etc. Since the number of possible values that a continuous random variable can take is uncountable, the probability for any specific value is zero (i.e. area under the probability density curve is zero), meaning we cannot calculate the probability at any specific point but we can still work out the probability for a certain range.  \"), mdx(\"p\", null, \"A \", mdx(\"a\", {\n    parentName: \"p\",\n    \"href\": \"https://en.wikipedia.org/wiki/Probability_density_function\"\n  }, \"probability density function\"), \" of a random variable \", mdx(\"span\", {\n    parentName: \"p\",\n    \"className\": \"math math-inline\"\n  }, mdx(\"span\", {\n    parentName: \"span\",\n    \"className\": \"katex\"\n  }, mdx(\"span\", {\n    parentName: \"span\",\n    \"className\": \"katex-mathml\"\n  }, mdx(\"math\", {\n    parentName: \"span\",\n    \"xmlns\": \"http://www.w3.org/1998/Math/MathML\"\n  }, mdx(\"semantics\", {\n    parentName: \"math\"\n  }, mdx(\"mrow\", {\n    parentName: \"semantics\"\n  }, mdx(\"mi\", {\n    parentName: \"mrow\"\n  }, \"X\")), mdx(\"annotation\", {\n    parentName: \"semantics\",\n    \"encoding\": \"application/x-tex\"\n  }, \"X\")))), mdx(\"span\", {\n    parentName: \"span\",\n    \"className\": \"katex-html\",\n    \"aria-hidden\": \"true\"\n  }, mdx(\"span\", {\n    parentName: \"span\",\n    \"className\": \"base\"\n  }, mdx(\"span\", {\n    parentName: \"span\",\n    \"className\": \"strut\",\n    \"style\": {\n      \"height\": \"0.6833em\"\n    }\n  }), mdx(\"span\", {\n    parentName: \"span\",\n    \"className\": \"mord mathnormal\",\n    \"style\": {\n      \"marginRight\": \"0.07847em\"\n    }\n  }, \"X\"))))), \" is a function that describes the relative likelihood of occurrence of the random variable \", mdx(\"span\", {\n    parentName: \"p\",\n    \"className\": \"math math-inline\"\n  }, mdx(\"span\", {\n    parentName: \"span\",\n    \"className\": \"katex\"\n  }, mdx(\"span\", {\n    parentName: \"span\",\n    \"className\": \"katex-mathml\"\n  }, mdx(\"math\", {\n    parentName: \"span\",\n    \"xmlns\": \"http://www.w3.org/1998/Math/MathML\"\n  }, mdx(\"semantics\", {\n    parentName: \"math\"\n  }, mdx(\"mrow\", {\n    parentName: \"semantics\"\n  }, mdx(\"mi\", {\n    parentName: \"mrow\"\n  }, \"X\")), mdx(\"annotation\", {\n    parentName: \"semantics\",\n    \"encoding\": \"application/x-tex\"\n  }, \"X\")))), mdx(\"span\", {\n    parentName: \"span\",\n    \"className\": \"katex-html\",\n    \"aria-hidden\": \"true\"\n  }, mdx(\"span\", {\n    parentName: \"span\",\n    \"className\": \"base\"\n  }, mdx(\"span\", {\n    parentName: \"span\",\n    \"className\": \"strut\",\n    \"style\": {\n      \"height\": \"0.6833em\"\n    }\n  }), mdx(\"span\", {\n    parentName: \"span\",\n    \"className\": \"mord mathnormal\",\n    \"style\": {\n      \"marginRight\": \"0.07847em\"\n    }\n  }, \"X\"))))), \"'s possible values.\"), mdx(\"p\", null, mdx(\"img\", {\n    parentName: \"p\",\n    \"src\": \"https://images.deepai.org/glossary-terms/51a7646ef6334199983a16c67f57babf/PDF.png\",\n    \"alt\": \"Probability Density Function\"\n  }), mdx(\"br\", {\n    parentName: \"p\"\n  }), \"\\n\", mdx(\"em\", {\n    parentName: \"p\"\n  }, \"The probability of \", mdx(\"span\", {\n    parentName: \"em\",\n    \"className\": \"math math-inline\"\n  }, mdx(\"span\", {\n    parentName: \"span\",\n    \"className\": \"katex\"\n  }, mdx(\"span\", {\n    parentName: \"span\",\n    \"className\": \"katex-mathml\"\n  }, mdx(\"math\", {\n    parentName: \"span\",\n    \"xmlns\": \"http://www.w3.org/1998/Math/MathML\"\n  }, mdx(\"semantics\", {\n    parentName: \"math\"\n  }, mdx(\"mrow\", {\n    parentName: \"semantics\"\n  }, mdx(\"mi\", {\n    parentName: \"mrow\"\n  }, \"x\")), mdx(\"annotation\", {\n    parentName: \"semantics\",\n    \"encoding\": \"application/x-tex\"\n  }, \"x\")))), mdx(\"span\", {\n    parentName: \"span\",\n    \"className\": \"katex-html\",\n    \"aria-hidden\": \"true\"\n  }, mdx(\"span\", {\n    parentName: \"span\",\n    \"className\": \"base\"\n  }, mdx(\"span\", {\n    parentName: \"span\",\n    \"className\": \"strut\",\n    \"style\": {\n      \"height\": \"0.4306em\"\n    }\n  }), mdx(\"span\", {\n    parentName: \"span\",\n    \"className\": \"mord mathnormal\"\n  }, \"x\"))))), \" is the area under the curve from \", mdx(\"span\", {\n    parentName: \"em\",\n    \"className\": \"math math-inline\"\n  }, mdx(\"span\", {\n    parentName: \"span\",\n    \"className\": \"katex\"\n  }, mdx(\"span\", {\n    parentName: \"span\",\n    \"className\": \"katex-mathml\"\n  }, mdx(\"math\", {\n    parentName: \"span\",\n    \"xmlns\": \"http://www.w3.org/1998/Math/MathML\"\n  }, mdx(\"semantics\", {\n    parentName: \"math\"\n  }, mdx(\"mrow\", {\n    parentName: \"semantics\"\n  }, mdx(\"mi\", {\n    parentName: \"mrow\"\n  }, \"a\")), mdx(\"annotation\", {\n    parentName: \"semantics\",\n    \"encoding\": \"application/x-tex\"\n  }, \"a\")))), mdx(\"span\", {\n    parentName: \"span\",\n    \"className\": \"katex-html\",\n    \"aria-hidden\": \"true\"\n  }, mdx(\"span\", {\n    parentName: \"span\",\n    \"className\": \"base\"\n  }, mdx(\"span\", {\n    parentName: \"span\",\n    \"className\": \"strut\",\n    \"style\": {\n      \"height\": \"0.4306em\"\n    }\n  }), mdx(\"span\", {\n    parentName: \"span\",\n    \"className\": \"mord mathnormal\"\n  }, \"a\"))))), \" to \", mdx(\"span\", {\n    parentName: \"em\",\n    \"className\": \"math math-inline\"\n  }, mdx(\"span\", {\n    parentName: \"span\",\n    \"className\": \"katex\"\n  }, mdx(\"span\", {\n    parentName: \"span\",\n    \"className\": \"katex-mathml\"\n  }, mdx(\"math\", {\n    parentName: \"span\",\n    \"xmlns\": \"http://www.w3.org/1998/Math/MathML\"\n  }, mdx(\"semantics\", {\n    parentName: \"math\"\n  }, mdx(\"mrow\", {\n    parentName: \"semantics\"\n  }, mdx(\"mi\", {\n    parentName: \"mrow\"\n  }, \"b\")), mdx(\"annotation\", {\n    parentName: \"semantics\",\n    \"encoding\": \"application/x-tex\"\n  }, \"b\")))), mdx(\"span\", {\n    parentName: \"span\",\n    \"className\": \"katex-html\",\n    \"aria-hidden\": \"true\"\n  }, mdx(\"span\", {\n    parentName: \"span\",\n    \"className\": \"base\"\n  }, mdx(\"span\", {\n    parentName: \"span\",\n    \"className\": \"strut\",\n    \"style\": {\n      \"height\": \"0.6944em\"\n    }\n  }), mdx(\"span\", {\n    parentName: \"span\",\n    \"className\": \"mord mathnormal\"\n  }, \"b\"))))), \". (\", mdx(\"a\", {\n    parentName: \"em\",\n    \"href\": \"https://deepai.org/machine-learning-glossary-and-terms/probability-density-function\"\n  }, \"source\"), \")\"), \"  \"), mdx(\"p\", null, \"Same as in the discrete section, for each distribution we have created a graph containing subplots and you will see how the distribution responds to the change of parameters. If you would like a copy of codes that generates these graphs, \", mdx(\"a\", {\n    parentName: \"p\",\n    \"href\": \"/a24c54d72bd73f7d09b18a953c8502a2/Continuous.r\"\n  }, \"download it here\"), \".\"), mdx(\"p\", null, \"We also recommend you visit the \", mdx(\"a\", {\n    parentName: \"p\",\n    \"href\": \"https://www.essycode.com/distribution-viewer/\"\n  }, \"distribution viewer\"), \" website and as it would help you to explore different distributions dynamically.\"), mdx(\"h3\", {\n    \"id\": \"gaussian\",\n    \"style\": {\n      \"position\": \"relative\"\n    }\n  }, mdx(\"a\", {\n    parentName: \"h3\",\n    \"href\": \"#gaussian\",\n    \"aria-label\": \"gaussian permalink\",\n    \"className\": \"anchor before\"\n  }, mdx(\"undefined\", {\n    parentName: \"a\"\n  })), \"Gaussian\"), mdx(\"p\", null, \"The Gaussian distribution (also known as the normal distribution) is probably the most important and common distribution in statistics (and in other areas such as engineering and physics) and it is often used for random variables with unknown distributions. The shape of Gaussian distribution's probability density function is known as the bell curve. Many examples around us are distributed as Gaussian distribution: IQ, exam results, heights, and salaries.  \"), mdx(\"p\", null, mdx(\"img\", {\n    parentName: \"p\",\n    \"src\": \"/64c0abb53317f0964212e03698e5b9d1/normal.png\",\n    \"alt\": \"Gaussian distributions\"\n  }), \"  \"), mdx(\"div\", {\n    className: \"bg-shefYellow shadow-md p-3 md:p-5 rounded-3xl text-base text-black\"\n  }, mdx(\"h2\", {\n    className: \"mt-0 flex items-center\"\n  }, mdx(HiOutlineLightBulb, {\n    className: \"inline-block text-4xl mr-2\",\n    mdxType: \"HiOutlineLightBulb\"\n  }), \" When to use?\"), mdx(\"ul\", {\n    className: \"my-0\"\n  }, mdx(\"li\", null, \"Distribution of the random variable is unknown and we can use the Gaussian distribution for the initial exploration\"), mdx(\"li\", null, \"Most of data (approx. 99.7%) are within three standard deviation from the mean, 95% of data should be within two standard deviation from the mean, and 68% of data are within one standard deviation from the mean\"))), mdx(\"p\", null, \"From our experiences, when modelling with continuous distributions 60% of the time the Gaussian distribution is assumed, 30% of the time some form of parametric skewed distribution is assumed (lognormal or gamma) and 10% of the time the data refuses to readily fit any distribution.\"), mdx(\"h3\", {\n    \"id\": \"uniform\",\n    \"style\": {\n      \"position\": \"relative\"\n    }\n  }, mdx(\"a\", {\n    parentName: \"h3\",\n    \"href\": \"#uniform\",\n    \"aria-label\": \"uniform permalink\",\n    \"className\": \"anchor before\"\n  }, mdx(\"undefined\", {\n    parentName: \"a\"\n  })), \"Uniform\"), mdx(\"p\", null, \"The continuous uniform distribution is similar to the discrete uniform distribution other than the calculation is slightly different. In a discrete uniform distribution every outcome has the same probability and we take \", mdx(\"span\", {\n    parentName: \"p\",\n    \"className\": \"math math-inline\"\n  }, mdx(\"span\", {\n    parentName: \"span\",\n    \"className\": \"katex\"\n  }, mdx(\"span\", {\n    parentName: \"span\",\n    \"className\": \"katex-mathml\"\n  }, mdx(\"math\", {\n    parentName: \"span\",\n    \"xmlns\": \"http://www.w3.org/1998/Math/MathML\"\n  }, mdx(\"semantics\", {\n    parentName: \"math\"\n  }, mdx(\"mrow\", {\n    parentName: \"semantics\"\n  }, mdx(\"mfrac\", {\n    parentName: \"mrow\"\n  }, mdx(\"mn\", {\n    parentName: \"mfrac\"\n  }, \"1\"), mdx(\"mi\", {\n    parentName: \"mfrac\"\n  }, \"k\"))), mdx(\"annotation\", {\n    parentName: \"semantics\",\n    \"encoding\": \"application/x-tex\"\n  }, \"\\\\frac{1}{k}\")))), mdx(\"span\", {\n    parentName: \"span\",\n    \"className\": \"katex-html\",\n    \"aria-hidden\": \"true\"\n  }, mdx(\"span\", {\n    parentName: \"span\",\n    \"className\": \"base\"\n  }, mdx(\"span\", {\n    parentName: \"span\",\n    \"className\": \"strut\",\n    \"style\": {\n      \"height\": \"1.1901em\",\n      \"verticalAlign\": \"-0.345em\"\n    }\n  }), mdx(\"span\", {\n    parentName: \"span\",\n    \"className\": \"mord\"\n  }, mdx(\"span\", {\n    parentName: \"span\",\n    \"className\": \"mopen nulldelimiter\"\n  }), mdx(\"span\", {\n    parentName: \"span\",\n    \"className\": \"mfrac\"\n  }, mdx(\"span\", {\n    parentName: \"span\",\n    \"className\": \"vlist-t vlist-t2\"\n  }, mdx(\"span\", {\n    parentName: \"span\",\n    \"className\": \"vlist-r\"\n  }, mdx(\"span\", {\n    parentName: \"span\",\n    \"className\": \"vlist\",\n    \"style\": {\n      \"height\": \"0.8451em\"\n    }\n  }, mdx(\"span\", {\n    parentName: \"span\",\n    \"style\": {\n      \"top\": \"-2.655em\"\n    }\n  }, mdx(\"span\", {\n    parentName: \"span\",\n    \"className\": \"pstrut\",\n    \"style\": {\n      \"height\": \"3em\"\n    }\n  }), mdx(\"span\", {\n    parentName: \"span\",\n    \"className\": \"sizing reset-size6 size3 mtight\"\n  }, mdx(\"span\", {\n    parentName: \"span\",\n    \"className\": \"mord mtight\"\n  }, mdx(\"span\", {\n    parentName: \"span\",\n    \"className\": \"mord mathnormal mtight\",\n    \"style\": {\n      \"marginRight\": \"0.03148em\"\n    }\n  }, \"k\")))), mdx(\"span\", {\n    parentName: \"span\",\n    \"style\": {\n      \"top\": \"-3.23em\"\n    }\n  }, mdx(\"span\", {\n    parentName: \"span\",\n    \"className\": \"pstrut\",\n    \"style\": {\n      \"height\": \"3em\"\n    }\n  }), mdx(\"span\", {\n    parentName: \"span\",\n    \"className\": \"frac-line\",\n    \"style\": {\n      \"borderBottomWidth\": \"0.04em\"\n    }\n  })), mdx(\"span\", {\n    parentName: \"span\",\n    \"style\": {\n      \"top\": \"-3.394em\"\n    }\n  }, mdx(\"span\", {\n    parentName: \"span\",\n    \"className\": \"pstrut\",\n    \"style\": {\n      \"height\": \"3em\"\n    }\n  }), mdx(\"span\", {\n    parentName: \"span\",\n    \"className\": \"sizing reset-size6 size3 mtight\"\n  }, mdx(\"span\", {\n    parentName: \"span\",\n    \"className\": \"mord mtight\"\n  }, mdx(\"span\", {\n    parentName: \"span\",\n    \"className\": \"mord mtight\"\n  }, \"1\"))))), mdx(\"span\", {\n    parentName: \"span\",\n    \"className\": \"vlist-s\"\n  }, \"\\u200B\")), mdx(\"span\", {\n    parentName: \"span\",\n    \"className\": \"vlist-r\"\n  }, mdx(\"span\", {\n    parentName: \"span\",\n    \"className\": \"vlist\",\n    \"style\": {\n      \"height\": \"0.345em\"\n    }\n  }, mdx(\"span\", {\n    parentName: \"span\"\n  }))))), mdx(\"span\", {\n    parentName: \"span\",\n    \"className\": \"mclose nulldelimiter\"\n  })))))), \" as the probability where \", mdx(\"span\", {\n    parentName: \"p\",\n    \"className\": \"math math-inline\"\n  }, mdx(\"span\", {\n    parentName: \"span\",\n    \"className\": \"katex\"\n  }, mdx(\"span\", {\n    parentName: \"span\",\n    \"className\": \"katex-mathml\"\n  }, mdx(\"math\", {\n    parentName: \"span\",\n    \"xmlns\": \"http://www.w3.org/1998/Math/MathML\"\n  }, mdx(\"semantics\", {\n    parentName: \"math\"\n  }, mdx(\"mrow\", {\n    parentName: \"semantics\"\n  }, mdx(\"mi\", {\n    parentName: \"mrow\"\n  }, \"k\")), mdx(\"annotation\", {\n    parentName: \"semantics\",\n    \"encoding\": \"application/x-tex\"\n  }, \"k\")))), mdx(\"span\", {\n    parentName: \"span\",\n    \"className\": \"katex-html\",\n    \"aria-hidden\": \"true\"\n  }, mdx(\"span\", {\n    parentName: \"span\",\n    \"className\": \"base\"\n  }, mdx(\"span\", {\n    parentName: \"span\",\n    \"className\": \"strut\",\n    \"style\": {\n      \"height\": \"0.6944em\"\n    }\n  }), mdx(\"span\", {\n    parentName: \"span\",\n    \"className\": \"mord mathnormal\",\n    \"style\": {\n      \"marginRight\": \"0.03148em\"\n    }\n  }, \"k\"))))), \" is the number of total outcomes. Whereas in a continuous uniform distribution, the random variable can take infinite number of values in the range \", mdx(\"span\", {\n    parentName: \"p\",\n    \"className\": \"math math-inline\"\n  }, mdx(\"span\", {\n    parentName: \"span\",\n    \"className\": \"katex\"\n  }, mdx(\"span\", {\n    parentName: \"span\",\n    \"className\": \"katex-mathml\"\n  }, mdx(\"math\", {\n    parentName: \"span\",\n    \"xmlns\": \"http://www.w3.org/1998/Math/MathML\"\n  }, mdx(\"semantics\", {\n    parentName: \"math\"\n  }, mdx(\"mrow\", {\n    parentName: \"semantics\"\n  }, mdx(\"mo\", {\n    parentName: \"mrow\",\n    \"stretchy\": \"false\"\n  }, \"[\"), mdx(\"mi\", {\n    parentName: \"mrow\"\n  }, \"a\"), mdx(\"mo\", {\n    parentName: \"mrow\",\n    \"separator\": \"true\"\n  }, \",\"), mdx(\"mi\", {\n    parentName: \"mrow\"\n  }, \"b\"), mdx(\"mo\", {\n    parentName: \"mrow\",\n    \"stretchy\": \"false\"\n  }, \"]\")), mdx(\"annotation\", {\n    parentName: \"semantics\",\n    \"encoding\": \"application/x-tex\"\n  }, \"[a,b]\")))), mdx(\"span\", {\n    parentName: \"span\",\n    \"className\": \"katex-html\",\n    \"aria-hidden\": \"true\"\n  }, mdx(\"span\", {\n    parentName: \"span\",\n    \"className\": \"base\"\n  }, mdx(\"span\", {\n    parentName: \"span\",\n    \"className\": \"strut\",\n    \"style\": {\n      \"height\": \"1em\",\n      \"verticalAlign\": \"-0.25em\"\n    }\n  }), mdx(\"span\", {\n    parentName: \"span\",\n    \"className\": \"mopen\"\n  }, \"[\"), mdx(\"span\", {\n    parentName: \"span\",\n    \"className\": \"mord mathnormal\"\n  }, \"a\"), mdx(\"span\", {\n    parentName: \"span\",\n    \"className\": \"mpunct\"\n  }, \",\"), mdx(\"span\", {\n    parentName: \"span\",\n    \"className\": \"mspace\",\n    \"style\": {\n      \"marginRight\": \"0.1667em\"\n    }\n  }), mdx(\"span\", {\n    parentName: \"span\",\n    \"className\": \"mord mathnormal\"\n  }, \"b\"), mdx(\"span\", {\n    parentName: \"span\",\n    \"className\": \"mclose\"\n  }, \"]\"))))), \" so the probability for each value within the range is \", mdx(\"span\", {\n    parentName: \"p\",\n    \"className\": \"math math-inline\"\n  }, mdx(\"span\", {\n    parentName: \"span\",\n    \"className\": \"katex\"\n  }, mdx(\"span\", {\n    parentName: \"span\",\n    \"className\": \"katex-mathml\"\n  }, mdx(\"math\", {\n    parentName: \"span\",\n    \"xmlns\": \"http://www.w3.org/1998/Math/MathML\"\n  }, mdx(\"semantics\", {\n    parentName: \"math\"\n  }, mdx(\"mrow\", {\n    parentName: \"semantics\"\n  }, mdx(\"mfrac\", {\n    parentName: \"mrow\"\n  }, mdx(\"mn\", {\n    parentName: \"mfrac\"\n  }, \"1\"), mdx(\"mrow\", {\n    parentName: \"mfrac\"\n  }, mdx(\"mi\", {\n    parentName: \"mrow\"\n  }, \"b\"), mdx(\"mo\", {\n    parentName: \"mrow\"\n  }, \"\\u2212\"), mdx(\"mi\", {\n    parentName: \"mrow\"\n  }, \"a\")))), mdx(\"annotation\", {\n    parentName: \"semantics\",\n    \"encoding\": \"application/x-tex\"\n  }, \"\\\\frac{1}{b-a}\")))), mdx(\"span\", {\n    parentName: \"span\",\n    \"className\": \"katex-html\",\n    \"aria-hidden\": \"true\"\n  }, mdx(\"span\", {\n    parentName: \"span\",\n    \"className\": \"base\"\n  }, mdx(\"span\", {\n    parentName: \"span\",\n    \"className\": \"strut\",\n    \"style\": {\n      \"height\": \"1.2484em\",\n      \"verticalAlign\": \"-0.4033em\"\n    }\n  }), mdx(\"span\", {\n    parentName: \"span\",\n    \"className\": \"mord\"\n  }, mdx(\"span\", {\n    parentName: \"span\",\n    \"className\": \"mopen nulldelimiter\"\n  }), mdx(\"span\", {\n    parentName: \"span\",\n    \"className\": \"mfrac\"\n  }, mdx(\"span\", {\n    parentName: \"span\",\n    \"className\": \"vlist-t vlist-t2\"\n  }, mdx(\"span\", {\n    parentName: \"span\",\n    \"className\": \"vlist-r\"\n  }, mdx(\"span\", {\n    parentName: \"span\",\n    \"className\": \"vlist\",\n    \"style\": {\n      \"height\": \"0.8451em\"\n    }\n  }, mdx(\"span\", {\n    parentName: \"span\",\n    \"style\": {\n      \"top\": \"-2.655em\"\n    }\n  }, mdx(\"span\", {\n    parentName: \"span\",\n    \"className\": \"pstrut\",\n    \"style\": {\n      \"height\": \"3em\"\n    }\n  }), mdx(\"span\", {\n    parentName: \"span\",\n    \"className\": \"sizing reset-size6 size3 mtight\"\n  }, mdx(\"span\", {\n    parentName: \"span\",\n    \"className\": \"mord mtight\"\n  }, mdx(\"span\", {\n    parentName: \"span\",\n    \"className\": \"mord mathnormal mtight\"\n  }, \"b\"), mdx(\"span\", {\n    parentName: \"span\",\n    \"className\": \"mbin mtight\"\n  }, \"\\u2212\"), mdx(\"span\", {\n    parentName: \"span\",\n    \"className\": \"mord mathnormal mtight\"\n  }, \"a\")))), mdx(\"span\", {\n    parentName: \"span\",\n    \"style\": {\n      \"top\": \"-3.23em\"\n    }\n  }, mdx(\"span\", {\n    parentName: \"span\",\n    \"className\": \"pstrut\",\n    \"style\": {\n      \"height\": \"3em\"\n    }\n  }), mdx(\"span\", {\n    parentName: \"span\",\n    \"className\": \"frac-line\",\n    \"style\": {\n      \"borderBottomWidth\": \"0.04em\"\n    }\n  })), mdx(\"span\", {\n    parentName: \"span\",\n    \"style\": {\n      \"top\": \"-3.394em\"\n    }\n  }, mdx(\"span\", {\n    parentName: \"span\",\n    \"className\": \"pstrut\",\n    \"style\": {\n      \"height\": \"3em\"\n    }\n  }), mdx(\"span\", {\n    parentName: \"span\",\n    \"className\": \"sizing reset-size6 size3 mtight\"\n  }, mdx(\"span\", {\n    parentName: \"span\",\n    \"className\": \"mord mtight\"\n  }, mdx(\"span\", {\n    parentName: \"span\",\n    \"className\": \"mord mtight\"\n  }, \"1\"))))), mdx(\"span\", {\n    parentName: \"span\",\n    \"className\": \"vlist-s\"\n  }, \"\\u200B\")), mdx(\"span\", {\n    parentName: \"span\",\n    \"className\": \"vlist-r\"\n  }, mdx(\"span\", {\n    parentName: \"span\",\n    \"className\": \"vlist\",\n    \"style\": {\n      \"height\": \"0.4033em\"\n    }\n  }, mdx(\"span\", {\n    parentName: \"span\"\n  }))))), mdx(\"span\", {\n    parentName: \"span\",\n    \"className\": \"mclose nulldelimiter\"\n  })))))), \" (i.e. evenly distributed according to the length of possible values).\"), mdx(\"div\", {\n    className: \"bg-shefYellow shadow-md p-3 md:p-5 rounded-3xl text-base text-black\"\n  }, mdx(\"h2\", {\n    className: \"mt-0 flex items-center\"\n  }, mdx(HiOutlineLightBulb, {\n    className: \"inline-block text-4xl mr-2\",\n    mdxType: \"HiOutlineLightBulb\"\n  }), \" When to use?\"), mdx(\"ul\", {\n    className: \"my-0\"\n  }, mdx(\"li\", null, \"When you know that every events are equally likely to happen\"))), mdx(\"h3\", {\n    \"id\": \"chi-square\",\n    \"style\": {\n      \"position\": \"relative\"\n    }\n  }, mdx(\"a\", {\n    parentName: \"h3\",\n    \"href\": \"#chi-square\",\n    \"aria-label\": \"chi square permalink\",\n    \"className\": \"anchor before\"\n  }, mdx(\"undefined\", {\n    parentName: \"a\"\n  })), \"Chi-square\"), mdx(\"p\", null, \"The chi-square distribution is primarily used in hypothesis testing and tests the difference between distributions for actual observations and expected outcomes (theoretical distribution). For example, we can use the chi-square to find out the type of cars people preferred across age groups. Another application will be to test whether two random variables are independent. \"), mdx(\"p\", null, mdx(\"img\", {\n    parentName: \"p\",\n    \"src\": \"/53e285d717309126426fa5eae553397c/chi.png\",\n    \"alt\": \"Chi-square distributions\"\n  })), mdx(\"div\", {\n    className: \"bg-shefYellow shadow-md p-3 md:p-5 rounded-3xl text-base text-black\"\n  }, mdx(\"h2\", {\n    className: \"mt-0 flex items-center\"\n  }, mdx(HiOutlineLightBulb, {\n    className: \"inline-block text-4xl mr-2\",\n    mdxType: \"HiOutlineLightBulb\"\n  }), \" When to use?\"), mdx(\"ul\", {\n    className: \"my-0\"\n  }, mdx(\"li\", null, \"Test the difference between actual observations and theoretical distribution\"), mdx(\"li\", null, \"Test for independence between random variables\"))), mdx(\"h3\", {\n    \"id\": \"f-distribution\",\n    \"style\": {\n      \"position\": \"relative\"\n    }\n  }, mdx(\"a\", {\n    parentName: \"h3\",\n    \"href\": \"#f-distribution\",\n    \"aria-label\": \"f distribution permalink\",\n    \"className\": \"anchor before\"\n  }, mdx(\"undefined\", {\n    parentName: \"a\"\n  })), \"F-distribution\"), mdx(\"p\", null, \"The F-distribution can be seen as a distribution of the ratio of two chi-square distributions, which is the ratio of two sums of squares of deviations of samples from their means. So variance between samples and variance within samples are needed. A F-distribution has two parameters \", mdx(\"span\", {\n    parentName: \"p\",\n    \"className\": \"math math-inline\"\n  }, mdx(\"span\", {\n    parentName: \"span\",\n    \"className\": \"katex\"\n  }, mdx(\"span\", {\n    parentName: \"span\",\n    \"className\": \"katex-mathml\"\n  }, mdx(\"math\", {\n    parentName: \"span\",\n    \"xmlns\": \"http://www.w3.org/1998/Math/MathML\"\n  }, mdx(\"semantics\", {\n    parentName: \"math\"\n  }, mdx(\"mrow\", {\n    parentName: \"semantics\"\n  }, mdx(\"msub\", {\n    parentName: \"mrow\"\n  }, mdx(\"mi\", {\n    parentName: \"msub\"\n  }, \"d\"), mdx(\"mn\", {\n    parentName: \"msub\"\n  }, \"1\"))), mdx(\"annotation\", {\n    parentName: \"semantics\",\n    \"encoding\": \"application/x-tex\"\n  }, \"d_{1}\")))), mdx(\"span\", {\n    parentName: \"span\",\n    \"className\": \"katex-html\",\n    \"aria-hidden\": \"true\"\n  }, mdx(\"span\", {\n    parentName: \"span\",\n    \"className\": \"base\"\n  }, mdx(\"span\", {\n    parentName: \"span\",\n    \"className\": \"strut\",\n    \"style\": {\n      \"height\": \"0.8444em\",\n      \"verticalAlign\": \"-0.15em\"\n    }\n  }), mdx(\"span\", {\n    parentName: \"span\",\n    \"className\": \"mord\"\n  }, mdx(\"span\", {\n    parentName: \"span\",\n    \"className\": \"mord mathnormal\"\n  }, \"d\"), mdx(\"span\", {\n    parentName: \"span\",\n    \"className\": \"msupsub\"\n  }, mdx(\"span\", {\n    parentName: \"span\",\n    \"className\": \"vlist-t vlist-t2\"\n  }, mdx(\"span\", {\n    parentName: \"span\",\n    \"className\": \"vlist-r\"\n  }, mdx(\"span\", {\n    parentName: \"span\",\n    \"className\": \"vlist\",\n    \"style\": {\n      \"height\": \"0.3011em\"\n    }\n  }, mdx(\"span\", {\n    parentName: \"span\",\n    \"style\": {\n      \"top\": \"-2.55em\",\n      \"marginLeft\": \"0em\",\n      \"marginRight\": \"0.05em\"\n    }\n  }, mdx(\"span\", {\n    parentName: \"span\",\n    \"className\": \"pstrut\",\n    \"style\": {\n      \"height\": \"2.7em\"\n    }\n  }), mdx(\"span\", {\n    parentName: \"span\",\n    \"className\": \"sizing reset-size6 size3 mtight\"\n  }, mdx(\"span\", {\n    parentName: \"span\",\n    \"className\": \"mord mtight\"\n  }, mdx(\"span\", {\n    parentName: \"span\",\n    \"className\": \"mord mtight\"\n  }, \"1\"))))), mdx(\"span\", {\n    parentName: \"span\",\n    \"className\": \"vlist-s\"\n  }, \"\\u200B\")), mdx(\"span\", {\n    parentName: \"span\",\n    \"className\": \"vlist-r\"\n  }, mdx(\"span\", {\n    parentName: \"span\",\n    \"className\": \"vlist\",\n    \"style\": {\n      \"height\": \"0.15em\"\n    }\n  }, mdx(\"span\", {\n    parentName: \"span\"\n  })))))))))), \" and \", mdx(\"span\", {\n    parentName: \"p\",\n    \"className\": \"math math-inline\"\n  }, mdx(\"span\", {\n    parentName: \"span\",\n    \"className\": \"katex\"\n  }, mdx(\"span\", {\n    parentName: \"span\",\n    \"className\": \"katex-mathml\"\n  }, mdx(\"math\", {\n    parentName: \"span\",\n    \"xmlns\": \"http://www.w3.org/1998/Math/MathML\"\n  }, mdx(\"semantics\", {\n    parentName: \"math\"\n  }, mdx(\"mrow\", {\n    parentName: \"semantics\"\n  }, mdx(\"msub\", {\n    parentName: \"mrow\"\n  }, mdx(\"mi\", {\n    parentName: \"msub\"\n  }, \"d\"), mdx(\"mn\", {\n    parentName: \"msub\"\n  }, \"2\"))), mdx(\"annotation\", {\n    parentName: \"semantics\",\n    \"encoding\": \"application/x-tex\"\n  }, \"d_{2}\")))), mdx(\"span\", {\n    parentName: \"span\",\n    \"className\": \"katex-html\",\n    \"aria-hidden\": \"true\"\n  }, mdx(\"span\", {\n    parentName: \"span\",\n    \"className\": \"base\"\n  }, mdx(\"span\", {\n    parentName: \"span\",\n    \"className\": \"strut\",\n    \"style\": {\n      \"height\": \"0.8444em\",\n      \"verticalAlign\": \"-0.15em\"\n    }\n  }), mdx(\"span\", {\n    parentName: \"span\",\n    \"className\": \"mord\"\n  }, mdx(\"span\", {\n    parentName: \"span\",\n    \"className\": \"mord mathnormal\"\n  }, \"d\"), mdx(\"span\", {\n    parentName: \"span\",\n    \"className\": \"msupsub\"\n  }, mdx(\"span\", {\n    parentName: \"span\",\n    \"className\": \"vlist-t vlist-t2\"\n  }, mdx(\"span\", {\n    parentName: \"span\",\n    \"className\": \"vlist-r\"\n  }, mdx(\"span\", {\n    parentName: \"span\",\n    \"className\": \"vlist\",\n    \"style\": {\n      \"height\": \"0.3011em\"\n    }\n  }, mdx(\"span\", {\n    parentName: \"span\",\n    \"style\": {\n      \"top\": \"-2.55em\",\n      \"marginLeft\": \"0em\",\n      \"marginRight\": \"0.05em\"\n    }\n  }, mdx(\"span\", {\n    parentName: \"span\",\n    \"className\": \"pstrut\",\n    \"style\": {\n      \"height\": \"2.7em\"\n    }\n  }), mdx(\"span\", {\n    parentName: \"span\",\n    \"className\": \"sizing reset-size6 size3 mtight\"\n  }, mdx(\"span\", {\n    parentName: \"span\",\n    \"className\": \"mord mtight\"\n  }, mdx(\"span\", {\n    parentName: \"span\",\n    \"className\": \"mord mtight\"\n  }, \"2\"))))), mdx(\"span\", {\n    parentName: \"span\",\n    \"className\": \"vlist-s\"\n  }, \"\\u200B\")), mdx(\"span\", {\n    parentName: \"span\",\n    \"className\": \"vlist-r\"\n  }, mdx(\"span\", {\n    parentName: \"span\",\n    \"className\": \"vlist\",\n    \"style\": {\n      \"height\": \"0.15em\"\n    }\n  }, mdx(\"span\", {\n    parentName: \"span\"\n  })))))))))), \", where \", mdx(\"span\", {\n    parentName: \"p\",\n    \"className\": \"math math-inline\"\n  }, mdx(\"span\", {\n    parentName: \"span\",\n    \"className\": \"katex\"\n  }, mdx(\"span\", {\n    parentName: \"span\",\n    \"className\": \"katex-mathml\"\n  }, mdx(\"math\", {\n    parentName: \"span\",\n    \"xmlns\": \"http://www.w3.org/1998/Math/MathML\"\n  }, mdx(\"semantics\", {\n    parentName: \"math\"\n  }, mdx(\"mrow\", {\n    parentName: \"semantics\"\n  }, mdx(\"msub\", {\n    parentName: \"mrow\"\n  }, mdx(\"mi\", {\n    parentName: \"msub\"\n  }, \"d\"), mdx(\"mn\", {\n    parentName: \"msub\"\n  }, \"1\"))), mdx(\"annotation\", {\n    parentName: \"semantics\",\n    \"encoding\": \"application/x-tex\"\n  }, \"d_{1}\")))), mdx(\"span\", {\n    parentName: \"span\",\n    \"className\": \"katex-html\",\n    \"aria-hidden\": \"true\"\n  }, mdx(\"span\", {\n    parentName: \"span\",\n    \"className\": \"base\"\n  }, mdx(\"span\", {\n    parentName: \"span\",\n    \"className\": \"strut\",\n    \"style\": {\n      \"height\": \"0.8444em\",\n      \"verticalAlign\": \"-0.15em\"\n    }\n  }), mdx(\"span\", {\n    parentName: \"span\",\n    \"className\": \"mord\"\n  }, mdx(\"span\", {\n    parentName: \"span\",\n    \"className\": \"mord mathnormal\"\n  }, \"d\"), mdx(\"span\", {\n    parentName: \"span\",\n    \"className\": \"msupsub\"\n  }, mdx(\"span\", {\n    parentName: \"span\",\n    \"className\": \"vlist-t vlist-t2\"\n  }, mdx(\"span\", {\n    parentName: \"span\",\n    \"className\": \"vlist-r\"\n  }, mdx(\"span\", {\n    parentName: \"span\",\n    \"className\": \"vlist\",\n    \"style\": {\n      \"height\": \"0.3011em\"\n    }\n  }, mdx(\"span\", {\n    parentName: \"span\",\n    \"style\": {\n      \"top\": \"-2.55em\",\n      \"marginLeft\": \"0em\",\n      \"marginRight\": \"0.05em\"\n    }\n  }, mdx(\"span\", {\n    parentName: \"span\",\n    \"className\": \"pstrut\",\n    \"style\": {\n      \"height\": \"2.7em\"\n    }\n  }), mdx(\"span\", {\n    parentName: \"span\",\n    \"className\": \"sizing reset-size6 size3 mtight\"\n  }, mdx(\"span\", {\n    parentName: \"span\",\n    \"className\": \"mord mtight\"\n  }, mdx(\"span\", {\n    parentName: \"span\",\n    \"className\": \"mord mtight\"\n  }, \"1\"))))), mdx(\"span\", {\n    parentName: \"span\",\n    \"className\": \"vlist-s\"\n  }, \"\\u200B\")), mdx(\"span\", {\n    parentName: \"span\",\n    \"className\": \"vlist-r\"\n  }, mdx(\"span\", {\n    parentName: \"span\",\n    \"className\": \"vlist\",\n    \"style\": {\n      \"height\": \"0.15em\"\n    }\n  }, mdx(\"span\", {\n    parentName: \"span\"\n  })))))))))), \" is the degrees of freedom of first chi-square distribution and \", mdx(\"span\", {\n    parentName: \"p\",\n    \"className\": \"math math-inline\"\n  }, mdx(\"span\", {\n    parentName: \"span\",\n    \"className\": \"katex\"\n  }, mdx(\"span\", {\n    parentName: \"span\",\n    \"className\": \"katex-mathml\"\n  }, mdx(\"math\", {\n    parentName: \"span\",\n    \"xmlns\": \"http://www.w3.org/1998/Math/MathML\"\n  }, mdx(\"semantics\", {\n    parentName: \"math\"\n  }, mdx(\"mrow\", {\n    parentName: \"semantics\"\n  }, mdx(\"msub\", {\n    parentName: \"mrow\"\n  }, mdx(\"mi\", {\n    parentName: \"msub\"\n  }, \"d\"), mdx(\"mn\", {\n    parentName: \"msub\"\n  }, \"2\"))), mdx(\"annotation\", {\n    parentName: \"semantics\",\n    \"encoding\": \"application/x-tex\"\n  }, \"d_{2}\")))), mdx(\"span\", {\n    parentName: \"span\",\n    \"className\": \"katex-html\",\n    \"aria-hidden\": \"true\"\n  }, mdx(\"span\", {\n    parentName: \"span\",\n    \"className\": \"base\"\n  }, mdx(\"span\", {\n    parentName: \"span\",\n    \"className\": \"strut\",\n    \"style\": {\n      \"height\": \"0.8444em\",\n      \"verticalAlign\": \"-0.15em\"\n    }\n  }), mdx(\"span\", {\n    parentName: \"span\",\n    \"className\": \"mord\"\n  }, mdx(\"span\", {\n    parentName: \"span\",\n    \"className\": \"mord mathnormal\"\n  }, \"d\"), mdx(\"span\", {\n    parentName: \"span\",\n    \"className\": \"msupsub\"\n  }, mdx(\"span\", {\n    parentName: \"span\",\n    \"className\": \"vlist-t vlist-t2\"\n  }, mdx(\"span\", {\n    parentName: \"span\",\n    \"className\": \"vlist-r\"\n  }, mdx(\"span\", {\n    parentName: \"span\",\n    \"className\": \"vlist\",\n    \"style\": {\n      \"height\": \"0.3011em\"\n    }\n  }, mdx(\"span\", {\n    parentName: \"span\",\n    \"style\": {\n      \"top\": \"-2.55em\",\n      \"marginLeft\": \"0em\",\n      \"marginRight\": \"0.05em\"\n    }\n  }, mdx(\"span\", {\n    parentName: \"span\",\n    \"className\": \"pstrut\",\n    \"style\": {\n      \"height\": \"2.7em\"\n    }\n  }), mdx(\"span\", {\n    parentName: \"span\",\n    \"className\": \"sizing reset-size6 size3 mtight\"\n  }, mdx(\"span\", {\n    parentName: \"span\",\n    \"className\": \"mord mtight\"\n  }, mdx(\"span\", {\n    parentName: \"span\",\n    \"className\": \"mord mtight\"\n  }, \"2\"))))), mdx(\"span\", {\n    parentName: \"span\",\n    \"className\": \"vlist-s\"\n  }, \"\\u200B\")), mdx(\"span\", {\n    parentName: \"span\",\n    \"className\": \"vlist-r\"\n  }, mdx(\"span\", {\n    parentName: \"span\",\n    \"className\": \"vlist\",\n    \"style\": {\n      \"height\": \"0.15em\"\n    }\n  }, mdx(\"span\", {\n    parentName: \"span\"\n  })))))))))), \" is the degrees of freedom for the second one. If the degrees of freedom is small then it means data are more spread out, and vice versa.  \"), mdx(\"p\", null, mdx(\"img\", {\n    parentName: \"p\",\n    \"src\": \"/29e3eef8a49f0b21691e69b754b95ed8/F.png\",\n    \"alt\": \"F-distribution\"\n  })), mdx(\"div\", {\n    className: \"bg-shefYellow shadow-md p-3 md:p-5 rounded-3xl text-base text-black\"\n  }, mdx(\"h2\", {\n    className: \"mt-0 flex items-center\"\n  }, mdx(HiOutlineLightBulb, {\n    className: \"inline-block text-4xl mr-2\",\n    mdxType: \"HiOutlineLightBulb\"\n  }), \" When to use?\"), mdx(\"ul\", {\n    className: \"my-0\"\n  }, mdx(\"li\", null, \"Test whether two independent samples (from Gaussian) were drawn with the same variance\"))), mdx(\"h3\", {\n    \"id\": \"exponential\",\n    \"style\": {\n      \"position\": \"relative\"\n    }\n  }, mdx(\"a\", {\n    parentName: \"h3\",\n    \"href\": \"#exponential\",\n    \"aria-label\": \"exponential permalink\",\n    \"className\": \"anchor before\"\n  }, mdx(\"undefined\", {\n    parentName: \"a\"\n  })), \"Exponential\"), mdx(\"p\", null, \"The probability density function of the exponential distribution gives the probability of decay at time \", mdx(\"span\", {\n    parentName: \"p\",\n    \"className\": \"math math-inline\"\n  }, mdx(\"span\", {\n    parentName: \"span\",\n    \"className\": \"katex\"\n  }, mdx(\"span\", {\n    parentName: \"span\",\n    \"className\": \"katex-mathml\"\n  }, mdx(\"math\", {\n    parentName: \"span\",\n    \"xmlns\": \"http://www.w3.org/1998/Math/MathML\"\n  }, mdx(\"semantics\", {\n    parentName: \"math\"\n  }, mdx(\"mrow\", {\n    parentName: \"semantics\"\n  }, mdx(\"mi\", {\n    parentName: \"mrow\"\n  }, \"t\")), mdx(\"annotation\", {\n    parentName: \"semantics\",\n    \"encoding\": \"application/x-tex\"\n  }, \"t\")))), mdx(\"span\", {\n    parentName: \"span\",\n    \"className\": \"katex-html\",\n    \"aria-hidden\": \"true\"\n  }, mdx(\"span\", {\n    parentName: \"span\",\n    \"className\": \"base\"\n  }, mdx(\"span\", {\n    parentName: \"span\",\n    \"className\": \"strut\",\n    \"style\": {\n      \"height\": \"0.6151em\"\n    }\n  }), mdx(\"span\", {\n    parentName: \"span\",\n    \"className\": \"mord mathnormal\"\n  }, \"t\"))))), \". This decay is due to the component \", mdx(\"span\", {\n    parentName: \"p\",\n    \"className\": \"math math-inline\"\n  }, mdx(\"span\", {\n    parentName: \"span\",\n    \"className\": \"katex\"\n  }, mdx(\"span\", {\n    parentName: \"span\",\n    \"className\": \"katex-mathml\"\n  }, mdx(\"math\", {\n    parentName: \"span\",\n    \"xmlns\": \"http://www.w3.org/1998/Math/MathML\"\n  }, mdx(\"semantics\", {\n    parentName: \"math\"\n  }, mdx(\"mrow\", {\n    parentName: \"semantics\"\n  }, mdx(\"mi\", {\n    parentName: \"mrow\"\n  }, \"\\u03BB\"), mdx(\"msup\", {\n    parentName: \"mrow\"\n  }, mdx(\"mi\", {\n    parentName: \"msup\"\n  }, \"e\"), mdx(\"mrow\", {\n    parentName: \"msup\"\n  }, mdx(\"mo\", {\n    parentName: \"mrow\"\n  }, \"\\u2212\"), mdx(\"mi\", {\n    parentName: \"mrow\"\n  }, \"\\u03BB\"), mdx(\"mi\", {\n    parentName: \"mrow\"\n  }, \"x\")))), mdx(\"annotation\", {\n    parentName: \"semantics\",\n    \"encoding\": \"application/x-tex\"\n  }, \"\\\\lambda e^{-\\\\lambda x}\")))), mdx(\"span\", {\n    parentName: \"span\",\n    \"className\": \"katex-html\",\n    \"aria-hidden\": \"true\"\n  }, mdx(\"span\", {\n    parentName: \"span\",\n    \"className\": \"base\"\n  }, mdx(\"span\", {\n    parentName: \"span\",\n    \"className\": \"strut\",\n    \"style\": {\n      \"height\": \"0.8491em\"\n    }\n  }), mdx(\"span\", {\n    parentName: \"span\",\n    \"className\": \"mord mathnormal\"\n  }, \"\\u03BB\"), mdx(\"span\", {\n    parentName: \"span\",\n    \"className\": \"mord\"\n  }, mdx(\"span\", {\n    parentName: \"span\",\n    \"className\": \"mord mathnormal\"\n  }, \"e\"), mdx(\"span\", {\n    parentName: \"span\",\n    \"className\": \"msupsub\"\n  }, mdx(\"span\", {\n    parentName: \"span\",\n    \"className\": \"vlist-t\"\n  }, mdx(\"span\", {\n    parentName: \"span\",\n    \"className\": \"vlist-r\"\n  }, mdx(\"span\", {\n    parentName: \"span\",\n    \"className\": \"vlist\",\n    \"style\": {\n      \"height\": \"0.8491em\"\n    }\n  }, mdx(\"span\", {\n    parentName: \"span\",\n    \"style\": {\n      \"top\": \"-3.063em\",\n      \"marginRight\": \"0.05em\"\n    }\n  }, mdx(\"span\", {\n    parentName: \"span\",\n    \"className\": \"pstrut\",\n    \"style\": {\n      \"height\": \"2.7em\"\n    }\n  }), mdx(\"span\", {\n    parentName: \"span\",\n    \"className\": \"sizing reset-size6 size3 mtight\"\n  }, mdx(\"span\", {\n    parentName: \"span\",\n    \"className\": \"mord mtight\"\n  }, mdx(\"span\", {\n    parentName: \"span\",\n    \"className\": \"mord mtight\"\n  }, \"\\u2212\"), mdx(\"span\", {\n    parentName: \"span\",\n    \"className\": \"mord mathnormal mtight\"\n  }, \"\\u03BB\"), mdx(\"span\", {\n    parentName: \"span\",\n    \"className\": \"mord mathnormal mtight\"\n  }, \"x\"))))))))))))), \" in the probability function which is referred to as the exponential decay and is commonly used for measuring radioactive decay, medication within the human body, and population of endangered species. The distribution is usually used to find out the time required until a specific event happens.\"), mdx(\"p\", null, \"The exponential distribution is related to the Poisson distribution as both distributions are a function of \", mdx(\"span\", {\n    parentName: \"p\",\n    \"className\": \"math math-inline\"\n  }, mdx(\"span\", {\n    parentName: \"span\",\n    \"className\": \"katex\"\n  }, mdx(\"span\", {\n    parentName: \"span\",\n    \"className\": \"katex-mathml\"\n  }, mdx(\"math\", {\n    parentName: \"span\",\n    \"xmlns\": \"http://www.w3.org/1998/Math/MathML\"\n  }, mdx(\"semantics\", {\n    parentName: \"math\"\n  }, mdx(\"mrow\", {\n    parentName: \"semantics\"\n  }, mdx(\"mi\", {\n    parentName: \"mrow\"\n  }, \"\\u03BB\")), mdx(\"annotation\", {\n    parentName: \"semantics\",\n    \"encoding\": \"application/x-tex\"\n  }, \"\\\\lambda\")))), mdx(\"span\", {\n    parentName: \"span\",\n    \"className\": \"katex-html\",\n    \"aria-hidden\": \"true\"\n  }, mdx(\"span\", {\n    parentName: \"span\",\n    \"className\": \"base\"\n  }, mdx(\"span\", {\n    parentName: \"span\",\n    \"className\": \"strut\",\n    \"style\": {\n      \"height\": \"0.6944em\"\n    }\n  }), mdx(\"span\", {\n    parentName: \"span\",\n    \"className\": \"mord mathnormal\"\n  }, \"\\u03BB\"))))), \". And provided the time unit is clearly defined in Poisson distribution, the \", mdx(\"span\", {\n    parentName: \"p\",\n    \"className\": \"math math-inline\"\n  }, mdx(\"span\", {\n    parentName: \"span\",\n    \"className\": \"katex\"\n  }, mdx(\"span\", {\n    parentName: \"span\",\n    \"className\": \"katex-mathml\"\n  }, mdx(\"math\", {\n    parentName: \"span\",\n    \"xmlns\": \"http://www.w3.org/1998/Math/MathML\"\n  }, mdx(\"semantics\", {\n    parentName: \"math\"\n  }, mdx(\"mrow\", {\n    parentName: \"semantics\"\n  }, mdx(\"mi\", {\n    parentName: \"mrow\"\n  }, \"\\u03BB\")), mdx(\"annotation\", {\n    parentName: \"semantics\",\n    \"encoding\": \"application/x-tex\"\n  }, \"\\\\lambda\")))), mdx(\"span\", {\n    parentName: \"span\",\n    \"className\": \"katex-html\",\n    \"aria-hidden\": \"true\"\n  }, mdx(\"span\", {\n    parentName: \"span\",\n    \"className\": \"base\"\n  }, mdx(\"span\", {\n    parentName: \"span\",\n    \"className\": \"strut\",\n    \"style\": {\n      \"height\": \"0.6944em\"\n    }\n  }), mdx(\"span\", {\n    parentName: \"span\",\n    \"className\": \"mord mathnormal\"\n  }, \"\\u03BB\"))))), \" will be identical in both distributions. For example, as mentioned previously the Poisson distribution can be used to model the number of students visiting the university website in a given time interval. In contrast, we can use the exponential distribution to model the difference between the visit time of current students and the visited time \", mdx(\"span\", {\n    parentName: \"p\",\n    \"className\": \"math math-inline\"\n  }, mdx(\"span\", {\n    parentName: \"span\",\n    \"className\": \"katex\"\n  }, mdx(\"span\", {\n    parentName: \"span\",\n    \"className\": \"katex-mathml\"\n  }, mdx(\"math\", {\n    parentName: \"span\",\n    \"xmlns\": \"http://www.w3.org/1998/Math/MathML\"\n  }, mdx(\"semantics\", {\n    parentName: \"math\"\n  }, mdx(\"mrow\", {\n    parentName: \"semantics\"\n  }, mdx(\"mi\", {\n    parentName: \"mrow\"\n  }, \"t\")), mdx(\"annotation\", {\n    parentName: \"semantics\",\n    \"encoding\": \"application/x-tex\"\n  }, \"t\")))), mdx(\"span\", {\n    parentName: \"span\",\n    \"className\": \"katex-html\",\n    \"aria-hidden\": \"true\"\n  }, mdx(\"span\", {\n    parentName: \"span\",\n    \"className\": \"base\"\n  }, mdx(\"span\", {\n    parentName: \"span\",\n    \"className\": \"strut\",\n    \"style\": {\n      \"height\": \"0.6151em\"\n    }\n  }), mdx(\"span\", {\n    parentName: \"span\",\n    \"className\": \"mord mathnormal\"\n  }, \"t\"))))), \" of the previous student.  \"), mdx(\"p\", null, mdx(\"strong\", {\n    parentName: \"p\"\n  }, \"Q.\"), \" Suppose on average there are 876 students visiting the website per hour (assuming these visits are \", mdx(\"a\", {\n    parentName: \"p\",\n    \"href\": \"https://www.stat.yale.edu/~pollard/Courses/241.fall97/Poisson.Proc.pdf\"\n  }, \"Poisson process\"), \"), what is the probability that we need to wait for 1 minute for the next student?  \"), mdx(\"p\", null, \"From the figure we deduce that the mean number of students visiting the website per minute is 14.6, then we can calculate the \", mdx(\"span\", {\n    parentName: \"p\",\n    \"className\": \"math math-inline\"\n  }, mdx(\"span\", {\n    parentName: \"span\",\n    \"className\": \"katex\"\n  }, mdx(\"span\", {\n    parentName: \"span\",\n    \"className\": \"katex-mathml\"\n  }, mdx(\"math\", {\n    parentName: \"span\",\n    \"xmlns\": \"http://www.w3.org/1998/Math/MathML\"\n  }, mdx(\"semantics\", {\n    parentName: \"math\"\n  }, mdx(\"mrow\", {\n    parentName: \"semantics\"\n  }, mdx(\"mi\", {\n    parentName: \"mrow\"\n  }, \"\\u03BB\")), mdx(\"annotation\", {\n    parentName: \"semantics\",\n    \"encoding\": \"application/x-tex\"\n  }, \"\\\\lambda\")))), mdx(\"span\", {\n    parentName: \"span\",\n    \"className\": \"katex-html\",\n    \"aria-hidden\": \"true\"\n  }, mdx(\"span\", {\n    parentName: \"span\",\n    \"className\": \"base\"\n  }, mdx(\"span\", {\n    parentName: \"span\",\n    \"className\": \"strut\",\n    \"style\": {\n      \"height\": \"0.6944em\"\n    }\n  }), mdx(\"span\", {\n    parentName: \"span\",\n    \"className\": \"mord mathnormal\"\n  }, \"\\u03BB\"))))), \" as \", mdx(\"span\", {\n    parentName: \"p\",\n    \"className\": \"math math-inline\"\n  }, mdx(\"span\", {\n    parentName: \"span\",\n    \"className\": \"katex\"\n  }, mdx(\"span\", {\n    parentName: \"span\",\n    \"className\": \"katex-mathml\"\n  }, mdx(\"math\", {\n    parentName: \"span\",\n    \"xmlns\": \"http://www.w3.org/1998/Math/MathML\"\n  }, mdx(\"semantics\", {\n    parentName: \"math\"\n  }, mdx(\"mrow\", {\n    parentName: \"semantics\"\n  }, mdx(\"mfrac\", {\n    parentName: \"mrow\"\n  }, mdx(\"mn\", {\n    parentName: \"mfrac\"\n  }, \"1\"), mdx(\"mn\", {\n    parentName: \"mfrac\"\n  }, \"14.6\"))), mdx(\"annotation\", {\n    parentName: \"semantics\",\n    \"encoding\": \"application/x-tex\"\n  }, \"\\\\frac{1}{14.6}\")))), mdx(\"span\", {\n    parentName: \"span\",\n    \"className\": \"katex-html\",\n    \"aria-hidden\": \"true\"\n  }, mdx(\"span\", {\n    parentName: \"span\",\n    \"className\": \"base\"\n  }, mdx(\"span\", {\n    parentName: \"span\",\n    \"className\": \"strut\",\n    \"style\": {\n      \"height\": \"1.1901em\",\n      \"verticalAlign\": \"-0.345em\"\n    }\n  }), mdx(\"span\", {\n    parentName: \"span\",\n    \"className\": \"mord\"\n  }, mdx(\"span\", {\n    parentName: \"span\",\n    \"className\": \"mopen nulldelimiter\"\n  }), mdx(\"span\", {\n    parentName: \"span\",\n    \"className\": \"mfrac\"\n  }, mdx(\"span\", {\n    parentName: \"span\",\n    \"className\": \"vlist-t vlist-t2\"\n  }, mdx(\"span\", {\n    parentName: \"span\",\n    \"className\": \"vlist-r\"\n  }, mdx(\"span\", {\n    parentName: \"span\",\n    \"className\": \"vlist\",\n    \"style\": {\n      \"height\": \"0.8451em\"\n    }\n  }, mdx(\"span\", {\n    parentName: \"span\",\n    \"style\": {\n      \"top\": \"-2.655em\"\n    }\n  }, mdx(\"span\", {\n    parentName: \"span\",\n    \"className\": \"pstrut\",\n    \"style\": {\n      \"height\": \"3em\"\n    }\n  }), mdx(\"span\", {\n    parentName: \"span\",\n    \"className\": \"sizing reset-size6 size3 mtight\"\n  }, mdx(\"span\", {\n    parentName: \"span\",\n    \"className\": \"mord mtight\"\n  }, mdx(\"span\", {\n    parentName: \"span\",\n    \"className\": \"mord mtight\"\n  }, \"14.6\")))), mdx(\"span\", {\n    parentName: \"span\",\n    \"style\": {\n      \"top\": \"-3.23em\"\n    }\n  }, mdx(\"span\", {\n    parentName: \"span\",\n    \"className\": \"pstrut\",\n    \"style\": {\n      \"height\": \"3em\"\n    }\n  }), mdx(\"span\", {\n    parentName: \"span\",\n    \"className\": \"frac-line\",\n    \"style\": {\n      \"borderBottomWidth\": \"0.04em\"\n    }\n  })), mdx(\"span\", {\n    parentName: \"span\",\n    \"style\": {\n      \"top\": \"-3.394em\"\n    }\n  }, mdx(\"span\", {\n    parentName: \"span\",\n    \"className\": \"pstrut\",\n    \"style\": {\n      \"height\": \"3em\"\n    }\n  }), mdx(\"span\", {\n    parentName: \"span\",\n    \"className\": \"sizing reset-size6 size3 mtight\"\n  }, mdx(\"span\", {\n    parentName: \"span\",\n    \"className\": \"mord mtight\"\n  }, mdx(\"span\", {\n    parentName: \"span\",\n    \"className\": \"mord mtight\"\n  }, \"1\"))))), mdx(\"span\", {\n    parentName: \"span\",\n    \"className\": \"vlist-s\"\n  }, \"\\u200B\")), mdx(\"span\", {\n    parentName: \"span\",\n    \"className\": \"vlist-r\"\n  }, mdx(\"span\", {\n    parentName: \"span\",\n    \"className\": \"vlist\",\n    \"style\": {\n      \"height\": \"0.345em\"\n    }\n  }, mdx(\"span\", {\n    parentName: \"span\"\n  }))))), mdx(\"span\", {\n    parentName: \"span\",\n    \"className\": \"mclose nulldelimiter\"\n  })))))), \". Finally, all we have to do is to find the probability of waiting time being more than 1 minute according to this probability density function:  \"), mdx(\"div\", {\n    \"className\": \"math math-display\"\n  }, mdx(\"span\", {\n    parentName: \"div\",\n    \"className\": \"katex-display\"\n  }, mdx(\"span\", {\n    parentName: \"span\",\n    \"className\": \"katex\"\n  }, mdx(\"span\", {\n    parentName: \"span\",\n    \"className\": \"katex-mathml\"\n  }, mdx(\"math\", {\n    parentName: \"span\",\n    \"xmlns\": \"http://www.w3.org/1998/Math/MathML\",\n    \"display\": \"block\"\n  }, mdx(\"semantics\", {\n    parentName: \"math\"\n  }, mdx(\"mrow\", {\n    parentName: \"semantics\"\n  }, mdx(\"mi\", {\n    parentName: \"mrow\"\n  }, \"f\"), mdx(\"mo\", {\n    parentName: \"mrow\",\n    \"stretchy\": \"false\"\n  }, \"(\"), mdx(\"mi\", {\n    parentName: \"mrow\"\n  }, \"x\"), mdx(\"mo\", {\n    parentName: \"mrow\",\n    \"stretchy\": \"false\"\n  }, \")\"), mdx(\"mo\", {\n    parentName: \"mrow\"\n  }, \"=\"), mdx(\"mfrac\", {\n    parentName: \"mrow\"\n  }, mdx(\"mn\", {\n    parentName: \"mfrac\"\n  }, \"1\"), mdx(\"mn\", {\n    parentName: \"mfrac\"\n  }, \"14.6\")), mdx(\"msup\", {\n    parentName: \"mrow\"\n  }, mdx(\"mi\", {\n    parentName: \"msup\"\n  }, \"e\"), mdx(\"mrow\", {\n    parentName: \"msup\"\n  }, mdx(\"mfrac\", {\n    parentName: \"mrow\"\n  }, mdx(\"mn\", {\n    parentName: \"mfrac\"\n  }, \"1\"), mdx(\"mn\", {\n    parentName: \"mfrac\"\n  }, \"14.6\")), mdx(\"mi\", {\n    parentName: \"mrow\"\n  }, \"x\")))), mdx(\"annotation\", {\n    parentName: \"semantics\",\n    \"encoding\": \"application/x-tex\"\n  }, \"f(x) = \\\\frac{1}{14.6} e^{\\\\frac{1}{14.6} x}\")))), mdx(\"span\", {\n    parentName: \"span\",\n    \"className\": \"katex-html\",\n    \"aria-hidden\": \"true\"\n  }, mdx(\"span\", {\n    parentName: \"span\",\n    \"className\": \"base\"\n  }, mdx(\"span\", {\n    parentName: \"span\",\n    \"className\": \"strut\",\n    \"style\": {\n      \"height\": \"1em\",\n      \"verticalAlign\": \"-0.25em\"\n    }\n  }), mdx(\"span\", {\n    parentName: \"span\",\n    \"className\": \"mord mathnormal\",\n    \"style\": {\n      \"marginRight\": \"0.10764em\"\n    }\n  }, \"f\"), mdx(\"span\", {\n    parentName: \"span\",\n    \"className\": \"mopen\"\n  }, \"(\"), mdx(\"span\", {\n    parentName: \"span\",\n    \"className\": \"mord mathnormal\"\n  }, \"x\"), mdx(\"span\", {\n    parentName: \"span\",\n    \"className\": \"mclose\"\n  }, \")\"), mdx(\"span\", {\n    parentName: \"span\",\n    \"className\": \"mspace\",\n    \"style\": {\n      \"marginRight\": \"0.2778em\"\n    }\n  }), mdx(\"span\", {\n    parentName: \"span\",\n    \"className\": \"mrel\"\n  }, \"=\"), mdx(\"span\", {\n    parentName: \"span\",\n    \"className\": \"mspace\",\n    \"style\": {\n      \"marginRight\": \"0.2778em\"\n    }\n  })), mdx(\"span\", {\n    parentName: \"span\",\n    \"className\": \"base\"\n  }, mdx(\"span\", {\n    parentName: \"span\",\n    \"className\": \"strut\",\n    \"style\": {\n      \"height\": \"2.0074em\",\n      \"verticalAlign\": \"-0.686em\"\n    }\n  }), mdx(\"span\", {\n    parentName: \"span\",\n    \"className\": \"mord\"\n  }, mdx(\"span\", {\n    parentName: \"span\",\n    \"className\": \"mopen nulldelimiter\"\n  }), mdx(\"span\", {\n    parentName: \"span\",\n    \"className\": \"mfrac\"\n  }, mdx(\"span\", {\n    parentName: \"span\",\n    \"className\": \"vlist-t vlist-t2\"\n  }, mdx(\"span\", {\n    parentName: \"span\",\n    \"className\": \"vlist-r\"\n  }, mdx(\"span\", {\n    parentName: \"span\",\n    \"className\": \"vlist\",\n    \"style\": {\n      \"height\": \"1.3214em\"\n    }\n  }, mdx(\"span\", {\n    parentName: \"span\",\n    \"style\": {\n      \"top\": \"-2.314em\"\n    }\n  }, mdx(\"span\", {\n    parentName: \"span\",\n    \"className\": \"pstrut\",\n    \"style\": {\n      \"height\": \"3em\"\n    }\n  }), mdx(\"span\", {\n    parentName: \"span\",\n    \"className\": \"mord\"\n  }, mdx(\"span\", {\n    parentName: \"span\",\n    \"className\": \"mord\"\n  }, \"14.6\"))), mdx(\"span\", {\n    parentName: \"span\",\n    \"style\": {\n      \"top\": \"-3.23em\"\n    }\n  }, mdx(\"span\", {\n    parentName: \"span\",\n    \"className\": \"pstrut\",\n    \"style\": {\n      \"height\": \"3em\"\n    }\n  }), mdx(\"span\", {\n    parentName: \"span\",\n    \"className\": \"frac-line\",\n    \"style\": {\n      \"borderBottomWidth\": \"0.04em\"\n    }\n  })), mdx(\"span\", {\n    parentName: \"span\",\n    \"style\": {\n      \"top\": \"-3.677em\"\n    }\n  }, mdx(\"span\", {\n    parentName: \"span\",\n    \"className\": \"pstrut\",\n    \"style\": {\n      \"height\": \"3em\"\n    }\n  }), mdx(\"span\", {\n    parentName: \"span\",\n    \"className\": \"mord\"\n  }, mdx(\"span\", {\n    parentName: \"span\",\n    \"className\": \"mord\"\n  }, \"1\")))), mdx(\"span\", {\n    parentName: \"span\",\n    \"className\": \"vlist-s\"\n  }, \"\\u200B\")), mdx(\"span\", {\n    parentName: \"span\",\n    \"className\": \"vlist-r\"\n  }, mdx(\"span\", {\n    parentName: \"span\",\n    \"className\": \"vlist\",\n    \"style\": {\n      \"height\": \"0.686em\"\n    }\n  }, mdx(\"span\", {\n    parentName: \"span\"\n  }))))), mdx(\"span\", {\n    parentName: \"span\",\n    \"className\": \"mclose nulldelimiter\"\n  })), mdx(\"span\", {\n    parentName: \"span\",\n    \"className\": \"mord\"\n  }, mdx(\"span\", {\n    parentName: \"span\",\n    \"className\": \"mord mathnormal\"\n  }, \"e\"), mdx(\"span\", {\n    parentName: \"span\",\n    \"className\": \"msupsub\"\n  }, mdx(\"span\", {\n    parentName: \"span\",\n    \"className\": \"vlist-t\"\n  }, mdx(\"span\", {\n    parentName: \"span\",\n    \"className\": \"vlist-r\"\n  }, mdx(\"span\", {\n    parentName: \"span\",\n    \"className\": \"vlist\",\n    \"style\": {\n      \"height\": \"1.004em\"\n    }\n  }, mdx(\"span\", {\n    parentName: \"span\",\n    \"style\": {\n      \"top\": \"-3.413em\",\n      \"marginRight\": \"0.05em\"\n    }\n  }, mdx(\"span\", {\n    parentName: \"span\",\n    \"className\": \"pstrut\",\n    \"style\": {\n      \"height\": \"3em\"\n    }\n  }), mdx(\"span\", {\n    parentName: \"span\",\n    \"className\": \"sizing reset-size6 size3 mtight\"\n  }, mdx(\"span\", {\n    parentName: \"span\",\n    \"className\": \"mord mtight\"\n  }, mdx(\"span\", {\n    parentName: \"span\",\n    \"className\": \"mord mtight\"\n  }, mdx(\"span\", {\n    parentName: \"span\",\n    \"className\": \"mopen nulldelimiter sizing reset-size3 size6\"\n  }), mdx(\"span\", {\n    parentName: \"span\",\n    \"className\": \"mfrac\"\n  }, mdx(\"span\", {\n    parentName: \"span\",\n    \"className\": \"vlist-t vlist-t2\"\n  }, mdx(\"span\", {\n    parentName: \"span\",\n    \"className\": \"vlist-r\"\n  }, mdx(\"span\", {\n    parentName: \"span\",\n    \"className\": \"vlist\",\n    \"style\": {\n      \"height\": \"0.8443em\"\n    }\n  }, mdx(\"span\", {\n    parentName: \"span\",\n    \"style\": {\n      \"top\": \"-2.656em\"\n    }\n  }, mdx(\"span\", {\n    parentName: \"span\",\n    \"className\": \"pstrut\",\n    \"style\": {\n      \"height\": \"3em\"\n    }\n  }), mdx(\"span\", {\n    parentName: \"span\",\n    \"className\": \"sizing reset-size3 size1 mtight\"\n  }, mdx(\"span\", {\n    parentName: \"span\",\n    \"className\": \"mord mtight\"\n  }, mdx(\"span\", {\n    parentName: \"span\",\n    \"className\": \"mord mtight\"\n  }, \"14.6\")))), mdx(\"span\", {\n    parentName: \"span\",\n    \"style\": {\n      \"top\": \"-3.2255em\"\n    }\n  }, mdx(\"span\", {\n    parentName: \"span\",\n    \"className\": \"pstrut\",\n    \"style\": {\n      \"height\": \"3em\"\n    }\n  }), mdx(\"span\", {\n    parentName: \"span\",\n    \"className\": \"frac-line mtight\",\n    \"style\": {\n      \"borderBottomWidth\": \"0.049em\"\n    }\n  })), mdx(\"span\", {\n    parentName: \"span\",\n    \"style\": {\n      \"top\": \"-3.384em\"\n    }\n  }, mdx(\"span\", {\n    parentName: \"span\",\n    \"className\": \"pstrut\",\n    \"style\": {\n      \"height\": \"3em\"\n    }\n  }), mdx(\"span\", {\n    parentName: \"span\",\n    \"className\": \"sizing reset-size3 size1 mtight\"\n  }, mdx(\"span\", {\n    parentName: \"span\",\n    \"className\": \"mord mtight\"\n  }, mdx(\"span\", {\n    parentName: \"span\",\n    \"className\": \"mord mtight\"\n  }, \"1\"))))), mdx(\"span\", {\n    parentName: \"span\",\n    \"className\": \"vlist-s\"\n  }, \"\\u200B\")), mdx(\"span\", {\n    parentName: \"span\",\n    \"className\": \"vlist-r\"\n  }, mdx(\"span\", {\n    parentName: \"span\",\n    \"className\": \"vlist\",\n    \"style\": {\n      \"height\": \"0.344em\"\n    }\n  }, mdx(\"span\", {\n    parentName: \"span\"\n  }))))), mdx(\"span\", {\n    parentName: \"span\",\n    \"className\": \"mclose nulldelimiter sizing reset-size3 size6\"\n  })), mdx(\"span\", {\n    parentName: \"span\",\n    \"className\": \"mord mathnormal mtight\"\n  }, \"x\")))))))))))))), mdx(\"p\", null, \"Another example would be, suppose that a specific type of car can last 20 years on average and the lifetime of these cars is exponential distributed. We can find out the probability that a car of this type last less than 10 years.  \"), mdx(\"p\", null, \"Note that the exponential distribution is 'memoryless' meaning as long as next event is not observed, then the distribution of time difference from \", mdx(\"span\", {\n    parentName: \"p\",\n    \"className\": \"math math-inline\"\n  }, mdx(\"span\", {\n    parentName: \"span\",\n    \"className\": \"katex\"\n  }, mdx(\"span\", {\n    parentName: \"span\",\n    \"className\": \"katex-mathml\"\n  }, mdx(\"math\", {\n    parentName: \"span\",\n    \"xmlns\": \"http://www.w3.org/1998/Math/MathML\"\n  }, mdx(\"semantics\", {\n    parentName: \"math\"\n  }, mdx(\"mrow\", {\n    parentName: \"semantics\"\n  }, mdx(\"mi\", {\n    parentName: \"mrow\"\n  }, \"t\")), mdx(\"annotation\", {\n    parentName: \"semantics\",\n    \"encoding\": \"application/x-tex\"\n  }, \"t\")))), mdx(\"span\", {\n    parentName: \"span\",\n    \"className\": \"katex-html\",\n    \"aria-hidden\": \"true\"\n  }, mdx(\"span\", {\n    parentName: \"span\",\n    \"className\": \"base\"\n  }, mdx(\"span\", {\n    parentName: \"span\",\n    \"className\": \"strut\",\n    \"style\": {\n      \"height\": \"0.6151em\"\n    }\n  }), mdx(\"span\", {\n    parentName: \"span\",\n    \"className\": \"mord mathnormal\"\n  }, \"t\"))))), \" to \", mdx(\"span\", {\n    parentName: \"p\",\n    \"className\": \"math math-inline\"\n  }, mdx(\"span\", {\n    parentName: \"span\",\n    \"className\": \"katex\"\n  }, mdx(\"span\", {\n    parentName: \"span\",\n    \"className\": \"katex-mathml\"\n  }, mdx(\"math\", {\n    parentName: \"span\",\n    \"xmlns\": \"http://www.w3.org/1998/Math/MathML\"\n  }, mdx(\"semantics\", {\n    parentName: \"math\"\n  }, mdx(\"mrow\", {\n    parentName: \"semantics\"\n  }, mdx(\"mi\", {\n    parentName: \"mrow\"\n  }, \"x\")), mdx(\"annotation\", {\n    parentName: \"semantics\",\n    \"encoding\": \"application/x-tex\"\n  }, \"x\")))), mdx(\"span\", {\n    parentName: \"span\",\n    \"className\": \"katex-html\",\n    \"aria-hidden\": \"true\"\n  }, mdx(\"span\", {\n    parentName: \"span\",\n    \"className\": \"base\"\n  }, mdx(\"span\", {\n    parentName: \"span\",\n    \"className\": \"strut\",\n    \"style\": {\n      \"height\": \"0.4306em\"\n    }\n  }), mdx(\"span\", {\n    parentName: \"span\",\n    \"className\": \"mord mathnormal\"\n  }, \"x\"))))), \" (the time we observed the next event) is the same the time difference from any point in the range \", mdx(\"span\", {\n    parentName: \"p\",\n    \"className\": \"math math-inline\"\n  }, mdx(\"span\", {\n    parentName: \"span\",\n    \"className\": \"katex\"\n  }, mdx(\"span\", {\n    parentName: \"span\",\n    \"className\": \"katex-mathml\"\n  }, mdx(\"math\", {\n    parentName: \"span\",\n    \"xmlns\": \"http://www.w3.org/1998/Math/MathML\"\n  }, mdx(\"semantics\", {\n    parentName: \"math\"\n  }, mdx(\"mrow\", {\n    parentName: \"semantics\"\n  }, mdx(\"mo\", {\n    parentName: \"mrow\",\n    \"stretchy\": \"false\"\n  }, \"[\"), mdx(\"mi\", {\n    parentName: \"mrow\"\n  }, \"t\"), mdx(\"mo\", {\n    parentName: \"mrow\"\n  }, \"+\"), mdx(\"mn\", {\n    parentName: \"mrow\"\n  }, \"1\"), mdx(\"mo\", {\n    parentName: \"mrow\",\n    \"separator\": \"true\"\n  }, \",\"), mdx(\"mi\", {\n    parentName: \"mrow\"\n  }, \"x\"), mdx(\"mo\", {\n    parentName: \"mrow\"\n  }, \"\\u2212\"), mdx(\"mn\", {\n    parentName: \"mrow\"\n  }, \"1\"), mdx(\"mo\", {\n    parentName: \"mrow\",\n    \"stretchy\": \"false\"\n  }, \"]\")), mdx(\"annotation\", {\n    parentName: \"semantics\",\n    \"encoding\": \"application/x-tex\"\n  }, \"[t+1, x-1]\")))), mdx(\"span\", {\n    parentName: \"span\",\n    \"className\": \"katex-html\",\n    \"aria-hidden\": \"true\"\n  }, mdx(\"span\", {\n    parentName: \"span\",\n    \"className\": \"base\"\n  }, mdx(\"span\", {\n    parentName: \"span\",\n    \"className\": \"strut\",\n    \"style\": {\n      \"height\": \"1em\",\n      \"verticalAlign\": \"-0.25em\"\n    }\n  }), mdx(\"span\", {\n    parentName: \"span\",\n    \"className\": \"mopen\"\n  }, \"[\"), mdx(\"span\", {\n    parentName: \"span\",\n    \"className\": \"mord mathnormal\"\n  }, \"t\"), mdx(\"span\", {\n    parentName: \"span\",\n    \"className\": \"mspace\",\n    \"style\": {\n      \"marginRight\": \"0.2222em\"\n    }\n  }), mdx(\"span\", {\n    parentName: \"span\",\n    \"className\": \"mbin\"\n  }, \"+\"), mdx(\"span\", {\n    parentName: \"span\",\n    \"className\": \"mspace\",\n    \"style\": {\n      \"marginRight\": \"0.2222em\"\n    }\n  })), mdx(\"span\", {\n    parentName: \"span\",\n    \"className\": \"base\"\n  }, mdx(\"span\", {\n    parentName: \"span\",\n    \"className\": \"strut\",\n    \"style\": {\n      \"height\": \"0.8389em\",\n      \"verticalAlign\": \"-0.1944em\"\n    }\n  }), mdx(\"span\", {\n    parentName: \"span\",\n    \"className\": \"mord\"\n  }, \"1\"), mdx(\"span\", {\n    parentName: \"span\",\n    \"className\": \"mpunct\"\n  }, \",\"), mdx(\"span\", {\n    parentName: \"span\",\n    \"className\": \"mspace\",\n    \"style\": {\n      \"marginRight\": \"0.1667em\"\n    }\n  }), mdx(\"span\", {\n    parentName: \"span\",\n    \"className\": \"mord mathnormal\"\n  }, \"x\"), mdx(\"span\", {\n    parentName: \"span\",\n    \"className\": \"mspace\",\n    \"style\": {\n      \"marginRight\": \"0.2222em\"\n    }\n  }), mdx(\"span\", {\n    parentName: \"span\",\n    \"className\": \"mbin\"\n  }, \"\\u2212\"), mdx(\"span\", {\n    parentName: \"span\",\n    \"className\": \"mspace\",\n    \"style\": {\n      \"marginRight\": \"0.2222em\"\n    }\n  })), mdx(\"span\", {\n    parentName: \"span\",\n    \"className\": \"base\"\n  }, mdx(\"span\", {\n    parentName: \"span\",\n    \"className\": \"strut\",\n    \"style\": {\n      \"height\": \"1em\",\n      \"verticalAlign\": \"-0.25em\"\n    }\n  }), mdx(\"span\", {\n    parentName: \"span\",\n    \"className\": \"mord\"\n  }, \"1\"), mdx(\"span\", {\n    parentName: \"span\",\n    \"className\": \"mclose\"\n  }, \"]\"))))), \", to \", mdx(\"span\", {\n    parentName: \"p\",\n    \"className\": \"math math-inline\"\n  }, mdx(\"span\", {\n    parentName: \"span\",\n    \"className\": \"katex\"\n  }, mdx(\"span\", {\n    parentName: \"span\",\n    \"className\": \"katex-mathml\"\n  }, mdx(\"math\", {\n    parentName: \"span\",\n    \"xmlns\": \"http://www.w3.org/1998/Math/MathML\"\n  }, mdx(\"semantics\", {\n    parentName: \"math\"\n  }, mdx(\"mrow\", {\n    parentName: \"semantics\"\n  }, mdx(\"mi\", {\n    parentName: \"mrow\"\n  }, \"x\")), mdx(\"annotation\", {\n    parentName: \"semantics\",\n    \"encoding\": \"application/x-tex\"\n  }, \"x\")))), mdx(\"span\", {\n    parentName: \"span\",\n    \"className\": \"katex-html\",\n    \"aria-hidden\": \"true\"\n  }, mdx(\"span\", {\n    parentName: \"span\",\n    \"className\": \"base\"\n  }, mdx(\"span\", {\n    parentName: \"span\",\n    \"className\": \"strut\",\n    \"style\": {\n      \"height\": \"0.4306em\"\n    }\n  }), mdx(\"span\", {\n    parentName: \"span\",\n    \"className\": \"mord mathnormal\"\n  }, \"x\"))))), \". Thus, time has no effect on further observations.  \"), mdx(\"p\", null, mdx(\"img\", {\n    parentName: \"p\",\n    \"src\": \"/b0b23205e55961bf1fdf1835158f0979/exp.png\",\n    \"alt\": \"Exponential distribution\"\n  }), \"  \"), mdx(\"div\", {\n    className: \"bg-shefYellow shadow-md p-3 md:p-5 rounded-3xl text-base text-black\"\n  }, mdx(\"h2\", {\n    className: \"mt-0 flex items-center\"\n  }, mdx(HiOutlineLightBulb, {\n    className: \"inline-block text-4xl mr-2\",\n    mdxType: \"HiOutlineLightBulb\"\n  }), \" When to use?\"), mdx(\"ul\", {\n    className: \"my-0\"\n  }, mdx(\"li\", null, \"Model the elapsed time between consecutive events\"), mdx(\"li\", null, \"Model the waiting time before an event occur\"))), mdx(\"h3\", {\n    \"id\": \"cauchy\",\n    \"style\": {\n      \"position\": \"relative\"\n    }\n  }, mdx(\"a\", {\n    parentName: \"h3\",\n    \"href\": \"#cauchy\",\n    \"aria-label\": \"cauchy permalink\",\n    \"className\": \"anchor before\"\n  }, mdx(\"undefined\", {\n    parentName: \"a\"\n  })), \"Cauchy\"), mdx(\"p\", null, \"The cauchy distribution, also known as the impossible distribution does not have mean or variance, but median and mode still exist. It has a similar bell shape to the Gaussian distribution but with much heavier tails, therefore, the cauchy distribution could be useful to test whether data approximate Gaussian distribution. It is also a special case of \", mdx(\"a\", {\n    parentName: \"p\",\n    \"href\": \"https://en.wikipedia.org/wiki/Student%27s_t-distribution\"\n  }, \"student's t distribution\"), \" which wouldn't be discussed in this chapter. The distribution has two parameters \", mdx(\"span\", {\n    parentName: \"p\",\n    \"className\": \"math math-inline\"\n  }, mdx(\"span\", {\n    parentName: \"span\",\n    \"className\": \"katex\"\n  }, mdx(\"span\", {\n    parentName: \"span\",\n    \"className\": \"katex-mathml\"\n  }, mdx(\"math\", {\n    parentName: \"span\",\n    \"xmlns\": \"http://www.w3.org/1998/Math/MathML\"\n  }, mdx(\"semantics\", {\n    parentName: \"math\"\n  }, mdx(\"mrow\", {\n    parentName: \"semantics\"\n  }, mdx(\"mi\", {\n    parentName: \"mrow\"\n  }, \"m\")), mdx(\"annotation\", {\n    parentName: \"semantics\",\n    \"encoding\": \"application/x-tex\"\n  }, \"m\")))), mdx(\"span\", {\n    parentName: \"span\",\n    \"className\": \"katex-html\",\n    \"aria-hidden\": \"true\"\n  }, mdx(\"span\", {\n    parentName: \"span\",\n    \"className\": \"base\"\n  }, mdx(\"span\", {\n    parentName: \"span\",\n    \"className\": \"strut\",\n    \"style\": {\n      \"height\": \"0.4306em\"\n    }\n  }), mdx(\"span\", {\n    parentName: \"span\",\n    \"className\": \"mord mathnormal\"\n  }, \"m\"))))), \" and \", mdx(\"span\", {\n    parentName: \"p\",\n    \"className\": \"math math-inline\"\n  }, mdx(\"span\", {\n    parentName: \"span\",\n    \"className\": \"katex\"\n  }, mdx(\"span\", {\n    parentName: \"span\",\n    \"className\": \"katex-mathml\"\n  }, mdx(\"math\", {\n    parentName: \"span\",\n    \"xmlns\": \"http://www.w3.org/1998/Math/MathML\"\n  }, mdx(\"semantics\", {\n    parentName: \"math\"\n  }, mdx(\"mrow\", {\n    parentName: \"semantics\"\n  }, mdx(\"mi\", {\n    parentName: \"mrow\"\n  }, \"\\u03B3\")), mdx(\"annotation\", {\n    parentName: \"semantics\",\n    \"encoding\": \"application/x-tex\"\n  }, \"\\\\gamma\")))), mdx(\"span\", {\n    parentName: \"span\",\n    \"className\": \"katex-html\",\n    \"aria-hidden\": \"true\"\n  }, mdx(\"span\", {\n    parentName: \"span\",\n    \"className\": \"base\"\n  }, mdx(\"span\", {\n    parentName: \"span\",\n    \"className\": \"strut\",\n    \"style\": {\n      \"height\": \"0.625em\",\n      \"verticalAlign\": \"-0.1944em\"\n    }\n  }), mdx(\"span\", {\n    parentName: \"span\",\n    \"className\": \"mord mathnormal\",\n    \"style\": {\n      \"marginRight\": \"0.05556em\"\n    }\n  }, \"\\u03B3\"))))), \" where each controls the mode and \", mdx(\"a\", {\n    parentName: \"p\",\n    \"href\": \"https://en.wikipedia.org/wiki/Full_width_at_half_maximum\"\n  }, \"full width at half maximum\"), \" of the distribution. \"), mdx(\"p\", null, mdx(\"img\", {\n    parentName: \"p\",\n    \"src\": \"/f920b97bfc605e32def27ff18d5c2415/cauchy.png\",\n    \"alt\": \"Cauchy distribution\"\n  }), \"  \"), mdx(\"div\", {\n    className: \"bg-shefYellow shadow-md p-3 md:p-5 rounded-3xl text-base text-black\"\n  }, mdx(\"h2\", {\n    className: \"mt-0 flex items-center\"\n  }, mdx(HiOutlineLightBulb, {\n    className: \"inline-block text-4xl mr-2\",\n    mdxType: \"HiOutlineLightBulb\"\n  }), \" When to use?\"), mdx(\"ul\", {\n    className: \"my-0\"\n  }, mdx(\"li\", null, \"Model the ratio of two independent normal distributions\"), mdx(\"li\", null, \"Any field dealing with infinite exponential growth (\", mdx(\"a\", {\n    href: \"https://deepai.org/machine-learning-glossary-and-terms/cauchy-distribution\"\n  }, \"source\"), \")\"), mdx(\"li\", null, \"As a prior distribution in Bayesian inference (\", mdx(\"a\", {\n    href: \"https://arxiv.org/pdf/1507.07170.pdf\"\n  }, \"source\"), \")\"))), mdx(\"h3\", {\n    \"id\": \"gamma\",\n    \"style\": {\n      \"position\": \"relative\"\n    }\n  }, mdx(\"a\", {\n    parentName: \"h3\",\n    \"href\": \"#gamma\",\n    \"aria-label\": \"gamma permalink\",\n    \"className\": \"anchor before\"\n  }, mdx(\"undefined\", {\n    parentName: \"a\"\n  })), \"Gamma\"), mdx(\"p\", null, \"The gamma distribution is related to many distributions including the Poisson, chi-square, exponential, and normal distributions. In the gamma function, the \", mdx(\"span\", {\n    parentName: \"p\",\n    \"className\": \"math math-inline\"\n  }, mdx(\"span\", {\n    parentName: \"span\",\n    \"className\": \"katex\"\n  }, mdx(\"span\", {\n    parentName: \"span\",\n    \"className\": \"katex-mathml\"\n  }, mdx(\"math\", {\n    parentName: \"span\",\n    \"xmlns\": \"http://www.w3.org/1998/Math/MathML\"\n  }, mdx(\"semantics\", {\n    parentName: \"math\"\n  }, mdx(\"mrow\", {\n    parentName: \"semantics\"\n  }, mdx(\"mi\", {\n    parentName: \"mrow\"\n  }, \"\\u03B1\")), mdx(\"annotation\", {\n    parentName: \"semantics\",\n    \"encoding\": \"application/x-tex\"\n  }, \"\\\\alpha\")))), mdx(\"span\", {\n    parentName: \"span\",\n    \"className\": \"katex-html\",\n    \"aria-hidden\": \"true\"\n  }, mdx(\"span\", {\n    parentName: \"span\",\n    \"className\": \"base\"\n  }, mdx(\"span\", {\n    parentName: \"span\",\n    \"className\": \"strut\",\n    \"style\": {\n      \"height\": \"0.4306em\"\n    }\n  }), mdx(\"span\", {\n    parentName: \"span\",\n    \"className\": \"mord mathnormal\",\n    \"style\": {\n      \"marginRight\": \"0.0037em\"\n    }\n  }, \"\\u03B1\"))))), \" is called the shape parameter and \", mdx(\"span\", {\n    parentName: \"p\",\n    \"className\": \"math math-inline\"\n  }, mdx(\"span\", {\n    parentName: \"span\",\n    \"className\": \"katex\"\n  }, mdx(\"span\", {\n    parentName: \"span\",\n    \"className\": \"katex-mathml\"\n  }, mdx(\"math\", {\n    parentName: \"span\",\n    \"xmlns\": \"http://www.w3.org/1998/Math/MathML\"\n  }, mdx(\"semantics\", {\n    parentName: \"math\"\n  }, mdx(\"mrow\", {\n    parentName: \"semantics\"\n  }, mdx(\"mi\", {\n    parentName: \"mrow\"\n  }, \"\\u03B2\")), mdx(\"annotation\", {\n    parentName: \"semantics\",\n    \"encoding\": \"application/x-tex\"\n  }, \"\\\\beta\")))), mdx(\"span\", {\n    parentName: \"span\",\n    \"className\": \"katex-html\",\n    \"aria-hidden\": \"true\"\n  }, mdx(\"span\", {\n    parentName: \"span\",\n    \"className\": \"base\"\n  }, mdx(\"span\", {\n    parentName: \"span\",\n    \"className\": \"strut\",\n    \"style\": {\n      \"height\": \"0.8889em\",\n      \"verticalAlign\": \"-0.1944em\"\n    }\n  }), mdx(\"span\", {\n    parentName: \"span\",\n    \"className\": \"mord mathnormal\",\n    \"style\": {\n      \"marginRight\": \"0.05278em\"\n    }\n  }, \"\\u03B2\"))))), \" is called the rate parameter (we have also seen the \", mdx(\"span\", {\n    parentName: \"p\",\n    \"className\": \"math math-inline\"\n  }, mdx(\"span\", {\n    parentName: \"span\",\n    \"className\": \"katex\"\n  }, mdx(\"span\", {\n    parentName: \"span\",\n    \"className\": \"katex-mathml\"\n  }, mdx(\"math\", {\n    parentName: \"span\",\n    \"xmlns\": \"http://www.w3.org/1998/Math/MathML\"\n  }, mdx(\"semantics\", {\n    parentName: \"math\"\n  }, mdx(\"mrow\", {\n    parentName: \"semantics\"\n  }, mdx(\"mi\", {\n    parentName: \"mrow\"\n  }, \"\\u03BB\")), mdx(\"annotation\", {\n    parentName: \"semantics\",\n    \"encoding\": \"application/x-tex\"\n  }, \"\\\\lambda\")))), mdx(\"span\", {\n    parentName: \"span\",\n    \"className\": \"katex-html\",\n    \"aria-hidden\": \"true\"\n  }, mdx(\"span\", {\n    parentName: \"span\",\n    \"className\": \"base\"\n  }, mdx(\"span\", {\n    parentName: \"span\",\n    \"className\": \"strut\",\n    \"style\": {\n      \"height\": \"0.6944em\"\n    }\n  }), mdx(\"span\", {\n    parentName: \"span\",\n    \"className\": \"mord mathnormal\"\n  }, \"\\u03BB\"))))), \"). Recall the example in the exponential distribution that model the waiting time for the visit of next student for the university website (assuming visits are poisson processes which means they are random), a useful application of gamma distribution in this situation is it can model the waiting time for the \", mdx(\"span\", {\n    parentName: \"p\",\n    \"className\": \"math math-inline\"\n  }, mdx(\"span\", {\n    parentName: \"span\",\n    \"className\": \"katex\"\n  }, mdx(\"span\", {\n    parentName: \"span\",\n    \"className\": \"katex-mathml\"\n  }, mdx(\"math\", {\n    parentName: \"span\",\n    \"xmlns\": \"http://www.w3.org/1998/Math/MathML\"\n  }, mdx(\"semantics\", {\n    parentName: \"math\"\n  }, mdx(\"mrow\", {\n    parentName: \"semantics\"\n  }, mdx(\"mi\", {\n    parentName: \"mrow\"\n  }, \"n\")), mdx(\"annotation\", {\n    parentName: \"semantics\",\n    \"encoding\": \"application/x-tex\"\n  }, \"n\")))), mdx(\"span\", {\n    parentName: \"span\",\n    \"className\": \"katex-html\",\n    \"aria-hidden\": \"true\"\n  }, mdx(\"span\", {\n    parentName: \"span\",\n    \"className\": \"base\"\n  }, mdx(\"span\", {\n    parentName: \"span\",\n    \"className\": \"strut\",\n    \"style\": {\n      \"height\": \"0.4306em\"\n    }\n  }), mdx(\"span\", {\n    parentName: \"span\",\n    \"className\": \"mord mathnormal\"\n  }, \"n\"))))), \"th student's visit. \"), mdx(\"p\", null, mdx(\"img\", {\n    parentName: \"p\",\n    \"src\": \"/77a18a82a17e96a3f5010586a3077713/gamma.png\",\n    \"alt\": \"Gamma distribution\"\n  }), \"  \"), mdx(\"p\", null, \"From the graph shown above, we can see that if we increase either \", mdx(\"span\", {\n    parentName: \"p\",\n    \"className\": \"math math-inline\"\n  }, mdx(\"span\", {\n    parentName: \"span\",\n    \"className\": \"katex\"\n  }, mdx(\"span\", {\n    parentName: \"span\",\n    \"className\": \"katex-mathml\"\n  }, mdx(\"math\", {\n    parentName: \"span\",\n    \"xmlns\": \"http://www.w3.org/1998/Math/MathML\"\n  }, mdx(\"semantics\", {\n    parentName: \"math\"\n  }, mdx(\"mrow\", {\n    parentName: \"semantics\"\n  }, mdx(\"mi\", {\n    parentName: \"mrow\"\n  }, \"\\u03B1\")), mdx(\"annotation\", {\n    parentName: \"semantics\",\n    \"encoding\": \"application/x-tex\"\n  }, \"\\\\alpha\")))), mdx(\"span\", {\n    parentName: \"span\",\n    \"className\": \"katex-html\",\n    \"aria-hidden\": \"true\"\n  }, mdx(\"span\", {\n    parentName: \"span\",\n    \"className\": \"base\"\n  }, mdx(\"span\", {\n    parentName: \"span\",\n    \"className\": \"strut\",\n    \"style\": {\n      \"height\": \"0.4306em\"\n    }\n  }), mdx(\"span\", {\n    parentName: \"span\",\n    \"className\": \"mord mathnormal\",\n    \"style\": {\n      \"marginRight\": \"0.0037em\"\n    }\n  }, \"\\u03B1\"))))), \" (the number of events) or \", mdx(\"span\", {\n    parentName: \"p\",\n    \"className\": \"math math-inline\"\n  }, mdx(\"span\", {\n    parentName: \"span\",\n    \"className\": \"katex\"\n  }, mdx(\"span\", {\n    parentName: \"span\",\n    \"className\": \"katex-mathml\"\n  }, mdx(\"math\", {\n    parentName: \"span\",\n    \"xmlns\": \"http://www.w3.org/1998/Math/MathML\"\n  }, mdx(\"semantics\", {\n    parentName: \"math\"\n  }, mdx(\"mrow\", {\n    parentName: \"semantics\"\n  }, mdx(\"mi\", {\n    parentName: \"mrow\"\n  }, \"\\u03BB\")), mdx(\"annotation\", {\n    parentName: \"semantics\",\n    \"encoding\": \"application/x-tex\"\n  }, \"\\\\lambda\")))), mdx(\"span\", {\n    parentName: \"span\",\n    \"className\": \"katex-html\",\n    \"aria-hidden\": \"true\"\n  }, mdx(\"span\", {\n    parentName: \"span\",\n    \"className\": \"base\"\n  }, mdx(\"span\", {\n    parentName: \"span\",\n    \"className\": \"strut\",\n    \"style\": {\n      \"height\": \"0.6944em\"\n    }\n  }), mdx(\"span\", {\n    parentName: \"span\",\n    \"className\": \"mord mathnormal\"\n  }, \"\\u03BB\"))))), \" (the mean) and fixed the other parameter, then the density will shifted towards right hand side, meaning longer wait times.  \"), mdx(\"div\", {\n    className: \"bg-shefYellow shadow-md p-3 md:p-5 rounded-3xl text-base text-black\"\n  }, mdx(\"h2\", {\n    className: \"mt-0 flex items-center\"\n  }, mdx(HiOutlineLightBulb, {\n    className: \"inline-block text-4xl mr-2\",\n    mdxType: \"HiOutlineLightBulb\"\n  }), \" When to use?\"), mdx(\"ul\", {\n    className: \"my-0\"\n  }, mdx(\"li\", null, \"Model real\\u2010valued positive measurements\"), mdx(\"li\", null, \"Model the waiting time before the \", mdx(\"i\", null, \"n\"), \"th event occur\"))), mdx(\"h3\", {\n    \"id\": \"beta\",\n    \"style\": {\n      \"position\": \"relative\"\n    }\n  }, mdx(\"a\", {\n    parentName: \"h3\",\n    \"href\": \"#beta\",\n    \"aria-label\": \"beta permalink\",\n    \"className\": \"anchor before\"\n  }, mdx(\"undefined\", {\n    parentName: \"a\"\n  })), \"Beta\"), mdx(\"p\", null, \"The beta distribution represents a distribution of probabilities of a probability in which the probability is unknown or can be used to represent variability over a fixed range. For example, we can use the beta distribution to model how likely a visitor will click a related post at a single visit, whereas the binomial distribution which can also model this problem by computes the percentage of visitors that clicked a related post among all visitors. The former modeling the probability of a random variable (the probability of clicking a related post) and the latter modeling the number of successes out of multiple trials and the probability is fixed from trial to trial.  \"), mdx(\"p\", null, mdx(\"img\", {\n    parentName: \"p\",\n    \"src\": \"/3f4e5ad1782508c58babe79d86769d8a/beta.png\",\n    \"alt\": \"Beta distribution\"\n  })), mdx(\"div\", {\n    className: \"bg-shefYellow shadow-md p-3 md:p-5 rounded-3xl text-base text-black\"\n  }, mdx(\"h2\", {\n    className: \"mt-0 flex items-center\"\n  }, mdx(HiOutlineLightBulb, {\n    className: \"inline-block text-4xl mr-2\",\n    mdxType: \"HiOutlineLightBulb\"\n  }), \" When to use?\"), mdx(\"ul\", {\n    className: \"my-0\"\n  }, mdx(\"li\", null, \"Model probabilities\"), mdx(\"li\", null, \"Model any uncertain variable with a limited range, e.g. [0,1]\"))), mdx(\"br\", null), mdx(\"h2\", {\n    \"id\": \"next-step\",\n    \"style\": {\n      \"position\": \"relative\"\n    }\n  }, mdx(\"a\", {\n    parentName: \"h2\",\n    \"href\": \"#next-step\",\n    \"aria-label\": \"next step permalink\",\n    \"className\": \"anchor before\"\n  }, mdx(\"undefined\", {\n    parentName: \"a\"\n  })), \"Next step\"), mdx(\"p\", null, \"Well done! You have made it! We hope you will find this material useful and informative. As you have seen that for each distribution we have created a graph from 10,000 generated random samples as representatives of the specific distribution with specified parameters. However, at the moment we have no knowledge of how these samples are generated and what is the process behind it. It is also worth noting that the relationship between the change in mean and change in variance for any model is far more important in large datasets than the actual distribution of individual data points. In \", mdx(Link, {\n    to: \"/docs/18/03/2021/LearningPath-Statistical-Modeling-2\",\n    mdxType: \"Link\"\n  }, \"Part 2: Sampling\"), \", we will be getting a general understanding of sampling, different ways of drawing samples, and how we can describe a sample.\"), mdx(\"h2\", {\n    \"id\": \"recommended-reading\",\n    \"style\": {\n      \"position\": \"relative\"\n    }\n  }, mdx(\"a\", {\n    parentName: \"h2\",\n    \"href\": \"#recommended-reading\",\n    \"aria-label\": \"recommended reading permalink\",\n    \"className\": \"anchor before\"\n  }, mdx(\"undefined\", {\n    parentName: \"a\"\n  })), \"Recommended reading\"), mdx(\"p\", null, mdx(\"a\", {\n    parentName: \"p\",\n    \"href\": \"https://seeing-theory.brown.edu/probability-distributions/index.html#section1\"\n  }, \"Seeing Theory - Probability distributions\"), mdx(\"br\", {\n    parentName: \"p\"\n  }), \"\\n\", mdx(\"a\", {\n    parentName: \"p\",\n    \"href\": \"https://onlinelibrary.wiley.com/doi/pdf/10.1002/9781119197096.app03\"\n  }, \"Understanding and Choosing the Right Probability Distributions\"), mdx(\"br\", {\n    parentName: \"p\"\n  }), \"\\n\", mdx(\"a\", {\n    parentName: \"p\",\n    \"href\": \"https://www.linkedin.com/learning/statistics-foundations-1\"\n  }, \"Statistics Foundations 1\"), mdx(\"br\", {\n    parentName: \"p\"\n  }), \"\\n\", mdx(\"a\", {\n    parentName: \"p\",\n    \"href\": \"https://www.linkedin.com/learning/statistics-foundations-2\"\n  }, \"Statistics Foundations 2\"), mdx(\"br\", {\n    parentName: \"p\"\n  }), \"\\n\", mdx(\"a\", {\n    parentName: \"p\",\n    \"href\": \"https://www.linkedin.com/learning/statistics-foundations-3\"\n  }, \"Statistics Foundations 3\"), mdx(\"br\", {\n    parentName: \"p\"\n  }), \"\\n\", mdx(\"a\", {\n    parentName: \"p\",\n    \"href\": \"https://ocw.mit.edu/courses/mathematics/18-440-probability-and-random-variables-spring-2014/\"\n  }, \"Probability and Random Variables - MIT OpenCourseWare\")));\n}\n;\nMDXContent.isMDXComponent = true;","tableOfContents":{"items":[{"url":"#introduction","title":"Introduction"},{"url":"#prerequisites","title":"Prerequisites"},{"url":"#discrete","title":"Discrete","items":[{"url":"#bernoulli","title":"Bernoulli"},{"url":"#binomial","title":"Binomial"},{"url":"#discrete-uniform","title":"Discrete Uniform"},{"url":"#poisson","title":"Poisson"},{"url":"#geometric","title":"Geometric"},{"url":"#negative-binomial","title":"Negative Binomial"}]},{"url":"#continuous","title":"Continuous","items":[{"url":"#gaussian","title":"Gaussian"},{"url":"#uniform","title":"Uniform"},{"url":"#chi-square","title":"Chi-square"},{"url":"#f-distribution","title":"F-distribution"},{"url":"#exponential","title":"Exponential"},{"url":"#cauchy","title":"Cauchy"},{"url":"#gamma","title":"Gamma"},{"url":"#beta","title":"Beta"}]},{"url":"#next-step","title":"Next step"},{"url":"#recommended-reading","title":"Recommended reading"}]},"fields":{"slug":"/docs/18/03/2021/LearningPath-Statistical-Modeling-1","readingTime":{"text":"20 min read"},"slugOrigin":"/2021-03-18-LearningPath-Statistical-Modeling-1/"},"frontmatter":{"type":"docs","title":"Probability Distributions","date":"18 March 2021","description":"Statistical Modeling Part 1 - In this chapter we will be exploring probability distributions by variable types.","tag":null,"category":null,"featured":null,"thumbnail":null,"author":[{"name":"Dataviz Team","avatar":{"childImageSharp":{"gatsbyImageData":{"layout":"fullWidth","backgroundColor":"#f8f8f8","images":{"fallback":{"src":"/static/871859109b0659b0d6a48ae540cb439e/780cc/dataviz.png","srcSet":"/static/871859109b0659b0d6a48ae540cb439e/780cc/dataviz.png 214w","sizes":"100vw"},"sources":[{"srcSet":"/static/871859109b0659b0d6a48ae540cb439e/6c5cc/dataviz.webp 214w","type":"image/webp","sizes":"100vw"}]},"width":1,"height":0.9158878504672897}}}},{"name":"Jean Russell","avatar":{"childImageSharp":{"gatsbyImageData":{"layout":"fullWidth","backgroundColor":"#e8e8e8","images":{"fallback":{"src":"/static/0241dc4c544ec54fee0c378b40ca6bc6/0be83/default.png","srcSet":"/static/0241dc4c544ec54fee0c378b40ca6bc6/f054e/default.png 750w,\n/static/0241dc4c544ec54fee0c378b40ca6bc6/ae1c8/default.png 1080w,\n/static/0241dc4c544ec54fee0c378b40ca6bc6/0be83/default.png 1280w","sizes":"100vw"},"sources":[{"srcSet":"/static/0241dc4c544ec54fee0c378b40ca6bc6/4f03f/default.webp 750w,\n/static/0241dc4c544ec54fee0c378b40ca6bc6/4f506/default.webp 1080w,\n/static/0241dc4c544ec54fee0c378b40ca6bc6/9e21f/default.webp 1280w","type":"image/webp","sizes":"100vw"}]},"width":1,"height":1}}}}],"disableTOC":null,"d3":null}}},"pageContext":{"id":"87c8a6e1-1dc9-5a25-a64b-c406a3289606","slug":"/docs/18/03/2021/LearningPath-Statistical-Modeling-1","prev":{"node":{"id":"e22e0478-5c30-5fcc-a5ba-f865e170f1f5","fields":{"slug":"/docs/18/03/2021/LearningPath-Statistical-Modeling-2"},"frontmatter":{"template":null,"title":"Sampling","date":"Thursday 18th March 2021","category":null,"tag":null,"d3":null,"type":"docs","published":null}}},"next":{"node":{"id":"ef9a6215-7d72-56f5-a9d9-1b0ba1c32b4e","fields":{"slug":"/docs/18/03/2021/LearningPath-Statistical-Modeling-2-non-random-sampling"},"frontmatter":{"template":null,"title":"Non-random sampling","date":"Thursday 18th March 2021","category":null,"tag":null,"d3":null,"type":"docs","published":null}}}}},
    "staticQueryHashes": ["160810946","3815917638","3976606562"]}